comments,N,lang,comment_in_english
"꼴레뜨, 친절한 그녀에게 감사합니다
처음 가 본 프랑스 여행은 그녀 덕분에 너무나 행복했습니다
넓은 집, 깔끔한 환경, 편리한 교통, 아늑한 방과 주방까지 내어주는 모든것이 완벽한 집이었습니다.

파리 여행을 계획하신다면 추천드립니다

지하철 강베타역은 어느지역을 가든 편한 위치였고 버스도 집앞에 있어서 나비고만 구입하신다면 교통도 문제 없습니다!
오히려 도심보다 더 좋았습니다

꼴레뜨. 고마워요~~❤️❤️",1,estonian,"Colle, a friendly thanks to her. 
First the travel to France thanks to her too happy. 
Spacious house, neat environment, convenient transportation, cozy room and the kitchen, and my very all it the perfect home. 

Paris plan to travel to if you recommend. 

Metro Gambetta area is any area to the garden location was the bus home in front of the butterfly and only purchase if you have transportation, no problem! 
Rather, the city was better than. 

Colle down. Thank you~~❤girl❤this girl"
Must book.,1,estonian,Must book.
"非常好的地理位置,靠近市政厅和巴黎圣母院,步行5min内有地铁｡设施齐备,环境舒适,非常适合在巴黎旅行!",1,estonian,"Very good location,close to City Hall and Notre-Dame Cathedral,a walk within 5min with the metro area. Well-equipped,comfortable environment,very suitable for the Paris trip!"
"늦은 시간에 체크인 했음에도 너무 친절하게 맞이해 주셨어요.
숙소는 사진이랑 다른점을 찾을 수 없을 정도로 너무 깨끗하고 감각적으로 잘 꾸며져 있었습니다.
파리에서 지내는 동안 테라스에서 에펠탑을 보면서 쉬는 시간이 제일 좋았어요
^^
부족함 없이 내 집 처럼 편한한 여행 즐길 수 있게 해주셔서 감사합니다.
파리에 다시 가게 된다면 꼭 다시 갈꺼에요!",1,estonian,"Late check in was also so kind to me.
Place a photo with other point can't find too clean and sensual as well decorated.
In Paris, while on the terrace of the Eiffel Tower while looking at the rest time the best.
^^
Is my house like a comfortable trip you can enjoy.
Paris in the place!"
David est très sympa.,1,estonian,David is very nice.
Tout est ok!!,1,estonian,Everything is ok!!
"All good, 
Thanks Celine",1,estonian,"All good, 
Thanks Celine"
Tout est ok,3,estonian,Everything is ok
"이 곳에서 삼일간 지냈습니다. 공항에서 숙소까지 지하철로 한시간정도 걸려서 멀다고 생각했는데 막상 도착하고나니, 집이 너무 마음에 들었습니다 ! 또 호스트께서 지도에 직접 맛집을 표시해 놓은것을 보고 감동받았습니다. 파리 중심가까지 가려면 40분정도가 걸리지만 일정이 끝나고 돌아오는 발걸음은 굉장히 가벼웠습니다. 이 곳은 아늑하고, 따뜻하고, 편안했습니다. 다음에도 파리에 온다면 한 번 더 묵고 싶습니다 ",1,estonian,"This place in three days time. The hostel from the airport up to one hour subway takes away from Thought film arrives and the house, too ! Or the host with the map directly to the restaurants to display to the place to see it and impressed. The heart of Paris, close to the 40 minutes it takes, but the schedule ends and the back foot is very light. This place is cozy, warm, and comfortable. Then in comes once more want to stay. "
"Alexandre의 숙소는 굉장히 만족스러웠습니다. 먼저 위치가 굉장히 좋습니다. 걸어서 루브르에 10분이면 도착하고 노틀담 성당 등도 15분 정도면 걸어서 도착했던 것 같구요. RER역에서도 걸어서 15분 이내의 거리라 샤를드골 공항에서 오기도 편합니다.

번화가에 위치해있어서 밤12시까지고 사람들이 밖에 나와 술 마시고 하는 분위기고 치안도 좋습니다.

숙소는 아주 넓지는 않고 조그만 거실과 침실 하나가 있는 깔끔하고 아늑한 분위기입니다. 3층?인데 엘레베이터가 없었지만 크게 불편하지는 않았습니다.

다시 파리에 가면 또 여기서 묵고 싶습니다.",1,estonian,"Alexandre's place is very satisfying. First the location is very good. Walk to the Louvre in 10 minutes and the Notre Dame Cathedral is also 15 minutes walk from had arrived. RER station walk from 15 minute as Charles de Gaulle airport coming from the room....

Place in until 12 at night and people go out and drink and atmosphere and policing.

The hostel is very wide, not only living room and bedroom one has a neat and cozy atmosphere. The 3rd floor?But the Elevator there was no but to the.

Go back to Paris or stay here."
volveríamos sin duda.,1,estonian,we would return without a doubt.
ja,1,estonian,and
"위치는 좋아요! RER C타고 내리면 바로앞이 숙소예요. 창문 열면 센강이 보이고 집앞에 오르세 미술관이예요. 루브르 박물관, 튈트리, 바토무슈 다 가까움. 에펠탑은 걸어서 30분? 정도. 내 방 말고는 다 공용. 화장실도 공용으로 써야한다는 불편함이 있고 방문 열쇠도 없고 창문도 꽉 안닫혀서 바람 다 들어와서 추움. 더 조은데 차자보고 엄쓰면 여기도 괜츈. 갈꼬라면 슈건 챙겨가세여. 있긴 있는데 다 큰거 뿌니고 쮭쮭함. 아 글고 쥬말밤마다 위ㅅ층에서 쿵쿵 띄면서 퐈튀했었음. 근데 피곤해서 걍 뻣음",1,estonian,"The location is great! RER C ride as well on the front of the hostel. The window opens to the Seine River and set in front of the Orsay Museum. The Louvre, the Tuileries, the bar-no issues then. The Eiffel Tower is within 30 minutes? So. My horse and the public. Toilets public, you have to write is and visit key and Windows tight swing out in the wind and cold. More is full of information and indentation here good fortune. Go to the corner of your eye if Super health pack. Are you the big or the roots and 쮭쮭. Art glass and jewelry really balm for my floor in the stomp out in the second Charles. I tired, I'm stiff the next"
jolie et bonne située,1,estonian,nice and good located
"숙소 아늑하고 깔끔합니다! 위치도 rer역, 메트로역, 버스정거장 다 가까워요. 근처에 식료품점이랑 코인세탁소도 있어요. 침대위에 수건이랑 세면도구 세팅되어있는게 마치 호텔같았어요. 무엇보다 호스트가 친절하고 호스트가 부득이하게 파리에 없었는데 대신에 체크인해준 친구분도 친절했어요. 저희 파리 도착시간이 너무 일러서 부탁드렸더니 얼리체크인도 해주셔서 편하기 쉬고 여행할 수 있었습니다.",1,estonian,"Stay cozy and neat. Location rer station, Metro Station, bus stops just close. Near grocery store, restaurant, coin Laundry. On the bed, and towels lovely toiletries set are to the hotel. Than what the host is friendly and the host is out in Paris, there was no update instead of check-in to your friends also friendly. Our Paris arrival time too, but in favor, I will up that in to and was able to travel."
Tolle Lage!,1,estonian,Great Location!
"位置非常好!走路去拉法葉7分鐘,羅浮宮跟瑪德蓮區都只要15分鐘,附近很多地鐵站,巷口斜對面的餐廳好吃又不貴!家中環境很大,一個大客廳跟兩間房間,但小的房間建議可以多個衣櫃(本來的衣櫃被house keeper放東西,沒辦法用)這樣才能晾浴巾等衣物｡
    馬桶跟浴室分開,浴室很大,但淋浴的熱水不夠四個人連續洗,第一天晚上有兩個人洗冷水澡,詢問屋主才說洗三個人要等一小時才會有熱水.....但之後幾天有等一小時,水還是不夠熱,冬天需要嚴加注意｡廚房有烤麵包機跟熱水壺和洗碗機,如果家中任何電器有異常或破損請立刻跟屋主反應,以免有後續糾紛｡以價格跟地理位置和房間大小,這間很值得推薦!!",1,estonian,"Location is very good! Walk to Lafayette 7 minutes,the Louvre with the Madeleine district are just 15 minutes,near many subway station,alley diagonally opposite the restaurant is delicious and not expensive! The home environment is very large,a large living room with two rooms,but small rooms suggestions can be multiple wardrobe(originally the wardrobe was house keeper to put things,no way)so as to clothes towels and other Laundry areas.
The toilet with the bathroom separate,the bathroom was large,but shower hot water is not enough four successive washes,the first night there were two people wash a cold shower,ask the owner before said Wash three to one hour will have hot water..... But after a few days with like an hour,water is still not hot enough,the Winter need to strictly pay attention as well. The kitchen has a toaster with an electric kettle and a dishwasher,if the home of any electrical appliances there are abnormal or damaged, immediately tell the house the main reaction,in order to avoid subsequent disputes as well. To the price with the location and room size,this room is highly recommended!!"
"우선 위치가 에펠탑 근처여서 늦은시간에 에펠탑을 보러 나갔다 오기에 너무 좋았어요. 주변에 마트 및 식당들이 많아서 장보기에도 편리하고, 먹을 곳도 많았어요.  거의 씻고, 잠만자다시피 아파트를 사용해서 오래 머무른 적이 없어서 넘 아쉬웠어요. 방도 크고 4명이서 사용하기에 딱 좋았어요.
화장실 문고리, 옷장 문, 문고리 등 고장난 부분들이 있었지만, 전체적으로 사용하는데 큰 무리는 없었어요. 다음에 파리에 다시 가게 된다면 또 이용하고 싶습니다.!",1,estonian,"First the location is the Eiffel Tower near by in the late hours on the Eiffel Tower went..... too good. Around and many museums in the long view, even convenient, to eat, and many did. Almost a wash, but let you know to use the apartment for a long stay never more than a breath. The room and the 4 of use just good.
The bathroom door, closet door, door and as the broken parts were, but overall a great bunch. Then in Paris in or want to use."
elle est genial et amité.  bonne hôtesse,1,estonian,she is awesome and amité. good hostess
숙소 위치나 청결도 어느 하나 나쁠 것 없이 상쾌하고 햇빛도 잘 드는 방이라 아주 만족했습니다. 욕실도 깨끗합니다. 하나 결점이 있다면 4층에 위치하며 엘레베이터가 없어서 계단을 올라가야 한다는 점 정도 있습니다. 주변은 차이나타운이 있어 비교적 동양인이 많습니다. 또 주변에 있는 일식집은 중국인이 하지만 영어도 잘하고 교자가 맛있습니다!,1,estonian,"Location, clean and which one is bad without refreshing and the sunshine even better way very satisfied. Bathroom also clean. One drawback if you are on the 4th floor located with Elevator, no stairs to climb to that degree. Around Chinatown are relatively the same shape. Or around some Chinese, but English is also good and the gyoza is delicious!"
"很美的坊間很舒適的床,Renaud還貼心提供許多很新的旅遊手冊,地點非常的方便,離火車站真的非常近,也很好找｡公寓有電梯,因此行李的搬運也不是問題!",1,estonian,"Beautiful printing and very comfortable bed,Renaud also many facilities provide many new travel manual,the location is very convenient,from the train station is really very close,also very good looking as well. The apartment has an Elevator,so Luggage handling is not a problem!"
"Renaud 的房子地址位置很好,距里昂车站走路3min,很方便出行｡周围有很多营业到很晚的餐厅｡
房间很大,整洁,床非常舒服!!躺下不想起来｡
房主人超级好,很耐心等我们入住,沟通很及时,还给我们推荐了很多餐厅｡他是个很有创造力的艺术家吧,有出售自己的作品｡
这次行程很赶,没有更多的聊天,如果有机会回到巴黎,会考虑再入住的!

推荐给出门的情侣或者朋友!",1,estonian,"Renaud House address of location good,away from Gare de Lyon walk 3min,very convenient to travel well. Around a lot of business to very late in the restaurant area.
The room was large,clean,bed very comfortable!! Lie down and don't want to get up as well.
A homeowner who is super nice,very patient and so we stay,communication was timely,back to the we recommend a lot of restaurants and great views. He is a very creative artist,have sold their work area.
This trip was very Rush,no more chat,if the opportunity to return to Paris,consider a re-live!

Recommended to go out for a couple or friends!"
Best time ever!,1,estonian,Best time ever!
"位置很好｡就在卢浮宫附近｡步行大约10多分钟｡不过整栋楼只有三楼有厕所,每次要上厕所得跑上跑下｡还有木板有很大的声音｡晚上如果家人先睡,跑上跑下会有很大噪音｡距离三号线地铁只有1min｡附近有一堆地道的日餐和韩餐馆｡",1,estonian,"The location is very good as well. It is in the Louvre near the House. Walk about 10 more minutes home. But the whole building only the third floor has toilet,every time you want to on the toilet have to run up and down the room. There is also the boardwalk has a great sound, and great views. In the evening if the family to sleep,running up and down there will be a lot of noise as well. From the third subway line is only 1min area. Nearby there is a bunch of authentic Japanese and Korean restaurants in the area."
"Varaus sujui joutuisasti ja luotettavasti. Asunto vastasi kuvausta ja paikka oli mukava. Vaikka asunto sijaitsi ravintolakadulla, oli asunto rauhallinen. Varustetaso oli hyvä ja siisti.
Kannattaa kuitenkin huomioida, että metrolta asuntoon oli 400m portaita ylöspäin eli ei heikkojalkaisille.",1,estonian,"The booking came quickly and reliably. The apartment matched the description and the place was nice. Although the apartment is a restaurant on the street, was the apartment quiet. The level of equipment was good and clean. 
Consider, however, that from the subway to the apartment was 400m up the ladder so no weak legs for daddy."
"숙소 위치가 정말 좋아요. 루브르도 가깝고 주변에 버스정류장, 지하철도 많고 쇼핑센터도 있어요. 바로 앞에는 음식점 옆에는 마트 주위에 한인마트 코인세탁소 모두 걸어서 갈 수 있는 거리에 있어요! 방 크기는 충분했고 깔끔하고 히터도 따뜻하고 좋았어요. 다만 방음이 잘 안돼서 윗집이 맨날 파티하고 떠드는 바람에 좀 시끄럽기도 하고 세면대가 너무 작아 세면 용도는 아닌 것 같고 딱 손 씻을 정도 크기? 여서 별 4개를 주었으나 집은 진~~~짜 좋았어요!",1,estonian,"Hostel location is really good. The Louvre is also close to the bus station, subway and shopping center. Right in front of the food store next to the Mart around the point for coin laundries, all within walking distance! Room size was sufficient and clean, and the heater is also warm and was great. Just how well the newbie top collection of the top Day party and left in the wind a little noisy and the sink is too small the purpose is and just hand wash the size? From 4 stars to was the house is true~~~squeeze was great!"
"急なお願いやﾄﾗﾌﾞﾙにも優しく対処してくれました｡家ももちろん綺麗で過ごしやすく､Benjamin夫婦の人柄もとても良かったです｡
駅近でどこへ行くにも地下鉄で便利でした｡ﾊﾟﾘに来る時はまた利用したいです｡本当にありがとうございました!",1,estonian,"Steep please and cant live shooter Edition gives the full experience to gently deal with it in it. The house is of course clean and comfortable well Benjamin the personality of the couple was also very good in a can.
Located near a train station so access to Metro is convenient and fun! Pattern I downloaded to come when it was working. Thank you very much for your kind response!"
Mohamed est tres aimable.,1,estonian,Mohamed is very kind.
루브르 박물관과 가까워서 넘 편했어요. 밤에 산책가기도 넘 좋구요~ 현대건축이나 현대미술 좋아하시면 주변에 있는 퐁피듀센터 강추합니다. 사진보다 집이 더 넓었어요. 욕실도 2개라 편했구요. 택시만 타고 다녔지만 바로 앞에 버스정류장도 있도 근처에 지하철역도 있어 편할거같아요~ 다만 오래된 건물이다 보니 계단에선 오래된 나무 냄새가 좀 나요~ 집 내부에선 전혀 안나구요!,1,estonian,"The Louvre Museum and close to more comfortable. Walking at night is also a good idea. modern architecture or modern art like you around Pont Philadelphia Education Center. Photos than the house more spacious. Bathroom 2 online. Taxi, but the ride went but at you also near a subway station, guests can also be like~ just an old building. the stairs in the old wooden smell.~ inside the house at all Anna!"
"집이 매우 깨끗하고 좋았습니다. 위치는 치안이 매우 좋은 위치고 근처에 마트가 매우 많고, 지하철역도 매우 가까워서 관광지 돌아다니기 매우 편했습니다. 에펠탑과 가까운 거리여서 밤에 심심할때마다 나가서 화이트 에펠탑을 보실수 있습니다. 침대도 2층 2인침대와 2인 소파베드가 있는데 매우 깨끗하고 넓고 좋았습니다. 호스트분도 매우 친절하시고 영어를 잘하셔서 의사소통에 문제가 전혀 없었습니다. 다르미안 형 사랑해요!",1,estonian,"The house is very clean and good. Location, security, very good location and near the gate is very large, and the subway station is also very close to tour around it is very comfortable. The Eiffel Tower and close by at night in the heart whenever I'm in the White Eiffel Tower. Beds 2 Floor 2 bed and 2 sofa beds there is a spacious and very clean and good. The host also very friendly and speak English well, so communication in not a problem at all. Different in Type I love!"
Muy agradable lugar. Camille es muy amable.,1,estonian,Very nice place. Camille is very friendly.
모든 장소 청소가 잘 되어있고 침구도 전부 세탁하여 바꿔주시는거 눈으로 확인했습니다. 수건도 충분했구요. 침대하나가 소파베드라 걱정했는데 매트리스가 생각보다 편해서 편안하게 잘 잤습니다. 주변에 슈퍼도 두개나 있고 무엇보다 조용해서 좋았어요. 밤비행기탄다고 짐도 맡아주셔서 마지막날까지 편안하게 잘 놀다 가네요. 집은 오래되었지만 파리 숙소어딜가도 다 그렇더라고요. 호스트도 친절하십니다. 가성비 최고의 숙소! 추천합니다,1,estonian,"All cleaning is done and bedding from Laundry to replace or check by eye. A towel is sufficient. Bed or sofa bed as I was worried the mattress think more comfortable comfortable and slept well. Around Super Or and What than using. Night flight to Istanbul, and Jim also officiated at the last day to play well. The house is old but Paris stay, even the treadmill is also so. The host is also friendly. With the best of facilities! Recommended."
"Kevin 在我們的入住時間剛好不在城裏,但仍然很親切的給予任何疑慮上的協助,房子的位置非常棒,附近有公共自行車系統,對於巴黎個景點間的移動非常方便!區裏的市集也非常方便購得生活所需｡推薦給大家!",1,estonian,"Kevin in our check-in time is just not in the city inside,but still it'll give any doubts on the assistance,the location of the house is great,close to public bike system,for Paris, a city between the mobile very convenient! Area inside the market is also very conveniently purchased living room. Recommend it to everyone!"
"여행하기 정말 좋은 곳에 위치하고 있는 숙소입니다!
Maud는 깨끗하고 안락한 공간뿐만 아니라 기분좋은 에너지로 우리 여행을 더욱 즐겁고 행복하게 해주었습니다.
파리에 다시간다면 꼭 다시 방문하고싶은 숙소입니다! 추천추천!!",1,estonian,"Here, a really good Ryokan. 
Maud is a clean and comfortable space as well as the feel-good energy into our trip more enjoyable and happy. 
Paris in the time to come back to visit me and stay. Recommendation recommendation!!"
숙소 정말 마음에 들었습니다. 위치도 개선문과 가까워 좋았고 집안이 굉장히 깨끗해 놀랐어요. 호스트도 친절한 설명과 함께 잘 안내해주었고 피드백도 바로 주셔서 무척 편했습니다. 귀국행 시간이 늦어 체크아웃을 늦게 해야했는데 바로 연락이 와 가능하다고 해주셔서 너무 고마웠어요.ㅠㅠ 다음에 또 파리에 묵게 된다면 꼭 이곳에서 다시 지내고 싶어요!,1,estonian,"Stay, really. The location is also private and nice and the house very clean and was so surprised. The host is also friendly with explanations Well Guide to and feedback directly from Google. The time is late, a late check-out you have had contact with the possible that Your was.ㅠㅠ then in Paris staying at if you come here again do you want to spend!"
Great views. Fab little pied à terre!,1,estonian,Great views. Fab little pied à terre!
"房东很热心地在路边等候我们,带我们进去车库,仔细介绍了房子的使用事项｡真的如房东所说屋顶平台的风景是一个天堂,能俯瞰巴黎城区,包括埃菲尔铁塔!房间设备也很赞!我们在巴黎度过了愉快的两天!楼下还有lidl超市很方便｡房东还很仔细地写了说明书｡",1,estonian,"The landlord is very keen on the roadside waiting for us,with us in the garage,carefully describes the house using the matter available. Really like the landlord said the roof platform of the train is a Paradise,overlooking the Paris urban area,including the Eiffel Tower! The room equipment is also very good! We're in Paris to spend a pleasant two days! Downstairs there is lidl supermarket very convenient location. The landlord is also very carefully written specification area."
"位置实在是太太太棒了,入住非常便捷!就在交通枢纽les halles那一站,出门斜对面就是地铁站入口,很多线路可以直接乘坐,房子位于商业中心,附近有超市还有有很多餐馆,即使晚上11点多回来路上也很热闹很安全,房间很安静,不过在三楼,楼梯稍窄,拎大行李箱上下楼时要花点力气~房东很帅,人也很好!",1,estonian,"The location is really Mrs. fantastic,stay very convenient! In the transportation hub of les halles that station,go diagonally opposite is the metro station entrance,many lines can be directly much,the house is located in the business center,near supermarket and many restaurants,even night 11 points more back on the road is also very lively very safe,the room was quiet,but on the third floor,the stairs are slightly narrow,carrying a large suitcase up and down the floor when you want to take the effort~the landlord is very handsome,people is also very good!"
"设施齐全,房间干净｡guest manager回复消息很快,房东很友好｡",1,estonian,"设施齐全,房间干净｡guest manager回复消息很快,房东很友好｡"
