comments,N,lang,en-en,comments
"Un grand Merci à Ada...Pour son accueil chaleureux, sa (Website hidden by Airbnb) bonne humeur !. 
Ton appréciation..Ada .. me touche vraiment beaucoup. Tu es pour moi..également une Amie..! A très bientôt..Ada..! ",1,french,fr-en,"A big Thank you to Ada...For her warm welcome, her (Website hidden by Airbnb) good mood !. 
Your appreciation..Ada .. really touches me a lot. You are for me..also a Friend..! Very soon..Ada..! "
"Nous avons été accueillies avec sympathie. Ada est vraiment très attentive, respectueuse. Si un jour nous devons revenir , nous n'hésiterons pas à lui demander  si la chambre est libre.",1,french,fr-en,"We were greeted with sympathy. Ada is very attentive, respectful. If one day we need to go back , we will not hesitate to ask if the room is free."
Logement vraiment très sympas ! Très simple d accès depuis la Gare de Lyon ou d Austerlitz je conseil aux personnes souhaitant découvrir Paris !,1,french,fr-en,Housing really very nice ! Very easy access from the Gare de Lyon and d'austerlitz I advice to people wishing to discover Paris !
"Votre appartement ne correspond pas à ce que vous proposez sur votre site, l'Internet ne fonctionne pas, il était très sale quand nous sommes arrivés, les lits n'étaient pas rentrés, le canapé-lit dans la chambre était dégoûtante. mais d'après ce que j'ai vu dans vos commentaires, vous êtes déjà habitué à le faire avec d'autres personnes, mais je vais être la dernière, car vous prennent les mesures appropriées à ce problème. Je veux que les factures des dommages que vous avez dit et je vais aller avec un professionnel dans le domaine, dans tous les lieux où les notes ont été prises pour m'en informer. J'attends une solution le plus vite possible Merci

Rafael Fernandez",1,french,fr-en,"Your apartment does not match what you offer on your site, the Internet doesn't work, it was very dirty when we arrived, the beds were not returned, the sofa-bed in the room was disgusting. but from what I have seen in your comments, you are already accustomed to doing with other people, but I'll be the last one, because you are taking the appropriate measures to this problem. I want the invoices for the damage as you said and I'm going to go with a professional in the field, in all the places where the notes were taken to inform me. I'm waiting for a solution as soon as possible Thank you

Rafael Fernandez"
"L'appartement de Marion est très joli, épuré et propre. 
Nous nous y sommes senties très bien. La location était idéale pour nous, à 2 pas de notre showroom. 
",1,french,fr-en,"The apartment of Marion is very pretty, sleek, and clean. 
We felt very well. The rental was ideal for us, 2 not of our showroom. 
"
Très bel appartement dans un des meilleurs quartiers parisiens. Rien à dire niveau propreté accueille et communication. Juste parfait !,1,french,fr-en,Very nice apartment in one of the best areas in paris. Nothing to say level cleanliness welcomes and communication. Just perfect !
"Agréable appartement situé à proximité de la place des Vosges, ou il est possible de se rendre à pied. Un peu plus loin accès aux quai de Seine.
Nous avons trouvé à nous garer dans une rue adjacente, mais en semaine le tarif est élevé (compter 6 euros les deux heures). Gratuit la nuit et le dimanche. Il existe sans doute des parkings mais nous n’avons pas cherché.",1,french,fr-en,"Nice apartment located near the place des Vosges, or it is possible to walk to. A little further access to the quai of the Seine.
We found to park in an adjacent street, but in a week the fee is high (around 6 euros for two hours). Free at night and Sunday. Doubtless there are parking lots, but we didn't try."
"La semaine passée chez Nicolas s’est parfaitement déroulée : l’appartement est conforme à la description et aux photos présents sur l’annonce, le quartier Marx Dormoy s’est révélé particulièrement sympathique et m’a occupé plusieurs soirées (Café éphémère Grand Train, café Lomi, terrasse des Petites Gouttes…), enfin Nicolas s’est révélé disponible et de bon conseil (bonnes adresses dans le quartier, idées de sorties, etc.). Le lit en mezzanine était très confortable mais pas sûr qu’il convienne à des voyageurs à mobilité réduite notamment… Bref, je recommande son appartement et reviendrai certainement une prochaine fois lors d’un nouveau déplacement professionnel!",1,french,fr-en,"Last week at the Nicolas went perfectly well : the apartment conforms to the description and photos present on the ad, the neighborhood, Marx Dormoy was particularly friendly and has occupied me several evenings (Coffee ephemeral Great Train, café Lomi, a terrace of Small Drops...), and finally Nicolas is revealed to be available and of good advice (good addresses in the neighborhood, ideas for outings, etc). The bed was very comfortable but not sure that it is suitable for travellers with reduced mobility, in particular... in Short, I recommend his apartment and will certainly come back next time during another business trip!"
"2ème séjour chez Nicolas, toujours aussi bien, l'appartement est comme annoncé, très propre et très bien équipé et bien placé. ",1,french,fr-en,"2nd stay at Nicolas, as well as, the apartment is as advertised, very clean and very well equipped and well positioned. "
"Accueil chaleureux de Nicolas. L'appartement est cosy, joliment décoré, à deux pas de Montmartre. Chez Nicolas, on se sent tout de suite chez soi. Très bonne adresse.",1,french,fr-en,"Warm welcome for Nicolas. The apartment is cosy, nicely decorated, two steps from Montmartre. In Nicolas, we feel immediately at home. Very good address."
"Très propre et conforme à la description. 
Au pied du métro et proche du RER pour la gare du nord.",1,french,fr-en,"Very clean and conform to the description. 
At the foot of the metro and close to the RER to the gare du nord."
Le séjour s'est vraiment très bien déroulé. Et notre hôte était exceptionnellement exceptionnel et très courtois.,1,french,fr-en,The stay was really very nice. And our host was exceptionally exceptional and very courteous.
"Appartement très propre, salle de bain toute neuve.
Les hôtes sont très sympas et disponibles pour tout renseignement.",1,french,fr-en,"Apartment very clean, bathroom brand new.
The hosts are very nice and available for any information."
"Nous n’avons pas rencontré personnellement Nicolas, mais il a été très réactif et disponible avant et tout au long de notre séjour. Il a été très arrangeant avec nous concernant l’heure du Check-in, chose que nous avons beaucoup apprécié. L’appartement est conforme aux photos, et est décoré avec soin. Notre séjour à Paris s’est très bien passé dans ce Airbnb : l’appartement est très bien équipé. 
Petit bémol concernant l’emplacement de l’appartement, le quartier est assez mal fréquenté. Cependant il est situé à deux pas du métro et des transports en commun, ce qui nous a permis de rejoindre les centres touristiques de Paris très facilement. 
Merci encore une fois à Nicolas et sa mère pour leur accueil et leur réactivité. Nous avons apprécié notre séjour chez Nicolas :)",1,french,fr-en,"We have not personally met Nicolas, but he was very reactive and available before and throughout our stay. He has been very accommodating with us regarding the time of Check-in, something that we appreciated a lot. The apartment is consistent with photos, and is decorated with care. Our stay in Paris went very well in this Airbnb : the apartment is very well equipped. 
Small downside on the location of the apartment, the neighborhood is pretty poorly attended. However, it is located close to the metro and public transportation, which allowed us to reach the tourist centers of Paris very easily. 
Thanks once again to Nicolas and his mother for their hospitality and their responsiveness. We enjoyed our stay at the Nicolas :)"
"Appartement conforme aux photos. Lieu facilement accessible en métro, qui relie en 30 min le centre de Paris. Hôtes toujours très disponibles. Je recommande !",1,french,fr-en,"Apartment complies with photos. Location easily accessible by subway, which connects in 30 min to the centre of Paris. Hosts always very available. I recommend !"
"Nicolas et Sébastien sont de très bons hôtes ! 
Ils ont été très arrangeants pour les horaires et ont laissé quelques adresses du coin. 
Appartement très bien situé et facile d’accès. 
Également très agréable d’y séjourner, lumineux et très bien équipé. 
Je recommande fortement !",1,french,fr-en,"Nicolas and Sebastien are very good hosts ! 
They were very accommodating for the timetable, and have left a few addresses from the corner. 
Apartment very well located and easy to access. 
Also very pleasant, luminous and very well equipped. 
I highly recommend it !"
"Un superbe accueil :-) Appartement idéalement situé, (conforme aux photos, dans un quartier vivant, avec tous les commerces nécessaires et les transports en bas de l'immeuble.
Allez y les yeux fermés!!!",1,french,fr-en,"A stunning home :-) Apartment ideally located (in accordance with photos, in a lively district, with all the necessary shops and transport at the bottom of the building.
Go there with your eyes closed!!!!!"
Super séjour dans un appartement astucieusement agencé pour tout confort (la literie du sofa est exceptionnelle) .Le quartier est super sympa  ( calme absolu et ambiance nocturne à proximité ! c'est le paradoxe réussi! )et les métros proches.Cédric en plus est très prévenant et disponible.,1,french,fr-en,"Super stay in an apartment artfully arranged for comfort (the bedding of the sofa is exceptional) .The neighborhood is super nice ( quiet and nightlife nearby ! it is the paradox of success! ), and the subways close.Cedric is very attentive and available."
"Nous avons eu un parfait séjour à Paris. L'appartement était magnifiquement située, trés agréable et calme. Et Cédric et Hifa des hôtes parfaits. La communication, ses récomendations, l'accueil, tout simplement parfait.
Merci beacoup pour vôtre accueil, nous nous sommes sentis comme chez nous!
",1,french,fr-en,"We had a perfect stay in Paris. The apartment was beautifully located, very nice and quiet. And Cedric and Hifa hosts perfect. The communication, its récomendations, the home, just perfect.
Thank you very much for your hospitality, we felt like home!
"
"Très bon accueil, Hafi (une amie de Cédric) m'a rapidement expliqué  le fonctionnement du studio. Tout est à disposition, serviettes de bain, café, thé etc… ce qui est très agréable. Le logement est exactement comme décrit, et le quartier est très sympathique, des balades sympas sont tout de suite accessibles !",1,french,fr-en,"Very good reception, Hafi (a friend of Cedric) I was quickly explained the operation of the studio. Everything is available, towels, coffee, tea, etc... which is very nice. The accommodation is exactly as described, and the neighborhood is very friendly, walks nice are immediately accessible !"
"Chouette lieu, original et inventif, poutres et tomettes, 
Très, très chouette localisation (Carreau du Temple et ses si jolies petites rues adjacentes) 
Les festifs nocturnes du quartier s’entendent il est vrai, mais 0 bruit de moteur ! ce qui est un bonheur et une rareté à Paris. 
Chouette accueil de Cédric sur place. On sent qu’il aime le lieu qu’il a crée.
Et les 5 étages se font sans problème dans un bien bel escalier aux marches toutes douces et patinées par le temps.",1,french,fr-en,"Nice place, original and inventive, beams and floor-tiles, 
Very, very nice location (Tile of the Temple and its lovely small streets) and adjacent 
The festive night in the neighborhood agree it is true, but 0 engine noise ! this is a joy and a rarity in Paris. 
Owl home of Cedric on the spot. One feels that he loves the place he has created.
And the 5 floors are no problem in a well staircase of steps, all soft and worn by time."
Premier séjour chez Cédric. Tout s'est super bien passé.  A refaire sans hesiter,1,french,fr-en,First stay with Cedric. Everything went very well. A remake without hesiter
"Très bon accueil. Cédric a été très aimable et arrangeant. L’appartement est bien placé, ensoleillé et au calme. La literie est particulièrement agréable.",1,french,fr-en,"Very good reception. Cedric was very kind and accommodating. The apartment is well located, sunny and quiet. The bedding is especially nice."
"Super accueil , l'appartement est tel que sur les photos,spacieux,propre,j'ai passé un excellent weekend dans cet appartment, je vous conseil de réserver cet appartement sans hésiter.",1,french,fr-en,"Excellent host , apartment is as on the pictures,spacious,clean,I spent an excellent weekend in this apartment, I advise you to book this apartment without hesitation."
Super appartement très bien situé! Marion toujours très disponible! Nous avons passé un excellent séjour. A' recommander vivement!,1,french,fr-en,Super apartment very well located! Marion always very available! We had a great stay. A' recommend highly!
Magnifique Appartement dans un beau quartier calme. Just Wonderful,1,french,fr-en,Beautiful Apartment in a beautiful quiet neighborhood. Just Wonderful
Superbe appartement ! Correspond parfaitement à la description ! L'emplacement est incroyable avec tout à proximité...Marion a été très disponible pour nous aider.,1,french,fr-en,Superb apartment ! Corresponds perfectly to the description ! The location is amazing with everything nearby...Marion has been very available to help us.
"Parfait! L'appartement de Marion est magnifique, tout est très bien organisé, rangé et Marion est une personne très disponible. Nous recommandons vivement son appartement !",1,french,fr-en,"Perfect! The apartment of Marion is beautiful, everything is very well organized, tidy, and Marion is a person very available. We strongly recommend his apartment !"
Très bel appartement. Décoré avec soin. Très calme. Marion a été très arrangeante sur les horaires d'arrivée et de départ. Un endroit que je conseillerai pour un week-end à Paris.,1,french,fr-en,Very nice apartment. Decorated with care. Very quiet. Marion was very arrangeante on the schedules of arrival and departure. A place that I will recommend it for a weekend in Paris.
"Bien que je n'ai pas eu la chance de rencontrer Marion, j'ai passé un excellent weekend dans son appartement. Tout était parfait et fidèle aux photos. 
Je le conseille vivement ! 

",1,french,fr-en,"Although I have not had the chance to meet Marion, I spent an excellent weekend in his apartment. Everything was perfect and true to the photos. 
I highly recommend ! 

"
Rien à redire. Accueil et lieu parfait !,1,french,fr-en,Nothing to complain about. Home and perfect location !
"Appartement trés bien situé au sud de Montmarte . Quartier sympa et animé avec plein de commerces ,restaurants et bars mais la cité Condorcet est au calme.
4eme étage avec ascenseur(",1,french,fr-en,"Apartment very well located in the south of Montmarte . Neighborhood nice and lively with lots of shops ,restaurants and bars but the town of Condorcet is quiet.
4th floor with elevator("
"Marion est très arrangeante. L Appartement est très bien situé et très calme, il mériterait un petit rafraîchissement",1,french,fr-en,"Marion is very arrangeante. The Apartment is very well located and very quiet, it deserves a little refreshment"
Nous avons eu le plaisir d'un séjour à Joseph pour notre vacances de noces. C'est très joli! Emplacement idéal pour visiter à Paris. L'appartement est incroyablement propre -- et parfait ! ! !  Merci beaucoup!,1,french,fr-en,We have had the pleasure of a stay at Joseph for our holiday wedding. This is very nice! Ideal location to visit Paris. The apartment is incredibly clean -- and perfect ! ! ! Thank you very much!
"Le studio soleil est parfaitement situé dans le quartier du marais. Aménagement, service, propreté, calme, luminosité, l accueil de Pascal, tout ceci a contribuer au bon déroulement de mon séjour (3semaines) 
Je vous recommande cet endroit pour un court ou long séjour.
",1,french,fr-en,"The studio sun is perfectly situated in the marais district. Planning, service, cleanliness, quiet, brightness, the home of Pascal, all of this contribute to the success of my stay (3weeks) 
I would recommend this place for a short or long stay.
"
"Appartement très  bien situé, propre et confortable! Pascal a également été très sympathique! ",1,french,fr-en,"Apartment very well located, clean and comfortable! Pascal was also very friendly! "
"Nous avons adoré notre séjour d'une semaine dans cet appartement. La localisation était parfaite puisque nous aimons beaucoup Le Marais. À quelques minutes du métro c'était très facile de s'y rendre. Nous avons trouvé l'endroit tranquille et très propre avec tout ce dont nous avons besoin.
Pascal a été d'une grande gentillesse et ses suggestions resto superbe!!
Nous y retournerons!
",1,french,fr-en,"We loved our one week stay in this apartment. The location was perfect since we love The Marais. A few minutes from the metro it was very easy to get there. We found the place quiet and very clean with everything we need.
Pascal was very kind and his suggestions restaurant superb!!
We will stay there again!
"
"On est immédiatement mis à l'aise dans ce magnifique appartement. La vue est splendide, le quartier est idéal, avec toutes les commodités à deux pas, et le centre de Paris à quelques stations de métro.
On reviendra !",1,french,fr-en,"One is immediately put at ease in this beautiful apartment. The view is beautiful, the neighborhood is ideal, with all the amenities to two steps, and the centre of Paris a few metro stations.
We will come back !"
"Nous avons passé un excellent séjour à Paris. L'appartement est superbe la vue exceptionnelle. Sophie nous a chaleureusement accueilli et conseillé pour ce séjour où aucun détail dans l accueil n a été oublié.
Je recommande cet appartement",1,french,fr-en,"We had a great stay in Paris. The apartment is beautiful the view outstanding. Sophie we were warmly welcomed and advised to stay where no detail in the home n has been forgotten.
I recommend this apartment"
"Bonjour,
Nous avons vraiment passé un séjour idyllique! 
Nous fêtions notre 23ème année de mariage et l’appartement et la vue ont contribué à nous faire vivre de savoureux instants: que ce soit le matin au petit dej ou le soir au dîner cette fabuleuse terrasse nous a conquis .
L’appartement est superbe, l’ambiance et la déco sont top jusqu’aux choix des interrupteurs.
Nous recommandons vivement cet appartement pour une escapade parisienne 
Très cordialement 
Rémi et Chrystelle ",1,french,fr-en,"Hello,
We spent an idyllic stay! 
We were celebrating our 23rd year of marriage and the apartment and the view have helped us to live delicious moments: either in the morning at breakfast or in the evening at dinner in this fabulous terrace has overcome us .
The apartment is superb, the ambiance and the decor are top up to the choice of the switches.
We strongly recommend this apartment for a parisian escapade 
Very cordially 
Remi et Chrystelle "
"Situation idéale pour moi, ma fille résidant à côté. Hôte accueillant. J' y retournerai sûrement. Merci Valentina.",1,french,fr-en,"Ideal Situation for me, my daughter living next door. Hospitable host. J' will go back surely. Thank You Valentina."
Good location,114,french,en-en,Good location
"Les contacts internet  avec vale sont agréables . Elle envoie toutes les infos nécessaires rapidement et de facon complète. L accès a l appartement est simple, la chambre sympa et pratique et c est calme. Le quartier est proche de la tour eiffel donc magnifique, tres commercant et c est bien desservi par les transports en commun. 
Vale est chaleureuse et accueillante voire meme organisatrice de soirée ! 
Bravo vale , je conseille a tout ceux qui souhaite decouvrir cette belle partie de paris de venir y séjourner ",1,french,fr-en,"Contacts internet with vale are pleasant . It sends all the info they needed quickly and so full. The access to the apartment is simple, the room pleasant and practical, and c is quiet. The neighborhood is close to the eiffel tower so beautiful, very little, and is well served by public transport. 
Vale is warm and inviting, or even organizing evening ! 
Bravo vale , I advise all those who wish to discover this beautiful part of paris to come and stay "
"Vale est très sympathique, discrète et facilement joignable. ",1,french,fr-en,"Vale is very friendly, discreet and easily reached. "
"Tout était impeccable, l'emplacement, organisation pour récupérer les clés, flexibilité pour partir à la fin du séjour etc sauf que l'appartement (et surtout ce qui importe, la salle de bain et la chambre) n'était pas propre! Donc si l'on est sensible à cela je ne recommande pas, sinon c'est une très bonne adresse!",1,french,fr-en,"Everything was impeccable, the location, organization, and to retrieve the key, flexibility to leave at the end of the stay etc except that the apartment (and especially what is important, the bathroom and the room) was not clean!!! So if one is sensitive to this I do not recommend, otherwise it is a very good address!"
Logement bien situé et calme.,2,french,fr-en,Apartment well located and quiet.
"Vale est une très bonne hôte : discrète, et présente si besoin. Je dois dire qu'elle s'est pliée en 4 pour que mon séjour se passe au mieux (elle m'a gardé mes bagages le dernier jour, ...) Bref... allez chez Vale, vous serez très bien reçu! En plus, l'appartement est très bien situé. C'est un vrai plus.",1,french,fr-en,"Vale is a very good host, unobtrusive, and presents if needed. I have to say that it is folded in 4 to make my stay the best (she kept my luggage on the last day, ...) in Short... go with Vale, you will be very well received! In addition, the apartment is very well located. It is a real plus."
Personne sympathique et discrète qui laisse une intimité à son hôte,1,french,fr-en,Person friendly and unobtrusive manner that leaves the privacy of his host
"Vale est vraiment une personne très accueillante. Arrivée à presque 1h du matin pour cause retard de train, elle m'attendait néanmoins et souriante! Le dialogue est toujours très facile avec elle. 
Son petit appartement est conforme à la description et parfaitement situé.",1,french,fr-en,"Vale is really a person very inviting. Arrival at nearly 1am in the morning due to train delay, she was waiting for me still, and smiling! The dialog is always very easy with it. 
His small apartment is conform to the description and perfectly located."
"Vale est très chaleureuse et sympathique. L'arrivée et le départ dans l'appartement ont été très faciles. Chambre très calme, bon rapport qualité/prix. Un ascenceur très petit mais suffisant et super important pour un 6ème étage. Merci",1,french,fr-en,"Vale is very warm and friendly. Arrival and departure in the apartment were very easy. Room very quiet, good price/quality ratio. Lift / elevator are very small but adequate and super important for a 6th floor. Thank you"
"L'accès au logement de Vale est aisé grâce aux consignes reçues juste avant mon arrivée (code d'accès et clef). Vale est sympa et disponible. Seul bémol, la propreté de la salle de bain.
Je recommande néanmoins e logement très bien placé au cœur de Paris.",1,french,fr-en,"The access to housing of Vale is easy thanks to the instructions received just before my arrival (access code, and key). Vale is nice and available. Only downside, the cleanliness of the bathroom.
I recommend, however, e housing very well placed in the heart of Paris."
"Nous avons apprécier la gentillesse et la disponibilité de Vale, ainsi que les informations qu'elle nous a données pour sortir et nous orienter. Cependant, nous aurions souhaiter que l'appartement ainsi que nos draps soit propre à notre arrivée. .. L'appartement de Vale est très bien situé, cela nous a permi d'optimiser notre week end.",1,french,fr-en,"We appreciate the kindness and the availability of Vale, as well as the information that she gave us to come out and direct us. However, we would wish that the apartment and our bed linen was clean at our arrival. .. The apartment Vale is very well situated, we are allowed to maximize our weekend."
très bien situé et Val est très gentille,1,french,fr-en,very well located and Val is very nice
tout était très bien,2,french,fr-en,everything was very well
"L'appartement de Vale est pratique, très bien situé et bien desservi par les transports. L'accueil et le séjour se sont faits sans difficulté : Vale est une hôte attentionnée, chaleureuse et amicale. Elle est aussi très réactive donc n'hésitez pas à la solliciter si besoin. Un bémol toutefois pour la propreté des parties communes, mais j'ai très bien dormi dans la chambre pendant les 3 nuits que j'y ai passé.",1,french,fr-en,"The apartment Vale is practical, very well located and well served by public transport. The welcome and the stay were made without difficulty : Vale is a host-considerate, warm and friendly. She is also very responsive so don't hesitate to ask if needed. A downside, however for the cleanliness of the common parts, but I slept very well in the room during the 3 nights that I have spent there."
Accueil impeccable de Val. L’emplacement est idéal au cœur de Paris. Tarif défiant toute concurrence.,1,french,fr-en,Impeccable welcome of Val. The location is ideal in the heart of Paris. Price defying any competition.
