comments,N,lang,en-en,comments
brochant역에서 매우 가깝고 근처에 큰 마트가 있어서 편리했습니다. 주요 관광지에 가려면 1번정도 환승해서 가야합니다.소파침대는 커서 2명이 쓰기에 크기가 좋았습니다.핟쥑뫈 바똳쪽이 푹 까라안쫬서 훠뤼도 같이 까롸안좌버리는줄...집들어갈뙈 안놰가 뿌뢍수어로 와서 뿌뢍수어 할줄 와는 원니가 엎었뚜면 지붸 못뚜러갈뻔헀어요. 벤자민이 일하는 중이라 벤자민의 친구가 대신 짐도 들어다주고 간단한 설명도 해줬습니다.꾼데 침구가 지붸대해 좔 모룬다고 붼좌민이 숼명해줄꼬뢧는데 붼자민 얼굴을 이일째봐뭬 겨우 봤눈데 붼자뮌 췽구가 열쉐가 옶쑤면 무늘못연다고 구래서 무늘 안좡갓는데 붼자ㅣㄴ이 올굴보자뫄좌 나뿐행동이라고 홍내둣이 말해쏘 어굴했쑹미다.4일쮀바뭬 뷍자뮈니 칭구가 솔명안해쭌거 뭘롸따구 짚에대해 쒈명해줬눈데 입밉 저눈 찝에서 뷸청괙이됀누낌을봐다뻐려찌요.,1,breton,ko-en,"Paris from the station is very close and near Big Mart there. The main attractions to go to 1 times the transfer to go.Sofa bed large 2 Write-In is a good size.Hardwood 쥑뫈 bar 똳 side hooked up during 쫬 from local Brussels also like how the mix of security followed that line...home they get 뙈 inside 놰 root 뢍 water with Root 뢍 water to the line and the circle are Lie was cricket, if 붸't cricket going to almost serve you. Benjamin work of Benjamin's friends instead load even heard of giving a simple description of me.Tout my bedding is 붸 to 좔 all deals and 붼 followed people 숼 by bar-tailed 뢧 I 붼 people in the face in this first look 뭬 barely saw the sight I 붼 who commune 췽 open Porsche is 옶 Jiangsu to the North Pond Nature..... and in the early days of Shijiazhuang'd they 붼 who ㅣㄴ this year face more black followed me as action and red throughout the Shoe to tell DS what the face was a fitness club.4 days 쮀 mobile 뭬 뷍 let Saumur. Ching is the solution described by Zun or what with a mix of hot straw for 쒈 to my sight, but believe me eye glasses in sweet Hall 괙 this latest soap should take care of..... glad to bracelets."
"Bonne chambre chez l'habitant, bon hôte.",1,breton,fr-en,"Good homestay, good host."
N'hésitez plus réservez,1,breton,fr-en,Do not hesitate any more book
"這次的住宿真的很棒,從CDG機場搭乘計程車只需要45分鐘以內的時間,住宿附近三分鐘步程處有公車可以抵達市中心,十分鐘內的步程包含了tram及metro,要到哪裡都很方便:房間很乾淨設備很齊全,雖然不大可是兩個人住起來很舒適方便｡
David人超好,我們提出的問題都可以幫助我們並且回復也很快速｡",1,breton,zh-en,"This accommodation is really great,from CDG airport by taxi only takes 45 minutes or less time,stay near three minutes walk of a bus can reach the city centre,ten minutes walk comprising of the tram and the metro,where to are very convenient:the room was very clean the equipment is very complete,though small, but two people living together very comfortable and convenient apartment.
David People super good,the issues we have raised can help us and reply is also very fast as well."
"房源的描述相对准确｡但是入住体验超级差!入住当天是个叫Victor的helper在那等我,这家伙做事不认真,说了是二十四号到结果他记成了是二十五号!到了后他带我们介绍房子这环ok｡然后走之前我要求提供多一套钥匙并把坏了的走廊灯修好,他答应了我第二天九点前会送到结果第二天在说好的时间没出现还一整天都找不到这个helper和房东｡第二天我是要拍婚纱照的,我父母是出去玩的,结果就被只有一套钥匙的事情搞到整天的行程都乱了!拍了一天的婚纱照累到不行冷到不行晚上还没热水洗澡!那一刻真的想死的心都有!灯泡还从天花板掉下来差点砸到人!跟房东反应然后房东和helper依然不回信息不回电话直至第三天才有反应｡房东说安排人来维修,明知道灯泡掉下来了还不带灯泡来修真是无脑!到离开那天,十一点要check out, 结果十一点邻居跑过来跟我说有人来维修大楼的电要关总闸,态度还恶劣｡说好修二十分钟结果到我们走的时候都没修好,然后就是我们提前五个三十公斤重的箱子下楼!出门时还看到那邻居根本就没关电!综上所述,沟通差,体验差,环境再好也没用!不会再考虑住这的了!",1,breton,zh-en,"Listing description is relatively accurate as well. But the check-in experience super poor! On the day of arrival is called the Victor of the helper in that I,this guy do not seriously,that is the twenty-fourth number to result his mind became is twenty-five! Got to after he took us introduce the house that the ring ok area. Then before we left I asked to provide more than a set of keys and put the broken hallway lights repaired,he promised me the next nine points before will be sent to the results the next day at agreed time no appear also all day can't find this helper and the landlord's. The next day I was going to shoot the wedding,my parents are out to play,the result is only a set of key things to day itinerary are a mess! Took a day of wedding tired. cold. evening still no hot water bath! That moment really want to die of heart have! The light bulb from the ceiling fell and almost hit people! Talk to the landlord of the reaction and then the landlord and the helper still does not reply the message not to call back until the third genius with the reaction area. The landlord said arrange people to repair,knowing that the light bulb fell off also without a bulb to fix a really no brain! To leave the that day,eleven to check out, the results of eleven neighbors came running to tell me someone to repair the building's electrical to turn off the total gate,attitude also bad areas. Good repair twenty minutes into our walk when they are not repaired,then we are ahead five to thirty kilograms of heavy boxes down the stairs! Go and also see that the neighbor didn't power off! In summary,to communicate the difference,experience the difference,the environment is again good also useless! Won't consider staying here!"
"一切是那么完美,这是我巴黎的家!we位置优越,交通便利,是非常hao de好的选择!感谢Eric,热情的接待!希望再次见面!",1,breton,zh-en,"Everything is so perfect,this is my Paris home! we position is superior,the transportation is convenient,is very hao de good choice! Thanks Eric,warm reception! Hope to meet again!"
"位置地點很好 很靠近metro
但實際上沒有自己的私人空間 就是在客廳睡 有點不自在 不介意的人才適合入住",1,breton,zh-en,"Location good very close to metro
But actually without your own private space is in the living room sleeping a little uncomfortable don't mind the talent for check-in"
"房子在离地铁一条街的位置,去哪很方便,可以走去卢浮宫,折叠小二层装饰得特别有格调,不过夏天晚上睡稍微有点闷,楼下酒吧不常开业但是开的时候会吵一夜,厨房设施一应俱全,美女房东Mooz人超好,住在客厅的另一个房间里平时互相不会打扰到,不仅回答旅游信息,在借东西和留行李方面都帮了大忙,我们现在还对狗狗nergal念念不忘太可爱了好吗,没有见过这么亲人的狗~巴黎之行选这里非常方便的",1,breton,zh-en,"House in from the subway, a street location,where is very convenient,can walk to the Louvre,folded small two layer decorated in a special style,though the summer night to sleep a little bit stuffy,the downstairs bar is not always opened but when will noisy of a night,kitchen facilities,beauty landlord Mooz people super good,live in the living room and another room usually with each other won't bother to,not only answer the tourist information,in to borrow something and left Luggage aspects are a big help,we are now also on the dog nergal obsessed too cute, okay?, not seen such a loved ones dog to stay in Paris selected here is very convenient"
"Perfekt für uns, näher am Gare du Nord ginge kaum. Unkompliziert, sauber, alles da, was man braucht. Merci vielmals!",1,breton,de-en,"Perfect for us, close to the Gare du Nord was a matter of hardly. Uncomplicated, clean, everything there that you need. Thanks very much!"
Perfect house!,1,english,en-en,Perfect house!
"ﾊﾟﾘに滞在したいが普通のﾎﾃﾙではつまらない､ﾊﾟﾘに住むような体験がしたい人におすすめします｡ｷｯﾁﾝなどｱﾒﾆﾃｨが充実し､滞在が始まれば快適なﾊﾟﾘ生活が楽しめます(洗濯機はありませんが)｡窓から見える景色はﾊﾟﾘ感満載です｡
南側の最寄駅Etienne Marcelの周りはﾊﾟﾘらしいｶﾌｪが立ち並び､ｼｮｯﾋﾟﾝｸﾞﾓｰﾙやﾎﾟﾝﾋﾟﾄﾞｩｾﾝﾀｰにも徒歩で行けます｡
ただし､北側の最寄駅Strasbourg Saint-Denisに行くときは､Rue Saint-Dennis通りは通らないことをおすすめおすすめします｡少し治安がわるい悪い感じで､歌舞伎町っぽいので｡",1,breton,ja-en,"Pattern I downloaded to want to stay ordinary Universal is uninteresting, too I try to zoom to the live experience is recommended for people who want time. The I check the settings such as soon softening WH location and stay there once you get started and comfortable ladder you can't download life is fun(the washing machine is not)｡ From the window the view is a panel I downloaded I Packed in a can.
On the South side of the station Etienne Marcel around the pattern I downloaded from the K frames and the Huntsman and G. Education gave me away I don't understand how to pack I I model e-mail and browse I don't understand how to pack away my work fine with the boots setting me am easy to walk on.
However, the North side of the station Strasbourg Saint-Denis when you go, on Rue Saint-Dennis Street Street and and recommend it. A little security is to feel bad, and the Kabukicho-ish of｡"
"ﾊﾟﾘの中心地で大変便利な場所にあります｡
ﾙｰﾌﾞﾙ､ﾏﾚ､ﾗﾌｧｲｴｯﾄは徒歩圏内にあります｡

一番近いﾒﾄﾛの駅は､3番線の Sentierですが､4番線 Les Hall, 8,9番のBonne Nouvelleも徒歩5分程でいけるため､主要観光地はﾒﾄﾛの乗り換え無しで行くことができます｡

ｱﾊﾟｰﾄは有名なﾓﾝﾄﾙｸﾞｲﾕ通りのすぐ近くにあります｡この通りには､商店街があり､新鮮な食材を手にいれることができ自炊したい方にも最適です｡ｽｰﾊﾟｰや薬局もあり､日用品やお土産を買うにも最適です｡

ｱﾊﾟｰﾄはｲﾒｰｼﾞ通りのﾊﾟﾘの屋根裏部屋で､雰囲気があります｡部屋は清潔に保たれていて､広さも3人には十分でした｡なによりﾊﾞｽﾀﾌﾞがあるので､日本の方にもおすすめです｡
滞在中は､けっこう自炊しましたが､不自由なく自炊できる設備が整っています｡

ﾎｽﾄのMarcも親切で､連絡も取りやすくﾄﾗﾌﾞﾙは全くありませんでした｡

全てにおいて素晴らしいｱﾊﾟｰﾄですが､唯一の欠点はｴﾚﾍﾞｰﾀｰ無し､5階にあることです｡
なれればなんてことはないですが､そこはあらかじめ認識する必要があります｡",1,breton,ja-en,"Bread and I try to zoom in the center of convenient place of departure.
Maybe shooter Edition gives the full experience､microphone level､live Bass-D makes it Engine times, thanks is within walking distance of departure.

The closest camera setting the mood of the station, on Line 3 of the Sentier, in line 4, Les Hall, 8,9 number of Bonne Nouvelle are also within 5 minutes if that, and the main attractions is the camera setting the mood of the ride with no can go on.

Like bread we Oh is famous fabric range setting spindle I I I User is in close proximity to in the vicinity. In this street, on shopping, and the freshest ingredients on hand that you can cook if you want also best possible. I frames compact parts and pharmacy and daily commodities and Souvenirs to buy the best available.

Like bread we Oh is it the camera else the street of bread and you can't download them in the attic, and the atmosphere is different in some ways. The room is clean, the size is also 3 people is enough for us. By Buss clean Edition gives you in Japan and not available.
Stay is, this self-catering but crippled without self-catering facilities all the time.

Host families of Marc so kind to contact details also and setting the live shooter Edition gives the full experience with no more.

All in the wonderful like bread we Oh is, but the only drawback is the engine skill level hard Am I no, and is located on the 5th floor of this page.
If it is not, and this is need to be aware of it."
Bon séjour chez David,1,breton,fr-en,Good stay at David
Razoavel,1,breton,en-en,Razoavel
Near metro,1,english,en-en,Near metro
She kept our luggage after chek-out time!,1,english,en-en,She kept our luggage after chek-out time!
"아침을 주셔요. 크로와상, 초코빵, 햄, 키위, 오렌지 쥬스, 요거트, 쿠키등 맛있어요. 체크아웃 시간도 넉넉해서 좋아요. 지하철이 근처에 3개 정도 있어서 아마 그것들을 주로 이용하실텐데 나름 가까워요.  그 여기 숙소 지역이 기피하는 지역? 으로 알고있는데 그렇게 무섭지는 않아요. 가정집과 학교? 도 옆에 있고요. 그 숙소로 들어가는 길이 좀 어둡긴한데 괜찮습니다.  불편한 점이 있는지 계속 물어주시고 아시는 한국분과도 연결해주셔서 여줘보시더라고요. 그래서 그 점은 조금 찡했습니다.",1,breton,ko-en,"The morning address. Croissants, chocolate bread, ham, kiwi, orange juice, yogurt, cookies so delicious. Check-out time is generous. The subway is near in the 3. in probably them mainly use would be my name. It here stay, areas to avoid that area? Known as it so scary I don't. Home and school? Next to the road. His rooms into a little dark but fine. That that continue to ask and no one with connections in here I see. So that is a little distortion."
"去凯旋门走路几分钟,铁塔走路20分钟,卢浮宫走路40分钟｡住这里很多景点可以用走的｡确实位置特别好｡房间是两张双人床,两张沙发床,住4人以内合适,住8人转不过身了｡设施比较基础,厕所门关不上,还好都是女人否则有点尴尬｡很抱歉比约定的中午12点晚了15分钟check out｡",1,breton,zh-en,"Go to the Arc de Triomphe to walk for a few minutes,the tower to walk 20 minutes,to the Louvre to walk 40 minutes home. Live here of the many attractions you can walk. Indeed the location is particularly good as well. The room is two double beds,two sofa beds,with a stay of 4 people or less suitable,with a stay of 8 people go, but the body of the House. Facilities were basic,the toilet door shut is not on,okay are woman otherwise a bit awkward as well. I'm sorry than the agreed 12 noon late 15 minutes to check out as well."
"Great house. Nice location. Near metro, near super matket",1,english,en-en,"Great house. Nice location. Near metro, near super matket"
"très bon séjour chez Anna,merci",1,breton,fr-en,"very good stay at Anna,thank you"
small but a good deal,1,english,en-en,small but a good deal
Très bon séjour chez Maguelone ! Merci !,1,breton,fr-en,Very good stay at Maguelone ! Thank you !
Perfekt!,1,breton,de-en,Perfect!
"Geneviève 的房子非常棒!通过房间的楼梯到达楼顶还能看到埃菲尔铁塔跟圣心堂,附近交通也很便利,到景点都很近,让我在巴黎住的很舒服,推荐｡",1,breton,zh-en,"Geneviève's House is great! Through the room of stairs to reach the roof you can see the Eiffel Tower with Sacre Coeur,near the traffic is also very convenient,to the attractions are very close,so I'm in Paris with a stay at the very comfortable,recommend area."
Shame about cleanliness ...,1,english,en-en,Shame about cleanliness ...
"정말 사랑스러운 가족의 집이었습니다. Guénaelle이 저희가 불편하지 않게 신경도 많이 써주고 친절하게 안내해 주었습니다. 근처에 메트로역이 두개 있어서 위치도 좋았고, 침실도 퀸사이즈 베드에 많이 좁지 않아서 여자 둘이 편히 지냈습니다. 덕분에 편하고 즐겁게 여행했어요:)",1,breton,ko-en,"Really lovely family home. Guénaelle the US is not uncomfortable to the nerve and also a lot of Sunny and friendly. Near Metro station, two at the location was also great, the bedroom is also a Queen-size bed in a lot of narrow not women both completely spent. Thanks to a comfortable and enjoyable trip.:)"
n'hesitez pas c'est top,1,breton,en-en,n'hesitez pas c'est top
Tout s’est très bien passé chez Glenn.,1,breton,fr-en,Everything went very well with Glenn.
Perfekt,1,breton,de-en,Perfect
Personnel souriant,1,breton,fr-en,Staff smiling
Well organized place.,1,english,en-en,Well organized place.
"14구쪽에 위치해있으며 주변은 깨끗합니다.
숙소도 깨끗한 편이며 조식은 바게트가 나옵니다.
체크인은 14:30분이며 더 빨리 도착하면 짐은 맡아 주나
거실이 아닌 주방에서 대기하거나 나가있어야합니다.
헤어드라이기는 여권을 맡기고 대여해줍니다. 
개인사물함은 번호에 안맞게 먼저 도착한 순서대로 마음대로 사용하면 됩니다.
침대마다 콘센트가 있어 좋습니다.",1,breton,ko-en,"14 Nine West located in the surrounding are clean.
The hostel is clean and comfortable, and the Breakfast is a baguette.
Check-in is 14:30 and arrive sooner if the load is a task or
The living room, not in the kitchen, or I have.
Hair dryer is your passport to leave for. 
Personal locker number on the first arrival order mind use.
Bed every outlet."
Perfecto :-),1,breton,es-en,Perfect :-)
Me ha gustado,1,breton,es-en,I liked
"위치가 너무 완벽합니다!! 공항에서 Direct 2을 타고 에펠탑에서 내리면 집까지 걸어서 3분? 진짜 가까워요 그리고 나가자마자 에펠탑이 바로 보여요ㅠㅠ 매일매일 에펠탑 볼수있음! 에펠탑이 잘보이는 인셉션 다리까지도 걸어서 10분? 바토무슈 선착장도 마찬가지 ㅎ 집 앞에 버스정류장도 많고 지하철도 걸어서 5~10분이면 주위역은 다 갈수있어요!! 하루 일정이 끝나고 집으로 돌아올때마다 했던 얘기가 """"""""숙소 위치 최고다""""""""
집 인테리어도 너무 이쁘고 침대가 소파를 개조?한 침댄데 하나도 불편하지않고 너무 푹신해요 라텍슨가?ㅎ 아 그리고 드라이기 안챙겨 가셔도 됩니다 초강력한 드라이기가 있거든요 바람세기 온도 조절 다돼요 ㅠㅠ 제일 맘에 드는점임..ㅎ 처음에 숙소 결정할때 후기가 별로 없어서 화장실 사진을 보고 결정을 했는데 역시나 화장실 완벽합니다 수압도 완벽 ㅎ 그리고 드럼 세탁기도 있으니까 세탁할거 많으신 분들은 세제챙겨가시면 될거같아요 ! 옷걸이도 많으니 괜히 안챙겨가도 될듯!굳이 단점을 하나 꼽자면 집 전체적인 조명이 어두워서 화장하려면 창문쪽 테이블에서 해야한다는점? 사실 단점도 아님..ㅎ
집 주위에 레스토랑이 진짜 많아요  가격대는 8~20유로 정도? 빵집도 꽤 있는데 특히 건너편 오른쪽에 Boulangerie patisserie 이라는 빵집이 있는데 여기 크로와상이랑 딸기잔뜩 올려져있는 타르트? 아무튼 진짜 맛있어요ㅠㅠ 근처에 꽤 큰 슈퍼마켓도 있어서 재료 사다가 해먹어도 됩니다 주방에 식기도구가 다있거든요 없는게 없어요ㅎ  
그리고 무엇보다 emy 메세지에 아주 친절하게 답장해줍니다ㅠㅠ 답장도 빠르고요 
지금은 이탈리아로 넘어와서 여행중인데 계속 여기 생각나네요 4일동안 묵으면서 이곳은 반드시 후기를 남겨서 알려야 겠구나라는 생각이 들었어요 무튼 여긴 ㅊ최고에요!!!! 다음에 파리에 다시 오게 된다면 여기에 또 묵고 싶어요:D
Thank you emy! Your flat is perfect:)",1,english,en-en,"위치가 너무 완벽합니다!! 공항에서 Direct 2을 타고 에펠탑에서 내리면 집까지 걸어서 3분? 진짜 가까워요 그리고 나가자마자 에펠탑이 바로 보여요ㅠㅠ 매일매일 에펠탑 볼수있음! 에펠탑이 잘보이는 인셉션 다리까지도 걸어서 10분? 바토무슈 선착장도 마찬가지 ㅎ 집 앞에 버스정류장도 많고 지하철도 걸어서 5~10분이면 주위역은 다 갈수있어요!! 하루 일정이 끝나고 집으로 돌아올때마다 했던 얘기가 """"""""숙소 위치 최고다""""""""
집 인테리어도 너무 이쁘고 침대가 소파를 개조?한 침댄데 하나도 불편하지않고 너무 푹신해요 라텍슨가?ㅎ 아 그리고 드라이기 안챙겨 가셔도 됩니다 초강력한 드라이기가 있거든요 바람세기 온도 조절 다돼요 ㅠㅠ 제일 맘에 드는점임..ㅎ 처음에 숙소 결정할때 후기가 별로 없어서 화장실 사진을 보고 결정을 했는데 역시나 화장실 완벽합니다 수압도 완벽 ㅎ 그리고 드럼 세탁기도 있으니까 세탁할거 많으신 분들은 세제챙겨가시면 될거같아요 ! 옷걸이도 많으니 괜히 안챙겨가도 될듯!굳이 단점을 하나 꼽자면 집 전체적인 조명이 어두워서 화장하려면 창문쪽 테이블에서 해야한다는점? 사실 단점도 아님..ㅎ
집 주위에 레스토랑이 진짜 많아요  가격대는 8~20유로 정도? 빵집도 꽤 있는데 특히 건너편 오른쪽에 Boulangerie patisserie 이라는 빵집이 있는데 여기 크로와상이랑 딸기잔뜩 올려져있는 타르트? 아무튼 진짜 맛있어요ㅠㅠ 근처에 꽤 큰 슈퍼마켓도 있어서 재료 사다가 해먹어도 됩니다 주방에 식기도구가 다있거든요 없는게 없어요ㅎ  
그리고 무엇보다 emy 메세지에 아주 친절하게 답장해줍니다ㅠㅠ 답장도 빠르고요 
지금은 이탈리아로 넘어와서 여행중인데 계속 여기 생각나네요 4일동안 묵으면서 이곳은 반드시 후기를 남겨서 알려야 겠구나라는 생각이 들었어요 무튼 여긴 ㅊ최고에요!!!! 다음에 파리에 다시 오게 된다면 여기에 또 묵고 싶어요:D
Thank you emy! Your flat is perfect:)"
Tout ok merci,1,breton,fr-en,All ok thank you
"Perfect.
지하철 역이 바로 옆에 있고 버스 정류장도 바로 있고 개선문 까지 걸어서 갈수도 있고  에펠탑까지도 걸어서 무리없이 갈수 있어요 위치도 좋고 또한 침대들이 진짜 편해요 깔끔하고 호텔같았어요 욕실도 깔끔하고 또한 제일 좋았던건 부엌이 완벽합니다 모든 조리기구가 준비되어있어요 저희는 집앞 마트에서 쇼핑해서 저녁은 직접 만들어먹었는데 좋았어요 그냥 여기 보이면 고민하지말고 걍 결제해야됨 ",1,breton,ko-en,"Perfect.
Subway station right next to the bus stop is also right there and a walk to go and the Eiffel Tower and even walk a bunch to go without. location is also good and also the bed really comfortable. clean hotel. the bathroom is also neat and also best conditions in the kitchen will be perfect for all cookware ready to have our house in shopping in the evening directly made I was good just see here, if not really losing my payment should be. "
Proche de tout ! Petit nids douillet.,1,breton,fr-en,Close to everything ! Small nest douillet.
Nous,1,breton,fr-en,We
Tres bel appartemant rénové avec gout.,1,breton,fr-en,Very nice-owned refurbished with taste.
"地理位置極佳, 5分鐘內步行距離到最近的metro站,五分鐘也可步行到傷兵院和羅丹美術館｡居住環境安全又乾淨,鄰居也滿友善的,房子在一樓也很方便｡可能是一層樓改建成兩戶的關係,房間有個通往隔壁的房門,是上鎖的很安全,只是隔音會比實牆差一些,還是會聽到隔壁的聲音｡床非常舒服｡煮飯器具也很齊全,洗衣機比較複雜｡浴室水壓穩定熱水夠熱｡",1,breton,zh-en,"Excellent location, within 5 minutes walking distance to the nearest metro station,five minutes walk to the wounded soldiers of the court of justice and the Rodin Museum grounds. The living environment safe and clean,neighbors also full of friendly,the house on the ground floor is also very convenient as well. Could be one floor converted into a two-family relationship,the room one leading to the next door,which is locked quite safe,just sound insulation than solid walls worse,or will hear the next sound well. Bed very comfortable and great views. The cooking appliance is also very well equipped,washing machine is relatively complex area. Bathroom water pressure and stable hot water hot enough area."
ganz gut,1,breton,de-en,very good
Très bon séjour chez zack merci,1,breton,fr-en,Very good stay with zack thank you
"房东有点冷漠｡房间比较小,露台不错｡check-in和check-out时间灵活｡",1,breton,en-en,"房东有点冷漠｡房间比较小,露台不错｡check-in和check-out时间灵活｡"
Vous allez vous régaler,1,breton,fr-en,You will enjoy
