comments,N,lang,en-en,comments
"Parfait !! ... la chambre est grande et au calme à deux pas de la gare du nord et de la gare de l'est ... David est très sympathique.
Pour ma première expérience de location via Airbnb je suis pleinement satisfait et je n'hésiterai à louer de nouveau cette chambre.",1,french,fr-en,"Perfect !! ... the room is big and in a quiet two not the gare du nord and the gare de l'est ... David is very friendly.
For my first rental experience on Airbnb and I am fully satisfied and I would hesitate to rent again this room."
"David est accueillant, serviable et sympatique. Nous sommes resté qu'une seule nuit mais il nous a quand meme très bien accueilli et renseigné. Son appartement est agréable également. Je vous le recommande !",1,french,fr-en,"David is friendly, helpful, and friendly. We stayed only one night but it was still very well welcomed and informed. His apartment is also enjoyable. I recommend it !"
"De passage à Paris pour quelques jours, j'ai du chercher en urgence un appartement proche de gare du nord. David a été super réactif, et l'accueil impeccable, c'était exactement ce qu'il me fallait.

Je le recommande vivement pour tout type de séjour, professionnel ou touristique.",1,french,fr-en,"Of passage in Paris for a few days, I had to look for urgently an apartment close to gare du nord. David was super responsive, and impeccable welcome, it was exactly what I needed.

I strongly recommend it for any type of stay, business or tourism."
David a été très organisé et sympathique pour mon séjour. Vous pouvez lui faire confiance ! Localisation parfaite pour les trains de la gare de l est. Le prix de la nuit reste un peu cher cependant.,1,french,fr-en,David was very organized and friendly for my stay. You can trust him ! Perfect location for the train station to the east. The price of the night is a little expensive though.
"David m'a fait visité son logement et m'a encouragé à utiliser sa cafetière pour le lendemain matin.
Le logement était décrit comme tel.
Je connaissait déjà le quartier, très sympa.
",1,french,fr-en,"David made me visited her housing and encouraged me to use her coffee maker for the next morning.
The housing was described as such.
I already knew the area, very nice.
"
"Hôte très agréable, appartement sympas.",1,french,fr-en,"Host very nice, apartment nice."
David mérite tout à fait son statut de superguest. Ravie de l'avoir rencontré.,1,french,fr-en,David deserves his status as a superguest. Delighted to have met him.
"David est un hôte très chaleureux et accueillant, bien placé et très gentil! Il m'a donné beaucoup de conseils pour bien pouvoir assister à un colloque à Paris! ",1,french,fr-en,"David is a host very warm and welcoming, well placed and very nice! It has given me a lot of advice to be able to attend a colloquium in Paris! "
"David est un hôte très sympathique et son accueil est chaleureux. le logement est toutefois plus vétuste qu'il ne paraît sur le site. Le quartier est celui de l'environnement immédiat de la gare de l'est, donc pratique mais sans charme. ",1,french,fr-en,"David is an host very friendly and his welcome is warm. the housing, however, is more dilapidated than it appears on the site. The neighborhood is the immediate environment of the train station, so convenient but without charm. "
"David est très sympa! Il est par ailleurs très précis dans ses explications, ce qui aide à l'organisation d'un voyage d'affaire ou de vacances.
L’appartement est plutôt grand et assez confortable pour le prix.
Le cartier est central ce qui est bien pour les transports en commun.",1,french,fr-en,"David is very nice! Furthermore, it is very precise in her explanations, which helps with the organization of a business trip or vacation.
The apartment is rather big and comfortable enough for the price.
The cartier is central which is good for public transport."
Après avoir été arnaqué pour une autre réservation express.Cela à été très rassurant d atterir chez David .réservation faite à 13 h pour le soir même .,1,french,fr-en,After you have been scammed for another reservation express.This was very reassuring of land in David .reservation in 13 h for the same evening .
"Merci à David, qui est venu m'ouvrir sa porte alors que j'avais fais la réservation à 23h ! D'autant plus qu'il était en sortie avec des amis il est venu avec le sourire et à prit le temps de me faire visiter l'appartement et répondre à mes questions. ",1,french,fr-en,"Thank you to David, who came up to me open his door while I was doing the booking at 23h ! All the more that he was out with friends he came in with a smile and took the time to make me visit the apartment and answer my questions. "
"beaucoup de place, très grandes disponibilité et attention de la part de David",1,french,fr-en,"plenty of room, great availability and attention of the part of David"
"Bien. 
c'était pratique et agréable.
Merci",1,french,fr-en,"Well. 
it was convenient and pleasant.
Thank you"
Bon dans l'ensemble. Hôte très sympathique.,1,french,fr-en,Good on the whole. Host very friendly.
Logement et hôte très agréable,1,french,fr-en,Housing and host very pleasant
Séjour très confortable chez David qui est un hôte très agréable et avenant. Je recommande sans réserve.,1,french,fr-en,Very comfortable stay at David who is a host very pleasant and helpful. I recommend them without reservation.
"Très bien situé, proche de la gare du Nord et de l'Est, beaucoup de possibilités de restauration. L'appartement en lui même est propre, l'espace salle de bain un peu petit. David m'a fait bon accueil. Logement idéal pour un court séjour.",1,french,fr-en,"Very well located, close to the gare du Nord and the East, a lot of dining options. The apartment itself is clean, the bathroom space a bit small. David made me welcome. Ideal accommodation for a short stay."
"L'accueil, la grandeur de la chambre et son emplacement font de l'appartement de David un très bon endroit pour profiter de Paris.",1,french,fr-en,"The home, the size of the room and its location make the apartment of David a very good place to enjoy Paris."
David est très réactif et m a attendu tard le soir! Merci!,1,french,fr-en,David is very responsive and m was expected later in the evening! Thank you!
"Chers amis de voyage, 
J'ai passé un agréable séjour chez David. 
L'emplacement est idéal, à 2 minutes à pied de la gare du Nord... c'est vraiment très bien placé. Et l'appartement est très calme, la chambre donne sur une cour. 
Bref, un séjour agréable, un hôte agréable, très bien. 
je recommande les amis
Padovanese",1,french,fr-en,"Dear friends of travel, 
I have spent a pleasant stay with David. 
The location is ideal, 2 minutes walk from the gare du Nord... it is really very well placed. And the apartment is very quiet, the room overlooks a courtyard. 
In short, a pleasant stay, a host, nice, very nice. 
I recommend the friends
Padovanese"
"Endroit agréable et hôte hors normes, super séjour.",1,french,fr-en,"Nice place and host non-standard, super stay."
"parfait séjour chez Kay, l'appartement est encore mieux que sur les photos et on y est au calme et bien placé pour être rapidement dans le centre de Paris! j'y retournerai sans hésiter",1,french,fr-en,"perfect stay at Kay, the apartment is even better than the pictures and it is very quiet and well placed to be quickly in the center of Paris! I will return without hesitation"
"Clément nous a très bien accueilli dans son appartement qui est très
plaisant et bien situé dans Paris.
Ces conseils sur les quartiers de Paris et sur la restauration 
parisienne nous ont été utiles pendant notre séjour.
Une adresse a recommandé",1,french,fr-en,"Clement we were very well welcomed in the apartment which is very
pleasant and well located in Paris.
These tips on the neighborhoods of Paris, and on the restoration 
paris we have been useful during our stay.
An address recommended"
"Appartement très bien situé (tout près du métro). Nous y avons été très bien accueillis. Confortable et fonctionnel pour notre petite famille de 4 (2 adolescentes), nous avons pu nous y reposer après des journées bien remplies. Appartement et hôte à recommander.",1,french,fr-en,"Apartment very well located (near the metro). We were very well received. Comfortable and functional for our small family of 4 (2 teenagers), we were able to rest after fun-filled days. Apartment and host to recommend."
Accueil excellent et appartement fort sympathique. Nous avons passé trois journées très agréables à Paris malgré un manque de sommeil occasionné par les nuisances sonores de l'avenue.,1,french,fr-en,Excellent home and apartment very nice. We spent three days very pleasant to Paris in spite of a lack of sleep caused by the noise of the avenue.
"Chouette appart 
",1,french,fr-en,"Nice apartment 
"
"Hôte très sympathique. Une bonne bouteille et des chocolats nous attendaient. Le petit mot avec des conseils sur le marché Blanqui et la boulangerie """" l'essentiel"""" ont été très utiles aussi.
L'appartement  était très propre et possède le charme discret de la bourgeoise (bohème).",1,french,fr-en,"Host very friendly. A good bottle and chocolates were waiting for us. The small word of advice on the market Blanqui and the bakery """" the essential"""" have been very helpful also.
The apartment was very clean and has the discreet charm of the bourgeois (bohemian)."
Accueil  et appartement très sympathiques bien situé proche toutes commodités. La Place d'Italie est très bien desservie que ce soit par le métro ou le bus. Nous y avons séjourné 4 jours avec nos 3 enfants (10 8 et 5) et ce fut parfait ! Une chose est sûre : nous reviendrons !!! Merci Clement pour votre accueil !!!,1,french,fr-en,Home and apartment very nice and well located close to all amenities. Place d'italie is very well served by the metro or the bus. We have stayed there 4 days with our 3 kids (10 8 and 5) and it was perfect ! One thing is for sure : we will return !!! Thank you Clement for your hospitality !!!
"Appartement décoré avec soin, dans un quartier sympathique et commerçant, bon restaurants , bien déservi par le métro, à 10 minutes à pied de la gare de Lyon, près de la place de la Bastille et de la très belle place des Vosges   Très  bon accueil sympathique et généreux.",1,french,fr-en,"Apartment decorated with care, in a friendly neighborhood, and shopping, good restaurants , well déservi by the metro, a 10-minute walk from the train station of Lyon, near the place de la Bastille and the lovely place des Vosges Very good host, friendly and generous."
"Accueil parfait, même à 22h00 le soir. Hôte charmant. Appartement soigneusement décoré ; et quelques détails qui font qu'on s'est senti de suite chez soi : petit déjeuner à notre attention pour le premier matin et coton à démaquiller dans la salle de bain. Trés bien situé : à peine à 15 minutes de la gare du Nord.

Sehr freundlicher Empfang des netten Eigentümers, trotz später Ankunft am Abend. Eine sehr schöne, mit Liebe zum Detail ausgestattete  Wohnung, in der es an nichts fehlt (auch für Leute die gerne kochen) und die zentral, in guten Umfeld gelegen ist. Wir werden sehr gerne wiederkommen.",1,french,fr-en,"Perfect home, even at 22: 00 in the evening. Charming host. Apartment carefully decorated ; and a few details that we felt immediately at home : breakfast to our attention for the first morning and cotton to remove makeup in the bathroom. Very well located : just 15 minutes from the gare du Nord.

Sehr freundlicher Empfang des netten Eigentümers, trotz später Ankunft am Abend. Eine sehr schöne, mit Liebe zum Detail ausgestattete Wohnung, in der es year nichts fehlt (auch für Leute, die gerne kochen) und die zentral, in guten Umfeld gelegen ist. Wir werden sehr gerne wiederkommen."
"J'ai été ravie de mon séjour parisien, l'appartement est très propore, beau, beaucoup de goût, de soin et de recherche dans la décoration. Un hôte charmant, je suis ravie, je recommande chaudement cette adresse et y retournerait certainement lors de prochains passages. Merci Michel ",1,french,fr-en,"I was delighted with my stay in paris, the apartment is very own, beautiful, great taste, care and research in the decoration. A charming host, I'm thrilled, I can highly recommend this address and would go back again definitely when next passages. Thank You Michel "
"La communication préalable avec Michel était correcte, l'accueil chaleureux et son appartement est comfortable et gentil. Tout de suite après l'entrée, on se sent à son aise. Nous étions déjà plusieures fois à Paris, mais juqu'ici toujours dans une chambre d'hôtel. 
Mais dans un appartement, en tout cas dans un appartement comme celui de Michel, c'est toute autre chose. On peut dire: """"Je suis Parisien"""" pour quelques jours. Le matin, on va acheter une baguette chez la boulangerie voisine, on fait ses achats sur le marché d'Alligre, on prend un petit café dans le bar """"du coin"""", le métro est proche et il y a un grand choix de restaurants et magasins.
C'est un appartement et un quartier à recommander. 
Seulement c'est moins apte pour des gens avec une mobilité limitée à cause de l'escalier vers le lit sous le plafond peu élevé.
Pour nous c'est: """"Michel, merci et à la prochaine!""""",1,french,fr-en,"The prior communication with Michel was correct, the warm welcome and his apartment is comfortable and nice. Immediately after the entrance, you feel at ease. We were already several times in Paris, but up here still in a hotel room. 
But in an apartment, in any case in an apartment as that of Michel, it is a whole other thing. You can say: """"I'm in Paris"""" for a few days. In the morning, we are going to buy a baguette at the bakery, one makes its purchases on the market of Alligre, it takes a little coffee in the bar """"the corner"","" the metro is close and there is a large choice of restaurants and shops.
It is an apartment and a neighborhood to recommend. 
Only it is less suitable for people with limited mobility because of the stairs to the bed under the ceiling low.
For us it is: ""' ""Michel, thank you and see you next time!"""""
"Nous avons été ravis de notre séjour chez Michel.
Difficile de trouver un hôte plus sympathique et attentionné !  Nous le recommanderons à nos amis.
Appartement parfait avec tout ce dont nous avions besoin.
Dominique ",1,french,fr-en,"We were delighted with our stay at Michel.
Difficult to find a host that is more friendly and attentive ! We will recommend to our friends.
Perfect apartment with everything we needed.
Dominique "
"Très bon séjour chez Michel, un accueil personnalisé et des attentions qui sont bienvenues et plus qu'utiles ! Merci Michel A bientôt ! ",1,french,fr-en,"Very good stay at Michel, a personalized welcome and attention that is welcome and is more than useful ! Thank you Michel soon ! "
Michel est un hôte très attentionné et disponible. Très bel appartement. Très fonctionnel. Je recommande!!,1,french,fr-en,Michel is a host very attentive and available. Very nice apartment. Very functional. I recommend!!
"Michel nous a bien accueilli ,il nous a  bien conseillé ,il était ponctuel lors de notre arrivée et départ .
Simple et sympa 
",1,french,fr-en,"Michel we welcomed it ,we well-advised ,he was punctual at our arrival and departure .
Simple and nice 
"
"Merci Michel, pour votre accueil, tous vos bons plans et cet appartement qui est a la fois chaleureux et extrêmement bien placé dans Paris !
Je reviendrai avec grand plaisir !",1,french,fr-en,"Thank you Michel, for your home, all your good plans and this apartment that is both warm and extremely well placed in Paris !
I will return with great pleasure !"
"Un appartement très agréable, où rien ne manque et tout est fait avec goût. Je recommande vivement ce bien, d'autant que l'accueil est parfait. 
Merci!",1,french,fr-en,"A very nice apartment where nothing is missing and everything is done with taste. I highly recommend this property, especially as the reception is perfect. 
Thank you!"
"Michel a pris contact tout de suite après la réservation afin de me donner les éléments essentiels pour obtenir les clés des lieux. Il était présent à l'heure au rendez vous et m'a très bien détaillé autant l'appartement que les magasins de proximité ou activités alentoures.
Une adresse à conseigner définitivement.
Merci Michel et bonne continuation.
Au plaisir de te recroiser
S.",1,french,fr-en,"Michel has made contact immediately after the booking in order to give me the essential elements to get the keys to the premises. He was present at the time at the appointment and I was very well detailed as much the apartment as the shops of proximity, or activities alentoures.
An address to conseigner permanently.
Thank you Michel and good luck.
The pleasure of you again
S."
"Plein de charme, ce logement est parfaitement situé à moins de 10 minutes de la gare de Lyon pour les voyageurs et à deux pas des taxis et métro. Situé dans une cour intérieur il est de plus très calme. Dans le quartier on trouve sans problème épiceries, fleuriste, pharmacie et grand magasins. De plus les bons petits restaurants et un bar à vin de très bons conseils se trouvent à 5 minutes.
Bref, à recommander sans hésiter, d'autant plus que Michel est plein de bons conseils et que ce logement, parfaitement équité, a été trouvé d'une propreté sans faille.",1,french,fr-en,"Full of charm, this home is perfectly located less than 10 minutes from the gare de Lyon train station for travelers, and close to taxis and metro. Located in an inner courtyard it is very quiet. In the neighbourhood you will easily find grocery stores, florist, pharmacy and department stores. More good little restaurants and a wine bar, very good advice can be found in 5 minutes.
In short, to recommend without hesitation, all the more that Michael is full of good advice, and that this dwelling, perfectly equitable, has been found of a cleanliness."
Appartement très en agréable et bien situé (proche métro).,1,french,fr-en,Apartment very nice and well located (near metro).
Michel est accueillant et toujours prêt à vous donner un conseil iu un voup de main...,1,french,fr-en,Michel is friendly and always ready to give you a board iu a voup of hand...
"Accueil adorable , logis adorable , et très paisible à quelques enjambées du grand rush .
Michel prévoit tout , et beaucoup de tendresse émane de ce lieu . 
Merci à nouveau et à bientôt , c’est promis",1,french,fr-en,"Home lovely , home lovely , and very peaceful with a few strides of the big rush .
Michel provides for all , and a lot of tenderness emanates from this place . 
Thank you again and see you soon , I promise"
"Bonsoir Axel et Michelle

Malgré les événements du 13 novembre, nous avons passé un séjour agréable, chambre spacieuse, calme et appartement très pratique.
Merci et bonne continuation.
José",1,french,fr-en,"Hello Axel and Michelle

Despite the events of 13 November, we spent a pleasant stay, spacious room, quiet and the apartment very practical.
Thank you and good luck.
José"
"Le logement correspondait parfaitement à la description faite sur AirBnb. L'appartement était très propre et très bien localisé, près d'un metro et dans un quartier super! En plus, la communication avec Axel était conviviale, précise et efficace. Nous avons beaucoup aimé notre expérience dans cet appartement chaleureux et confortable. ",1,french,fr-en,"The accommodation corresponded perfectly to the description made on AirBnb. The apartment was very clean and very well located, near a metro and in a super neighborhood! In addition, the communication with Axel was user-friendly, precise and efficient. We loved our experience in this apartment warm and comfortable. "
"Tout s'est très bien passé. Un peu de lenteur à l'allumage (la BNB sitter ne savait pas démarrer le chauffage) mais l'installation était des plus simples à utiliser ! Appartement calme et clair, bien situé. ",1,french,fr-en,"Everything went very well. A bit of slowness to the ignition (the BNB sitter could not start the heating) but the installation was simple to use ! Apartment quiet and bright, well located. "
"Axel a accueilli mes amis pour quelques jours dans son appartement.
Malgré son absence, et grâce à François le bnbsitter tout s'est bien passé, l'appartement était propre et bien rangé, en plus la décoration est top avec des couleurs très """"fresh"""".
L'appartement est bien situé, pas loin du métro avec passages réguliers de bus et taxis.
Je le recommande pour toutes ses raisons et plus.
Merciiiii",1,french,fr-en,"Axel has hosted my friends for a few days in her apartment.
Despite his absence, and thanks to François the bnbsitter everything went well, the apartment was clean and tidy, the decoration is top with colours that are very """"fresh"""".
The apartment is well located, not far from the metro with regular passages of buses and taxis.
I recommend it for all of those reasons and more.
Merciiiii"
"Cet appartement convient mieux aux plus jeunes, moins aux baby boomers. Pas trop équipé pour cuisiner même de façon basic.",1,french,fr-en,"This apartment is best suited for younger, less than the baby boomers. Not too equipped for cooking even basic."
L'appartement d'Axel et Michelle et Michelle est charmant et bien situé. Nous nous sommes senti à la maison pour notre séjour à Paris.,1,french,fr-en,"The apartment Axel and Michelle, and Michelle is charming and well located. We felt at home for our stay in Paris."
"Spacieux, propre, chaleureux, bref, impeccable.",1,french,fr-en,"Spacious, clean, warm, in short, is impeccable."
Superbe séjour! Emplacement parfait! Près de tout à pied. Studio très propre et bien aménagé. Contient toutes les commodités requises. Communications rapides avec l'hôte et le gérant. Directives claires et précises. Merci à vous deux!,1,french,fr-en,Great stay! Perfect location! Nearly everything on foot. Studio very clean and well laid out. Contains all the amenities required. Fast communication with the host and the manager. Clear guidelines and precise. Thanks to both of you!
"Studio idéalement situé et bien équipé. Canapé lit confortable, bon chauffage et eau chaude qui marche correctement. L´accueil a été ponctuel et attentif à ce que tout se passe bien. Le seul bémol est que le studio est un peu petit ; une fois qu´on a ouvert le canapé lit, il ne reste plus beaucoup d´espace.",1,french,fr-en,"Studio ideally located and well equipped. Sofa bed comfortable, good heating and hot water which works well. The reception was punctual and attentive to what all is going on well. The only downside is that the studio is a bit small ; once we opened the sofa bed, there is not a lot space."
"Notre semaine montmartroise aura été un de nos plus beaux séjours parisiens. Nous avons été acceuillis formidablement par Sue, Merci !
L appartement est idéalement situé (et CONFORME aux photos) tant pour les balades, que pour le shopping. Quartier très bien desservi avec une foule de petits commerces.
Nous reviendrons á Montmartre,  c est sûr mais ce sera chez Amandine !",1,french,fr-en,"Our week in montmartre has been one of our nicest stays in paris. We were welcomed wonderfully by Sue, Thank you !
The apartment is conveniently located (and in ACCORDANCE with the photos) as for walking, for shopping. Neighborhood is very well served with a host of small shops.
We will return to Montmartre, c is safe but it will be at Amandine !"
"Bel appartement, spacieux, lumineux et au calme. A deux pas de la porte d Orleans, des bus directs pour aller aux principaux musees de Paris
Ideal pour un couple avec enfant.",1,french,fr-en,"Beautiful apartment, spacious, bright and quiet. Two steps from the porte d'orleans, with direct buses to go to the main museums of Paris
Ideal for a couple with child."
"Merci Lena, nous avons passe un excellent sejour chez toi. Ton appart est super, bien situe et bien spacieux. Tout etait parfait et surtout je te remercie pour ton aide :)
A bientot j'espere",1,french,fr-en,"Thank you Lena, we had a great stay at home. Your apartment is great, well located and well spacious. Everything was perfect and I especially thank you for your help :)
See you soon I hope"
"Idéalement situé à 2 pas de la porte d'Orléans (métro, tram et RER, l'appartement de Léna est chaleureux et lumineux. La rue de Coulmier est calme et la vue sur l'ancienne petite ceinture est dégagée. On peut tout à fait s'attarder sur les balcons pour profiter de l'atmosphère du quartier. L'équipement intérieur est complet et l'on se sent rapidement comme chez soit.
Bref, une bonne adresse à recommander",1,french,fr-en,"Ideally located at 2 steps from the porte d'orleans (metro, tram and RER, the apartment Lena is warm and bright. The rue de Coulmier is quiet and the view of the old little belt is released. You can linger on the balconies to enjoy the atmosphere of the neighborhood. The equipment inside is complete and you feel quickly like at home.
In short, a good address to recommend"
Bon rapport qualité-prix. Logement bien situé entre 2 stations de métro dans un quartier calme et avec tous les services à proximité. L'absence de rideaux opaques dans la chambre et de la moquette mur à mur dans toutes les pièces pourrait incommoder certaines personnes.,1,french,fr-en,Good quality-price ratio. Apartment well located between 2 metro stations in a quiet area with all services nearby. The absence of blackout curtains in the bedroom and the carpet is wall-to-wall in every room might bother some people.
