comments,N,lang,en-en,comments
"地址超级棒,卢浮宫,先贤祠,圣母院,市政厅,蓬皮杜等景点和网红餐厅走着就可以去｡虽然没有看到房东,但是房东帮了我们很多,虽然过了check out的时间,依然帮我们保管行李~~",1,breton,zh-en,"Address of super rod,the Louvre,Pantheon,Notre Dame,Hotel de Ville,Pompidou Centre and other attractions and a network of red restaurant walk you can go home. Although did not see the landlord,but the landlord helped us a lot,although after check out time,still it get our baggage~~"
Fabulous neighborhood.,1,english,en-en,Fabulous neighborhood.
"Bonjour a tous,

 Avec ma Maman nous avons très bien dormis,",1,breton,fr-en,"Hello all,

With my Mum we have very well slept,"
"Petit studio très bien situé. 
WIFI très bien + nous avions tout dont nous avions besoin (savon, sèche cheveux...). 
",1,breton,fr-en,"Small studio very well located. 
WIFI very good + we had everything we needed (soap, hairdryer, etc.). 
"
추천합니다 일단 에펠탑 가까이있어 너무 좋았습니다  가까운곳에 맛집도 있고 지하철도 금방 탈수있어 교통이 편리합니다  할머님도 거의 자유분방하셧고  단한가지 문제? 는 살짝 집 분위기가 무섭다는점 외에는 너무 좋았습니다,1,breton,ko-en,"Recommended. once the Eiffel Tower got closer was good too..... the nearest place in restaurants and Subway also dehydration are very convenient for transportation. you, too, mother almost liberal to amble, and only for the problem? The Tap House atmosphere is scary. in addition to that too good."
Perfect. Again.,1,breton,en-en,Perfect. Again.
Très bon séjour chez Dorothée.,1,breton,fr-en,Very good stay at Dorothée.
On beau séjour chez notre hôte!,1,breton,fr-en,It is a nice stay at our host!
"유럽여행의 마지막이 파리였는데, 숙소가 메우 깨끗해서 좋았습니다. 예상한데로 그리 넓지는 않지만, 둘이 지내기에 딱 적당했어요. 
오를리 샤를드골 모두 지하철로 바로 올수 있고 역에서도 매우 가까워서 이동이 엄청 편했습니다.
저희 같은 경우는 자전거로 이동을 해서 현관에서 나오면 바로 velib 자전거를 이용할수 있다는 점도 너무 편리했구요.
현관도 2중 보안장치가 있어서 매우 안전했고, 집앞에 카페가 있어서 늦게까지 가벼운 맥주한잔 하기에도 좋았습니다.
여러모로 매우 만족스러웠고, 다시 파리에 오게 된다면 또 이용할 생각입니다.
다만 2층 침대가 조금 불편했고, 1층에 소파베드을 사용하려 했지만, 시트가 청소가 되어 있지 않더군요. 청소 하시는분께 2명만 왔다고 예기해서 2층 침대만 사용한다고 생각했나봐요. 미리 소파베드 청소도 말씀하시면, 시트를 미리 교체해 주실거 같네요.
",1,breton,ko-en,"A trip to Europe with the last of the Paris that was, the hostel is very clean. As expected it is wide, but two in just right. 
Orly Charles de Gaulle all the subway right there and the station on the Go is enormous.
Us if you like the bike, go to the porch right at the velib bike you can use that too.
The porch also 2 of the security device is in a very safe and had a house, in front of a café in the late Light beer but good.
Here was very satisfactory, and again in Paris you used to think.
Just 2 bunk beds a little uncomfortable and had, on the 1st floor sofa bed to use, but the sheets are clean and there is not. Clean but with 2 people only came for in the 2 bunk beds only used for thought. Preview sofa cleaning said surface, the sheet to preview the replacement for the same.
"
Good neighbourhood,1,english,en-en,Good neighbourhood
tout bon,1,breton,fr-en,all good
"good trip, good house",1,english,en-en,"good trip, good house"
Alles tipptopp  Kann man nur empfehlen,1,breton,de-en,Everything Can be a tip for the top only recommend
Acochegante.,1,breton,en-en,Acochegante.
Tout très bien,3,breton,fr-en,Everything very well
Allez y vous ne serez pas decu!,1,breton,fr-en,Go there you will not be disappointed!
"Pour tout est bien, merci",1,breton,fr-en,"For all is well, thank you"
"Gennadiy很热情并耐心地给我们介绍注意事项,房子很干净舒适,地理位置优越,附近就有两个地铁站,而且临近市中心,出游很方便｡生活日用品比较齐全｡唯一少许不足是屋子里的卫生间只有一个帘子,使用有一点不方便,但也可以使用外面的卫生间｡",1,breton,zh-en,"Gennadiy is very enthusiasm and patience to give us a description note,the house is very clean and comfortable,great location,near two metro stations,and close to the city centre,travel is very convenient location. Daily necessities of life full house. The only little drawback is the room of the toilet only a curtain,use a little convenient,but can also be used outside of the toilet area."
"지하철 11호선 Goncourt 역에서 1분 거리에 있어 짐을 들고 이동하기가 수월했습니다. 호스트는 직접 만나볼 수 없었지만 도착하기 전에 연락하여 숙소 찾는 방법에 대해서 친절히 답변해주었습니다. 큰 거실과 단독 침대방 주방 화장실로 구성되어 있었고 넓었기 때문에 생활하는데 불편함이 없었습니다.
현지인들이 주로 생활하는 곳이어서 특별한 경험을 할 수 있었고 근처에 맛있는 빵집과 식당이 있어서 늦은 시간 식사를 해결하기에도 좋았습니다.
베개속이 약간 지저분하였지만 새로운 시트로 모두 교체되어 있었고 침대도 매우 편안했습니다. 기본적으로는 인테리어가 잘되어있는 멋진 집이었습니다.",1,breton,ko-en,"Subway metro line 11, Goncourt station on the 1 minute load and the number of months. Host directly can not meet, but before arrival by contacting the property how to find about it. Large living room and a single bed kitchen bathroom was large because it was life that was.
Local people, mainly living in the special experience to have been able to and near a delicious bakery and restaurant in the late hours of a meal to fix on good.
Pillow speed slightly but as new sheet, and replace all of the was and the bed was very comfortable. By default, the interior is well done cool house."
Perfect! Couldn't have booked a better place,1,english,en-en,Perfect! Couldn't have booked a better place
Perfekt.,1,breton,de-en,Perfect.
"파리의 중심지에 위치하고 있습니다. 매우 안전한 마레지구에 위치하고 있어서 안심하고 여행할 수 있었습니다. 호스트는 매우 친절하셨고 머무는 동안 많은 도움을 주셨습니다. 방은 매우 깨끗했고환기도 잘 되고 햇빛도 잘 들어왔습니다. Merci라는 유명한 가게를 걸어갈 수 있고 그 밖에도 피카소 박물관, 보스쥬광장, 식당, 마트, 카페, 약국, 지하철 등이 가까이 있습니다. 또 주변 길거리에 예쁜 옷가게가 많아서 행복했습니다... ",1,breton,ko-en,"Paris Center. Very safe Mare district, located in the safe and was able to travel. The host is very friendly and during the stay many different topics. The room was very clean and the Converter is also well sunlight well. Merci La is famous for walking and also the Picasso Museum, Vosges Plaza, restaurants, supermarkets, cafes, pharmacies, subway etc. Or around the street in pretty clothes more happy. "
"조금 좁다고 느낄 수도 있지만 매우 아담하고 깨끗한 집이었습니다. 햇빛도 잘 들어오고, 따뜻한 물도 잘 나와서 지내기 좋았습니다. Alien은 정말 친절하고 궁금한 거에 대해서 질문을 하면 거의 30분 내에 답변을 해주어서 편리했습니다. 에펠탑까지도 5~10분 내로 갈 수 있는 거리라 편리하고, 이쪽 동네가 다른 동네에 비해서 안전한 동네인 것 같았습니다. 단, 한가지 아쉬웠던 점은 파리의 아파트가 대부분 그런건지 모르겠지만, 집까지 올라가는 계단이 좁고 높아서 무거운 캐리어를 들고 올라가는 것은 좀 힘들었습니다. 그래도 결론적으로는 매우 만족스러운 숙소였습니다.",1,breton,ko-en,"A little narrow and might feel but very cozy and clean house. Sit and warm water, also well and good. Alien is really friendly and curious about questions for nearly 30 minutes to answer. The Eiffel Tower even 5 to 10 minutes you can go to the street convenient, this neighborhood is another neighborhood in a safe neighborhood it seemed. However, one inconvenient point is that Paris apartment is for the most part that I don't know, but the house up the stairs narrow and high and heavy get is a little tough. So in conclusion a very satisfactory stay."
Tout,2,breton,fr-en,All
"이번 여행중에 지낸 숙소중에 최고의 숙소!
Alex의 친절한 미소로 시작된 3주간의 파리생활은 기억속에 오래남을 것 같다
집앞에 바로 있는 까르프와 3분거리의 프랑프릭스 2분 거리의 베이커리는 즐거운 아침및 저녁 식사를 도와주었고, 샤틀레역과 매우 가까운 곳에 있어 파리관광을 위한 교통편은 매우 편리하였음.
다만 3층이라 표기되어있지만 5층 계단이라 처음에는 약간 힘듦.
깨끗하고 잘 꾸며진 실내와 정돈된 침실과 욕실이 마음에 듦.
집은 매우 따뜻했고 온수 사용량도 문제없었음. 번화가라 이동시 안전한 느낌이 있음",1,breton,ko-en,"This trip in spent hotel the place to stay!
Alex's friendly smile begins with 3 weeks of Paris life is remembered in the Old South seems to be
House right on the call and 3 minutes of a French hotel a 2 minute walk of the bakery an enjoyable Breakfast and evening meal helped, and the Châtelet station and very close to the Paris Tourism for the transportation is very convenient.
Just 3 layers is there, but the 5th floor staircase at first a little difficulty.
Clean and well decorated indoor and uncluttered bedroom and bathroom in mind is a community project.
The house was very warm and hot water usage without any problems. The move feels safe there"
vous devez meriter,1,breton,fr-en,you must deserve
"房東會將二樓的浴室跟廁所讓給你單獨使用,房間跟房屋都蠻乾淨的,所在的位子離Metro很近,很方便",1,breton,zh-en,"The landlord will be on the second floor of the bathroom with toilet let you alone,room with homes that are foolhardy net,where the seat away from the Metro is very near,very convenient"
숙소는 사진과 똑같습니다. 아주 예쁘고 가족들은 매우 친절해요. 개인실이지만 화장실도 방에 있고 집 열쇠를 가지고 다녀서 생활하는데 불편함은 없습니다. 아침식사도 원하는 시간에 챙겨주시고 늘 안부를 물어보시며 친절하고 따뜻한 마음을 받을 수 있었습니다. 큰 길만 나가면 지하철 역도 있고 오페라와도 걸어서 이동이 가능해서 접근성이 훌륭합니다 :D,1,breton,ko-en,"Place photos and equally. Very pretty and the family is very friendly. Private rooms, but the bathroom in the room and house key and her life is. Breakfast at the desired time snatching and increase the safety to ask, and a friendly and warm heart were able to receive. A big way to the subway station and the Opera and within walking distance from the from the accessibility is wonderful :D"
Mycket trevlig lgh i centrala Paris,1,breton,sv-en,Very nice apartment in the centre of Paris
Très bon séjour chez Isabelle,1,breton,fr-en,Very good stay with Isabelle
One word: Perfect :),1,english,en-en,One word: Perfect :)
Très bon séjour chez Philippe,1,breton,fr-en,Very nice stay at Philippe
Exigeant,1,breton,fr-en,Requiring
h,4,breton,en-en,h
"아주 완벽한 숙소였습니다. 
역에서 50M?? 정도고 트램 버스 마트 아주가까워서 정말좋았습니다. 
데이비드도 친절하고 짐맞기는것도 말하면 말맞아줬습니다. 
프랑스 여행을 간다면 꼭다시 이집을 예약할거같습니다. 
",1,breton,ko-en,"A very perfect stay. 
From the station, 50 M?? Degree and tram bus Mart very close good. 
David friendly and Jim right before that it says you said right she is. 
French when you travel to the top of the back of this book you like. 
"
"房間很乾淨舒適,設備都藏在廚具櫃內 相片上看不出來 但其實非常齊全: 洗衣機 洗碗機 冰箱 烤箱 微波爐 鍋具 餐具全部都有. 地點就在Sentier地鐵站旁. 10m walk就是熱鬧的Rue Montorgueil. 房東Antoine住在附近 是個親切熱心的人 推薦附近好吃的餐廳都很棒 也給我們check in/out time最大的方便. 推薦!",1,breton,zh-en,"The room was very clean and comfortable,the equipment are hidden in the cookware Cabinet photo on See To but actually very well equipped: washing machine dishwasher refrigerator oven microwave pots and pans utensils are all there. Location, right in the Sentier metro station next to. 10m walk is the lively Rue Montorgueil. The landlord Antoine live in the neighborhood is a kind of enthusiastic person to recommend near delicious restaurants are great also to our check in/out time maximum convenience. Recommended!"
"저희가 야간이동으로 인해 오전에 도착하였는데, Gwen은 직접 짐을 맡아주었습니다. 숙소는 2개의 지하철역 사이에 있고, 중심가라 이동이 용의한 편이었습니다. 퐁피두센터가 바로 앞에 위치해 있습니다.",1,breton,ko-en,"Our night is due to arrive, Gwen is a direct burden. The hostel is 2 metro stations, Central this hotel was. The Pompidou Center is right in front of the location."
位置非常好 走路去蓬皮杜大概5分钟 离玛嘿区也很近 旁边有地铁站 3､4､11号 走路都在5分钟左右｡去城中大部分著名的地方(奥赛博物馆啊 卢浮宫啊 bon marche啊 铁塔啊)都可以走路去 都在半径3公里左右｡房间很干净 阳光很好 在一个街角 楼下不远处有超市和餐厅｡唯一缺点是没有电梯   女生提箱子上4楼有点辛苦 当然大部分巴黎市中心的老房子都没有电梯｡,1,breton,zh-en,"Very good location to walk to the Pompidou probably 5 minutes away from Ipanema Hey area is also very close to Metro Station, 3, and 4, and 11, walk 5 minutes around the House. Go to the city in the most famous places(the Orsay Museum. the Louvre. bon marche. Tower.) the can walk to everything in the radius of 3 km around the area. The room was very clean, the sun very good in a corner downstairs not far from there is supermarket and restaurant area. The only drawback is no Elevator girls suitcase on the 4th floor a little bit hard of course, most of Paris's old house has no Elevator available."
"非常乾淨和舒服,離metro只需幾分鐘路程｡",1,breton,en-en,"非常乾淨和舒服,離metro只需幾分鐘路程｡"
"위치는 진짜 좋아요 메트로로 다 연결되어있어 한번에 가기 좋습니다 숙소 전체적인 평은 가격대비 괜찮습니다
위치좋고 가격저렴하니 만족합니다 
샤워장은 안에 있으나 화장실이 밖에 있어 좀 불편한거 빼고요..숙소 머무는 몇일동안 엄청더웠는데 선풍기가 고장나 단이 그다음날 사가지고와서 고마웠어요 참 수건은 5일밤 잤는데3개씩 줬구요 세탁기없습니다 이집은 위치와 가격이 다했습니다",1,breton,ko-en,"Location real like Metro then connected once and good to go. stay, the overall rating is the staff.
Location good and price low to satisfying. 
The shower is inside but the toilet is out there, and a little uncomfortable, or take away. stay, stay for a few days a huge even was a fan failure or just that the next day and was see a towel is 5 nights slept in 3 pairs gave. washing machine. the location and the price."
tout est nickel,1,breton,fr-en,everything is nickel
Charmant,3,breton,fr-en,Charming
Très bon séjour chez Inès,1,breton,fr-en,Very good stay at Inès
Vous allez adorer !,1,breton,fr-en,You will love it !
"정말 좋은 숙소입니다^^ 
처음에는 도심이랑 너무 멀지 않을까 걱정 많이 했는데 20~30분정도면 도심으로 바로 갈 수 있어서 너무 좋더라구요! 그리고 저희는 집근처 지하철 7호선만 타고 다녔습니다 7호선에서 집까지 걸어오는데 전혀 무섭지 않아요! 집시들도 없구요 한국의 일산..?? 같은 느낌이랄까..?? 오히려 soum네 동네가 치안은 좋은거 같아요! 나중에는 여자둘이 배짱생겨서 새벽 한 시에 숙소에 들어갔답니다 ㅋㅋㅋ
7호선타면 루브르까지 바로 가고, 버스타면 몽마르트언덕까지도 바로 갈 수 있어요!!
그리고 근처에 까르푸도 있어서 매일 이곳에서 아침과 저녁을 사 먹었죠~!  Soum도 너무 친절하고 좋으신 분이에요♡ 아낌없이 추천합니다^^",1,breton,ko-en,"A really good place.^^ 
Initially, the city of love not too far away and I'm worried the lot was 20 to 30 minutes to the city center as you can go, too. And our house near subway line 7, but a ride attended. line 7 in the House walked up to it at all, not scary! Gypsies don't have one of the nitrous..?? Feel like ever..?? Rather, the soum of four neighborhood policing is like. Later in our guts play in the Dawn time in the place entered. ㅋㅋㅋ
Line 7 to the Louvre right up until, the Montmartre hill until you can go right!!
And near the Carrefour so daily in the morning and evening to eat~! Soum too friendly and nice with you♡ generously recommended.^^"
"차로 여행을 하는 사람들에게도, 아닌 사람들에게도 좋은 숙소입니다. 기본적으로 깨끗하게 관리되고 있고, 전용주차공간을 포함해서 check in/out process 도 좋습니다. 위치도 metro 가 기본인 파리에서는 매우 좋습니다. 여러가지 효율성을 고려한 여행을 생각해보면 강력하게 추천합니다.",1,breton,ko-en,"Travel by car to the people, not the people who make a good place to stay. By default, friendly staff, private Parking space, including check in/out process is also good. The location is also metro with a basic design in Paris is very good. Several efficiency considerations for a journey when you think about is strongly recommended."
Bon séjour chez,1,breton,fr-en,Good stay in
N'hésitez pas: vous ne serez pas déçu(es) !,1,breton,fr-en,Do not hesitate: you will not be disappointed(es) !
Elegant hostess,1,english,en-en,Elegant hostess
"房东人超级好,离metro出站口超级近,屋子也非常干净舒适,而且地理位置也处在市中心,比较安全",1,breton,zh-en,"Landlord people super good,from the metro outbound port super close,the room also very clean and comfortable,and the location in the city centre,relatively safe"
