comments,N,lang,en-en,comments
"Frederique je velice prijemna hostitelka, pohotove odpovida na zpravy a respektuje soukromi. Pokoj je starosvetsky dreveny, velky a s pohodlnou posteli. Ma take soukromou koupelnu (sprcha + umyvadlo, zachod je zvlast be apolecne casti). V kuchyni jsem mel k dispozici mikrovlnku, jeden regal v lednici a mohl jsem i pouzit pracku. Byt je  v bezpecne lokalite a vyhodne polozen, v okoli je hodne restauraci, baru, stanic metra i dve hlavni nadrazi, ze kterych vedou spoje na letiste CDG i Orly. Stravil jsem tu tri tydny a mohu tento but vrele doporucit.",1,czech-iso8859_2,cs-en,"Frederique is a very good hostess, - too on the news and respects privacy. The room is starosvetsky dreveny, big and with a comfortable bed. Ma take private bathroom (shower + washbasin, the restroom is seperatly be apolecne part). In the kitchen I had available a microwave, one regal in the fridge and I could even use the claw. The apartment is in a safe location and vyhodne placed over, around is a lot of restaurant, bar, subway stations and two barrel station, from which the lead connections to the airport CDG and Orly. I spent here three weeks and I can do this but highly recommend it."
Nice spot thank you,1,czech-iso8859_2,en-en,Nice spot thank you
"Děkujeme za úžasné 3 dny v okouzlujícím bytě. Je naprosto klidný, přestože se nachází v centru Paříže. Našli jsme vše v naprostém pořádku, krásně připravené k ubytování.  Z bytu je všude kousek a když se vám nechce pěšky, metro je hned za rohem. Můžeme všem jen doporučit. ",1,czech-iso8859_2,cs-en,"Thank you for an amazing 3 days in this charming apartment. It is absolutely quiet, although located in the heart of Paris. We found everything in perfect order, beautifully prepared accommodation. From the apartment it is everywhere piece and if you don't want to walk, the metro is right around the corner. We can all only recommend. "
"Ubytování bylo skvělé v blízkosti památek a hlavního centra. Veškeré potřebné vybavení bylo přímo na bytě, v blízkém okolí byli i potraviny a vše potřebné. Skvělá dostupnost metrem i RER linkou. Majitelka i když neuměla anglicky, skvěle vše vysvětlila, ukázala a vše bylo srozumitelně předáno.",1,czech-iso8859_2,cs-en,"Accommodation was great, close to sights and the main city centre. All the necessary equipment was directly on the apartment, in the near vicinity were also food and everything needed. Great access to metro and RER line. The owner although could not speak English, great explained everything, showed up and everything was clearly passed."
"Very nice host, adorable dog",1,czech-iso8859_2,en-en,"Very nice host, adorable dog"
"Perfektní domluva/vstřícnost ohledně příjezdu/odjezdu. Super lokalita, hned u metra, supermarket, obchody. Samotný byt je 4.patro bez výtahu, mohl by být problém třeba s kočárkem, nám to ale nevadilo.",1,czech-iso8859_2,cs-en,"The perfect arrangement/available on arrival/departure. Super location, right next to the subway, supermarket, shops. The apartment itself is 4.floor without elevator, it could be a problem with the stroller, we didn't mind."
nice host,1,czech-iso8859_2,en-en,nice host
"Velmi rychlá a milá komunikace. Příchod pozdě v noci proběhl v pořádku. Sandra nám poslala detailní popis, kde jsou klíče atp. Pokoj je sice velmi malý, nicméně pro přespání dostačující. Z bytu jsme došli za 15 minut na Montmartre. Celkově spokojenost! Děkujeme! :)",1,czech-iso8859_2,cs-en,"Very fast and nice communication. Arrival late at night was fine. Sandra sent us a detailed description of where the keys are, etc. the Room is very small, however for a sleepover sufficient. From the apartment we came in 15 minutes to Montmartre. Overall, satisfaction! Thank you! :)"
"Nice guy nice house
",1,czech-iso8859_2,en-en,"Nice guy nice house
"
"Předání klíčů proběhlo v pořádku,poslané vstupní kody fungovali. Byt byl velice prostorný,čistý,pěkný. Nebylo co vytknout. Velice doporučuji.",1,czech-iso8859_2,cs-en,"The handover of the keys went fine,the sent input codes worked. The apartment was very spacious,clean,nice. Been above reproach. I highly recommend it."
에펠탑과 가깝고 주변에 메트로 역이 많아 다니기 편리했습니다.,1,czech-iso8859_2,ko-en,The Eiffel Tower and close to Metro station more then was convenient.
"Dobré ubytování, čisté a bezproblémové. Dobrá lokalita",1,czech-iso8859_2,cs-en,"Good accommodation, clean and hassle-free. Good location"
Very nice place...,1,czech-iso8859_2,en-en,Very nice place...
Nice place. Very close to Louvre.,1,czech-iso8859_2,en-en,Nice place. Very close to Louvre.
"Lokalita je bezvadna a ubytovani neni v porovnani s ostatnimi drahe. Trosku me prekvapilo, ze check out byl uz v 10 hodin, ale asi zalezelo i na prijezdu nasledujicich hostu. Ralda i Alex komunikovali rychle a jejich rady a popisy, napr. jak najit byt, byly velmi uzitecne.",1,czech-iso8859_2,cs-en,"The location is really and holiday rentals it's not in porovnani with other expensive. If surprised, from the check out was already at 10 hours, but I guess zalezelo on prijezdu the next guest. Ralda and Alex communicated quickly and their advice and the descriptions, eg. how to find the apartment were very useful."
very very nice Hoster.,1,czech-iso8859_2,en-en,very very nice Hoster.
"Ubytování je na dobrém místě- téměř  úplném v centru.
Komunikace s hostitelkou byla velmi rychlá, odpovídala okamžitě.
Všechno bylo čisté. Cítila jsem se tam dobře.
Jediné co byl problém, tak jedna sprcha na velké množství lidí kdy jsem musela čekat třeba hodinu než jsem se do koupelny dostala.",1,czech-iso8859_2,cs-en,"Accommodation is in a good place - almost complete in the center.
Communication with the hostess was very fast, answered immediately.
Everything was clean. I felt good out there.
The only thing that was a problem, so one shower for a large number of people when I had to wait an hour before I to the bathroom got."
"Menší ale hezký byt, skvělá lokalita a dobrá cena. Rozhodně doporučuji :)",1,czech-iso8859_2,cs-en,"Smaller but nice apartment, great location and good price. Definitely recommend :)"
"两个房东都超级好,给了我们各种建议｡17号没位置了还专门帮我跑了两个hotel问价,为我们找房子住｡青旅地段不错,出门就是地铁站,巴黎圣母院､先贤祠､卢浮宫都可以走过去｡总之,很安心很方便的一个住处｡",1,czech-iso8859_2,zh-en,"Two landlords are super nice,gave us a variety of recommended areas. 17, no location. also specially to help me run the two hotel ask the price,as we find a house to live house. Hostel location Good,went out is Metro station,Notre Dame Cathedral, and Pantheon, and the Louvre can be went home. In short,it is peace of mind very convenient one place location."
"숙소위치가 너무 좋았고, 호스트가 매우 친절하셨습니다.",1,czech-iso8859_2,ko-en,"The hostel location is good too, and the host is very friendly......"
Very nice place !!!,1,czech-iso8859_2,en-en,Very nice place !!!
Very nice place !!,1,czech-iso8859_2,en-en,Very nice place !!
"Byt byl krásný, všechno bylo tak jak bylo v informacich. Claire byla moc milá a ochotná.",1,czech-iso8859_2,cs-en,"The apartment was beautiful, everything was just as it was in the information. Claire was very nice and willing."
"Děkujeme Marcovi za perfektní ubytování. Byt byl pro naši čtyřčlennou rodinu menší, ale pro naše potřeby stačil. S Marcem jsme se kvůli jeho pracovnímu vytížení nepotkali, ale byl k dispozici na telefonu.
Byt byl čistý a kuchyně standardně vybavená. V lednici nám Marc nechal i vychlazené pivo :-). Koupelna měla nevýhodu v tom, že se nedala větrat. 
Paříž nás uchvátila a možnost bydlet přímo v centru dění pár kroků od Eiffelovy věže v době konání fotbalového EURO2016 byla úžasným zážitkem. Pokud se někdy znovu do Paříže vypravíme, Marcův byt bude naše první volba.",1,czech-iso8859_2,cs-en,"Thank you, Marco, for the perfect accommodation. The apartment was for our family of four less, but for our needs is enough. With Marc we are because of his workload met, but was available on the phone.
The apartment was clean and kitchen as standard equipped with. In the fridge we Marc had even a cold beer :-). Bathroom had a disadvantage in that it didn't ventilate. 
Paris seizes us and the opportunity to live right in the heart of the action a few steps from the Eiffel tower at the time of the football EURO2016 was an amazing experience. If you ever get back to Paris we go, marco's apartment will be our first choice."
"very nice stay, nice apt",1,czech-iso8859_2,en-en,"very nice stay, nice apt"
"Krásný, útulný malý byt blízko centra a krásného parku. Komunikace s Elitebath byla skvělá a rychlá. ",1,czech-iso8859_2,cs-en,"Beautiful, cosy small apartment close to downtown and beautiful park. Communication with Elitebath was great and fast. "
"Čisté, dobře vybavené studio, perfektně situované. / Clean, well-equipped, perfectly located studio. / Studio propre, bien équipé et parfaitement situé.
Ke stanici metra Strasbourg - Saint Denis dojdete za pár minut, o kousek dál staví autobus, který Vás pohodlně zaveze na Gare du Nord. Pěšky za pár minut jsou dosažitelné i další linky metra, včetně Châtelet - Les Halles. Pro poznávání Paříže ideální výchozí bod. V přízemí je supermarket, v bezprostředním okolí pak minimálně další dva a pár minut chůze živá Quartier Montorgueil, kde se nachází spousta příjemných bister a restaurací. Po náročném dni jsem ocenila pohodlnou manželskou postel. Vybavení kuchyně odpovídá fotkám - kávovar, rychlovarná konvice, mikrovlnka, lednice, sporák... Vše funkční a čisté.",1,czech-iso8859_2,cs-en,"Clean, well equipped studio, perfectly located. / Clean, well-equipped, perfectly located studio. / Studio propre, bien equipped et parfaitement situé.
Metro station Strasbourg - Saint Denis can be reached in a few minutes, a short walk away is a bus stop conveniently connects at the Gare du Nord. On foot in a few minutes are attainable even for more subway lines, including the Châtelet - Les Halles. For exploring Paris an ideal starting point. On the ground floor is a supermarket, in the immediate vicinity then at least another two and a few minutes walk to the lively Quartier Montorgueil, where is located a lot of pleasant bistros and restaurants. After a busy day, I appreciated the comfortable double bed. Kitchen equipment corresponds to the photos - coffee machine, electric kettle, microwave, fridge, stove... Everything functional and clean."
"Majitelka je ochotná, vstřícná, komunikativní - hovoří málo anglicky ale nebyl to problém. Fotografie ubytování odpovídají skutečnosti. Místnost je malá, ale útulná, s velkou matrací na spaní v patře. Uvítali jsme možnost uvařit si. Lokalita parádní, nedaleko metro a památky na dosah.",1,czech-iso8859_2,cs-en,"The owner is willing, friendly, communicative - speak little English but it wasn't a problem. Accommodation photos correspond to reality. The room is small, but cozy, with great mattresses for sleeping on the floor. We welcomed the opportunity to cook. Location great, close to metro and sights within reach."
Vse jak bylo uvedeno. S pani komunikace skvela a rychla. Radi se opet vratime:-))) dekujeme,1,czech-iso8859_2,cs-en,Everything as stated. With the missus communication good and quick. But again vratime:-))) thank you
Very nice a s,1,czech-iso8859_2,en-en,Very nice a s
"vyhovující ubytování , výborně umístěné , příjemná hostitelka",1,czech-iso8859_2,cs-en,"satisfactory accommodation , very well located , nice hostess"
"Vše bylo v pořádku, bylo poslán jasný návod jak se dostat do bytu, v bytě žádný problém, pokud je zima je možné si zatopit, koupelna moderní čistá, připravte se ale že je ubytování na kopci a z každé zastávky metra je to do kopce :D",1,czech-iso8859_2,cs-en,"Everything was fine, was sent clear instructions how to get to the apartment, in the apartment no problem, if it is cold it is possible to turn up the heat, the bathroom modern, clean, prepare but it is located on a hill and from each stop of the subway is up the hill :D"
"Utulny bytecek. Ubytovani probehlo bez problemu,jen zpravy od Erika byly ve Francouzstine,ale domluvili jsme se. :) doporucuji",1,czech-iso8859_2,cs-en,"Utulny bytecek. Holiday rentals netscape was without problems,just reports from the Erika were in Francouzstine,but we agreed. :) ."
"Byt byl maličký, ale podle kamarádky, co v Paříži žije, je to běžné, takže jsem nic většího ani nečekala - hledali jsme hlavně něco na přespání, takže jsme preferovali nízkou cenu před komfortem.
Pro ty, kteří by chtěli v bytě trávit víc času bych doporučila hledat jinde, ale nám to stačilo.  Je to hned u metra, i když cesta do centra chvíli zabere a kousek od domu je i menší supermarket... Zvládli jsme si tam i uvařit jednoduché jídlo - kuchyně byla vybavená potřebným nádobím i spotřebiči.
Nabídka je sice ve francouzštině, ale Yael komunikuje i anglicky, takže domluva předání klíčů a vše potřebné proběhlo snadno.
Jediná menší nevýhoda pro páry - 2 postele nad sebou - ale věděli jsme to předem a Yael nám připravila matrace na zem, takže jsme spali spolu, jen to lůžko bylo pro 2 trochu menší.",1,czech-iso8859_2,cs-en,"The apartment was tiny, but according to a friend who lives in Paris, is it common, so I'm nothing more didn't expect - we were looking for mainly something for you, so we prefer a low price from the comfort of.
For those who would like to in the apartment to spend more time, I'd recommend looking elsewhere, but for us it was enough. It's right near the subway, even if the path to the center, it takes a while and not far from the house and a smaller supermarket... we did get there and cook a simple meal - the kitchen was equipped with necessary utensils and appliances.
The menu is in French, but Yael communicates in English, so the deal handing over the keys and everything needed was easy.
The only minor drawback for couples - 2 beds one above the other - but we knew this in advance and Yael made us a mattress on the floor, so we slept together, just that the bed was for 2 a little smaller."
"Ubytování bylo dle popisu shodné, hostitelé byli příjemní, lokalita výborná, v okolí plno restaurací i obchodů a přitom klidné místo.",1,czech-iso8859_2,cs-en,"Accommodation was according to the description of the same, the hosts were pleasant, the location excellent, in a neighborhood full of restaurants and shops and yet quiet location."
Muy bueno todo,3,czech-iso8859_2,es-en,Very good all
Very nice !!,2,czech-iso8859_2,en-en,Very nice !!
"Emma byla skvělá, nápomocná a vše šlo bez problému. Studio bylo krásné, uklizené a pro dva naprosto ideální. Krásně zařízené. Můžu jenom doporučit.",1,czech-iso8859_2,cs-en,"Emma was great, helpful and everything went without a problem. The Studio was beautiful, tidy and absolutely perfect. Beautifully furnished. I can only recommend."
Very nice place to stay,2,czech-iso8859_2,en-en,Very nice place to stay
very  nice,1,czech-iso8859_2,en-en,very  nice
"Krásný byt kousek od Montmarteru. Byt je přímo nad železniční tratí tak je třeba počítat s větším hlukem v noci, ale s tím jsem počítala a nevadilo mi to. Anida a Paolo byli velmi milý a byt byl krásný a čistý. Děkuji moc, určitě tam nejsem naposledy.",1,czech-iso8859_2,cs-en,"Beautiful apartment steps away from Montmartre. The apartment is directly above the railway tracks so it is necessary to count with more noise at night, but I can work with that and I didn't mind it. Anida and Paolo were very kind and the apartment was beautiful and clean. Thank you very much, I'm sure I'm not there for the last time."
"Byt byl krásný, čistý a na hezkém klidném místě. S hostitelkou byla skvělá domluva. Dokonce jsme si při odjezdu zapomněli v bytu Iphone a ona se s námi ihned domluvila a telefon zaslala poštou. Byly jsme víc než mile překvapení. Děkujeme!",1,czech-iso8859_2,cs-en,"The apartment was beautiful, clean and in a nice quiet location. With the hostess was a great deal. Even we at the check-out forgot in the apartment the Iphone and she is with us immediately got off the phone and the phone sent in the mail. We were more than pleasantly surprise. Thank you!"
So lovely <3,1,czech-iso8859_2,en-en,So lovely <3
"Strávili jsme v Guillaumove bytě 3 noci. Byt se nachází na opravdu skvělém místě, moc se nám v části Montmartre líbilo. V bytě bylo vše základní, co člověk k pobytu potřebuje. Trošku nás zklamalo, že jsme neměli povlecene peřiny a nenašli jsme povlak na peřinu. Ale to se dalo odpustit. Horší byla zima v bytě a k dispozici pouze malinké topení, které nebylo dostačující. První večer na manžela nezbyla tepla voda na sprchu, ale pak už jsme si dávali pozor  a vodou šetřili. Nicméně v domě byl krásný klid, nebyl slyšet žádný ruch z ulice. Přes veškeré nedostatky byt mohu doporučit, předevsim pro svou úžasnou polohu přímo u stanice metra v krásné čtvrti. Děkujeme za poskytnutí pobytu ",1,czech-iso8859_2,cs-en,"We spent in Guillaumove apartment 3 nights. The apartment is on really great location, we're in the part of Montmartre liked. In the apartment everything was basic, what person residence needs. A bit disappointed that we didn't povlecene duvets and we haven't found the coating on the duvet cover. But that's to be forgiven. Worse it was cold in the apartment and available to only a tiny heater which was not sufficient. The first night the husband left to heat water for a shower, but then we watch out and water saving. However, in the house was a beautiful calm, not to hear any of the bustle of the street. Despite all the shortcomings of the apartment I can recommend, předevsim for its amazing location right next to the metro station in a lovely neighborhood. Thank you for providing residence "
"Very nice place to stay, very new.",1,czech-iso8859_2,en-en,"Very nice place to stay, very new."
Charismatický a slunný byt na krásném místě v dobré ulici a umělecké čtvrti. Vynikající dostupnost všech klenotů Paříže. Chantal nám  poskytla řadu výborných typů  včetně map i knih. Chantal miluje umění a její  byt to jen podtrhuje. Vřele doporučuji.,1,czech-iso8859_2,cs-en,"Charismatic and sunny apartment in a beautiful location in a good street and the arts district. Excellent availability of all the jewels of Paris. Chantal has provided us with a number of excellent types, including maps and books. Chantal loves art and her apartment's highlights. I highly recommend it."
"Byt byl velice útulný a na dobrém a klidném místě, ne moc vzdáleného od metra a nádraží. Ubytovatelé byli velice vstřícní.",1,czech-iso8859_2,cs-en,"The apartment was very cozy and in a good and quiet location, not too far from the metro and train station. Ubytovatelé were very accommodating."
"Pokoj je na Pariz opravdu prostorny a s krasnym vyhledem.  Lokalita je skvela, hned vedle vstupu do Muzea d´Orsay.  Alex byl velmi prijemny a rychle reagoval na vsechny dotazy. Koupelnu jsem sdilela s Alexovou spolubydlici, ale nikdy nebyl zadny problem. Velmi pohodlne a velke postele.  Kuchyň je k dispozici po celou dobu. Pokoj se da zamknout pouze zevnitr, ale citila jsem se tam bezpecne a ani neměla pocit, že pokoj musím zamykat, když jdu pryč, ale raději na to upozorňuji, pokud to je pro někoho důležité. Můj pokoj byl čistý a uklizený, zbytek bytu může působit pro některé lidi trochu neudržovaně se starým nábytkem, ale to mi nevadilo a brala jsem to jako prostor majitele. Já byla moc spokojená a určitě se u Alexe ubytuji zase příště.",1,czech-iso8859_2,cs-en,"The room is on the Pariz really grabs, with plenty and with nice in the hotel. The location is great, right next to the entrance to the Museum dOrsay. Alex was very clean and responded quickly to all questions. Bathroom I sdilela with with alex's roommate, but he was never no problem. Very comfortable and large bed. The kitchen is available all the time. Room locks only from the inside, but I felt there safely and didn't even have the feeling that the room I have to lock the door when I go away, but rather I am pointing that out, if it's for someone important. My room was clean and tidy, the rest of the apartment can act for some people a little neudržovaně with old furniture, but it didn't bother me and I took it as a space owner. I was very happy and I'm sure Alex I'll check again next time."
"Vyborné pohoštění, paní milá, pomohla nám, vše ukázala. Jako doma ❤️",1,czech-iso8859_2,cs-en,"Excellent hospitality, mrs. nice, she helped us, everything showed up. Like home ❤️"
"Dobrá lokalita pro výjezdy a pochody k památkám. Eiffelova věž asi 10 minut pěšky. Rušná ulice, doporučuji si vzít pro horší spáče špunty do uší. Byt pěkný a pro turisty plně dostačující.",1,czech-iso8859_2,cs-en,"Good location for trips and walks to the sights. Eiffel tower about 10 minutes walk. Busy street, I recommend you take for the worse snorer earplugs. Apartment nice and for tourists fully sufficient."
"Ubytování se nám líbilo, byt byl útulný, čistý. Popis a komunikace-vše skvěle fungovalo. Velký problém jsme měli s hlukem z ulice.",1,czech-iso8859_2,cs-en,"Accommodation we liked, the apartment was cozy, clean. The description and the communication-everything worked perfectly. The big problem we had with the noise from the street."
"Byt je menší, ale je zde vše potřebné. Pro dva ideální. Nic nám zde nechybělo a s ničím nebyl žádný problém! Všude bylo čisto a uklizeno. Komunikace byla velmi dobrá, téměř okamžitá reakce na (Website hidden by Airbnb) což nás velmi mile překvapilo. Pobyt u Vladimira doporučujeme!",1,czech-iso8859_2,cs-en,"The apartment is smaller, but there is everything needed. For two ideal. Nothing here was missing and nothing was no problem! Everywhere was clean and tidy. Communication was very good, almost instantaneous reaction to the (Website hidden by Airbnb), which makes us very pleasantly surprised. Stay with Vladimir, we recommend!"
Not a,1,czech-iso8859_2,en-en,Not a
"북역 근처라서 교통 편리하고, 아파트가 넓고 조용했어요. ",1,czech-iso8859_2,ko-en,"North railway station near the traffic is convenient, the apartment is spacious and quiet. "
"Skvělý hostitel, vyjde se vším vstříc. S čímkoliv pomůže, zajímá se a je pořád na příjmu. Mně pomohl realizovat i mé nestandardní přání! :) Byt útulný, čistý a hned na metru. Mohu jen doporučit!",1,czech-iso8859_2,cs-en,"Great host, will come out with everything to meet. Anything will help and is still on the air. Helped me realize even my non-standard wishes! :) The apartment cozy, clean and right on the subway. I can only recommend!"
Úžasný pobyt. Vše velmi čisté. Krásný pokoj s vlastní moderní koupelnou. Hostitelé jsou moc milí. Rozhodně toto ubytování doporučuji při návštěvě Paříže.,1,czech-iso8859_2,cs-en,Amazing stay. Everything is very clean. Beautiful room with own modern bathroom. The hosts are very nice. Definitely this property I recommend when visiting Paris.
Very nice !,2,czech-iso8859_2,en-en,Very nice !
"S bydlením u Manon jsem byla já i moje mamka spokojená! Byt je prostorný, hezky zařízený a měly jsme k dispozici opravdu vše, co jsme potřebovaly. V bytě jsme většinou pobyly jen přes noc, kdy jsme díky velké a pohodlné posteli nabraly hodně sil, nicméně jsem přesvědčená, že by se nám u Manon líbilo, i kdybychom měly být """"""""doma"""""""" častěji. Akorát bychom mohly dostat nějaká ramínka na oblečení...
Byt je velmi dobře dostupný, cca 5 minut od metra a díky tipu na místní pekárnu jsme si ráno pochutnávaly na výborných bagetách a croissantech! Děkuji za ochotu poradit nám cokoli, co bylo třeba (doprava, tipy na restaurace...).
Doporučuji! Přístě bych volila stejně! :-)",1,czech-iso8859_2,cs-en,"With the housing market at Manon was me and my mom happy! The apartment is spacious, nicely furnished and we had available really everything we needed. In the apartment we usually pobyly just over night, when we thanks to the large and comfortable bed took a lot of manpower, however I am convinced that we in Manon liked it, even if we should be """"""""at home"""""""" more often. Only we could get some hangers for clothes...
The apartment is very easily accessible, approximately 5 minutes from the metro and thanks to a tip to the local bakery for the morning feasting on the delicious breadsticks and with croissants! Thank you for your willingness to consult us anything, what was needed (transport, tips on restaurants...).
I recommend! Next time I would opt for as well! :-)"
"Setkáni proběhlo přesne dle dohody, byt přesne zodpovída nabídce. Vynikajici poloha vedle stanice metra. Skvělé místo pro vyražení do města. Oceňuji parkovací místo v podzemní garáži. Perfektní pobyt, Thomas byl skvělý hostitel.  ",1,czech-iso8859_2,cs-en,"Meeting took place exactly according to the agreement, the apartment exactly zodpovída menu. Good location next to the metro station. A great place to plunge into the city. I appreciate the parking space in the underground garage. Perfect stay, Thomas was a great host. "
