comments,N,lang,en-en,comments
"Un petit nid fouiller douillet situé dans  appartement tranversant, très lumineux avec une fenêtre dans chaque piece! Situé au 4ème étage, sans ascenseur, même après une bonne journée de marche ne nous a pas paru pénalisant. Mais au contraire, dès l'entrée dans l'appartement,  une belle décoration, très confortable, bien équipé, un VRAI lit en 160cm digne de se nom vous, bous fera oublié les marchés montées....un vrai airbnb, où Anne nous confie son lieux de vie en toute confiance. 
Notre hôtes a été très réactive et nous a facilité notre séjour pour tous les points demandés.
Nous reviendrons chez Anne c'est sur si l'occasion se présente à nous.
 Merci encore.",1,french,fr-en,"A small nest to excavate snug located in apartment tranversant, very bright with a window in each piece! Located on the 4th floor, without lift, even after a good day of walking has not appeared penalizing. But, on the contrary, as soon as you enter the apartment, a beautiful decoration, very comfortable, well equipped, a REAL bed 160cm worthy to name you, bous will be forgotten the market climbs....a true airbnb, where Anne gives us his places of life with confidence. 
Our host was very responsive and made it easy for us our stay for all the points requested.
We will come back with Anne it is on if the opportunity presents itself to us.
Thank you again."
"Appartement spacieux, propre,clair, et calme à proximité de Montparnasse, dans un quartier vivant. Anne est très disponible. Je recommande vivement.",1,french,fr-en,"Spacious apartment, clean,clear, and calm in the vicinity of Montparnasse, in a lively district. Anne is very available. I highly recommend it."
"Merci à l’hôte pour sa ponctualité à nous accueillir et les très bonnes indications pour s'y rendre. La localisation est vraiment excellente, très centrale. Endroit très tranquille. Attention, il faut bien considérer que la photo du studio est prise avec un grand angle; les dimensions réelles sont surprenantes! L'appart est plutôt sombre, les fenêtres donnant sur cour intérieure exiguë. Rapport qualité/prix intéressant.
 ",1,french,fr-en,"Thank you to the host for his punctuality to welcome us and very good indications to get there. The location is really excellent, very central. Very quiet place. Attention, it must consider that the photo of the studio taken with a wide angle; the actual dimensions are surprising! The apartment is rather dark, the windows facing inner courtyard cramped. Price/quality ratio is interesting.
"
"Nous avons été très bien accueilli à notre arrivée. excellent timing, remise des clefs et explications des points essentiels de la procédure. Studio très calme, et sûr, en plein coeur de Paris. On sent que le propriétaire fait confiance aux occupants, ce qui est très appréciable.",1,french,fr-en,"We were very well welcomed at our arrival. excellent timing, handover of keys and explanation of the essential points of the procedure. The Studio is very quiet, and safe, in the heart of Paris. You can feel that the owner trusts to the occupants, which is very nice."
Appartement 5 sur 5 !,1,french,fr-en,Apartment 5 on 5 !
"Studio de petite taille très bien situé au coeur de Paris mais avec canapé-lit dont le matelas est de qualité médiocre, et douche dont l'accès n'est pas aisé pour obèses (que nous ne sommes pas).",1,french,fr-en,"Studio small and very well located in the heart of Paris but with a sofa-bed in which the mattress is of poor quality, and a shower whose access is not easy for obese (we are not)."
Very comfortable apartment in excellent location.,1,french,en-en,Very comfortable apartment in excellent location.
"L'appartement est idéalement situé. Il n'y a pas de bruit, ce qui est appréciable à Paris. Il y a beaucoup de poussière dans l'appartement. Désagréable, surtout pour quelqu'un qui y est très sensible. Tout le centre de Paris peut se faire à pied à partir de l'appartement, formidable. ",1,french,fr-en,"The apartment is ideally located. There is no noise, which is appreciable in Paris. There is a lot of dust in the apartment. Unpleasant, especially for someone who is very sensitive. All of central Paris can be done on foot from the apartment, great. "
"Bel appartement bien place à Paris! 
A recommander
",1,french,fr-en,"Beautiful apartment well located in Paris! 
Has recommend
"
"Nous avons eu une réponse immédiate et Franck nous attendait à l'heure dite.
L'appartement est très joli, tout à fait comme sur les photos. Propre et calme, toutes les fenêtres donnent sur des cours. Le lit est en peu petit mais très confortable et le clic-clac est très confortable également .
L'appartement est super bien situé dans le marais. Bref, que des points positifs et hautement à recommander!!",1,french,fr-en,"We had an immediate response, and Frank was waiting for us at the appointed time.
The apartment is very nice, quite like on the pictures. Clean and quiet, all windows overlook on the course. The bed is little bit small but very comfortable and the sofa bed is very comfortable also .
The apartment is super well located in the marais. In short, that points positive, and highly recommend!!"
"Franck est trés discret dans son accueil et j'ai apprécié la confiance qu'il nous à fait .L'appartement était conforme à nos attentes même plus. Propreté, pratique, confort, rien ne manquait. Nous avons été enchanté. Quartier agréable calme. Pour une première expérience airbnb c'est une réussite. Merci",1,french,fr-en,"Franck is very discreet in her home and I enjoyed the trust that he has us .The apartment was in line with our expectations even more. Clean, convenient, comfortable, nothing was lacking. We have been delighted with it. Nice neighborhood quiet. For a first experience with airbnb it was a success. Thank you"
"Je suis allée, avec mon papa, à  Paris pour passer qqs jours. J’avais habité a Paris qqs années et j’ai choisi l’appart car il est dans un quartier magnifique. L’appart était conforme à la description et à nos attentes. L’appart est très confortable et très propre. La communication avec Franck était parfaite. On recommande l’appart sans doute.  ",1,french,fr-en,I went with my dad to Paris to spend a few days. I had lived in Paris a few years ago and I chose the apartment because it is in a neighborhood beautiful. The apartment was conform to the description and our expectations. The apartment is very comfortable and very clean. The communication with Franck was perfect. We recommend the apartment without a doubt. 
"Nous avons passé un très bon moment en famille dans l'appartement de Franck! Le point le plus positif est sans doute sa location qui est tout simplement parfaite pour découvrir Paris. En plus, le métro est à quelques pas.. L'appartement à beaucoup de cachet et est bien tranquille malgré le fait que nous y étions pendant la finale de l'EURO! ",1,french,fr-en,"We spent a very good time with the family in the apartment of Franck! The best thing is without doubt its location which is simply perfect to discover Paris. In addition, the metro is walking distance.. The apartment with lots of character and is very quiet despite the fact that we were there during the final of the EURO! "
"La localisation de ce logement est excellente, près de tout, mais puisqu'il donne sur la cours intérieure c'est très calme la nuit. Nous avons beaucoup aimé notre séjour. Quelques petites choses pourraient être améliorées pour rendre le séjour plus confortable:
- le divan lit grince énormément ce qui rend le sommeil difficile.
- il faisait très froid pour nos premiers jours à Paris et le chauffage électrique ne fonctionnait pas dans le salon.
- la douche ne semble plus couler comme le disait les commentaires précédents, toutefois elle est un peu sale et la pomme de douche serait vraiment à changer.
Sinon nous n'avons rien à redire!",1,french,fr-en,"The location of this accommodation is excellent, close to everything, but since it overlooks the inner courtyard it is very quiet at night. We loved our stay. A few small things could be improved to make the stay more comfortable:
- the sofa bed squeaks a lot which makes it difficult to sleep.
it was very cold for our first few days in Paris, and the electric heating was not working in the living room.
- the shower does seem more run down as was said by the previous comments, however it is a little dirty and the shower head would really change.
Otherwise we have nothing to complain about!"
"Appartement très bien situé dans Paris, au calme, bien équipé, et avec du charme",1,french,fr-en,"Apartment very well located in Paris, in a quiet, well-equipped, and charming"
Frank est beau et gentil Il a bien explique tout!  L'appart est propre et bien situe. Voila voila voila~ On reviendra,1,french,fr-en,Frank is handsome and kind He well explains everything! The apartment is clean and well located. Voila voila voila~ We will come back
"Nous avons été accueillis par une personne extrêmement chaleureuse, attentive et prévenante, qui a tout fait pour faciliter notre installation, notre séjour et le rendre agréable. L’appartement est idéalement situé, dans un quartier vivant et pratique, à proximité des centres actifs de Paris (transport en commun, accès à pied) - dans une rue calme et silencieuse.   
Tout ce que nous pouvions attendre à partir de la description était là, et même davantage, dans les meilleures conditions de fonctionnement et d'accès. Nous avons particulièrement apprécié la prévenance et le dynamisme de notre hôte.  ",1,french,fr-en,"We were greeted by an extremely warm, attentive and caring, who has done everything to facilitate our installation, our stay and make it enjoyable. The apartment is ideally located, in a lively area and convenient, close to the active centres of Paris (public transport, access on foot) - in a quiet street and very quiet. 
Everything we could have expected from the description was there, and even more, in the best conditions of operation and access. We particularly appreciated the thoughtfulness and dynamism of our host. "
Nous avons fait un voyage fantastique. Le logement était bien situé et très propre. Un endroit à retourner.,1,french,fr-en,We had a fantastic trip. The accommodation was well situated and very clean. A place to return to.
"Ce logement est un pied à terre idéal pour découvrir les charmes de Paris. Logé dans une ruelle assez tranquille, il est près de nombreux services et bien desservi par les transports en commun. 
Elisabeth a bien communiqué avec nous avant notre arrivée et nous a fait un accueil chaleureux et informatif. ",1,french,fr-en,"This accommodation is an ideal base for discovering the charms of Paris. Housed in a lane fairly quiet, it is close to many services and well connected by public transport. 
Elisabeth has communicated well with us before our arrival and gave us a warm welcome and informative. "
"Un accueil chaleureux et personnalisé, Elisabeth vous êtes une hôte exceptionnelle. Chez Elisabeth, tout est parfait. Un petit nid douillet, parfaitement équipé, très bien situé. Un endroit idéal pour passer quelques jours à Paris. Je reviendrai. Encore merci Elisabeth pour cette semaine.",1,french,fr-en,"A warm and personal welcome, Elisabeth you're a host exceptional. In Elizabeth, everything is perfect. A small cosy nest, fully equipped, very well located. A perfect place to spend a few days in Paris. I will be back. Thank you again Elizabeth for this week."
Tout était parfait. Nous avons été très bien accueillis. Nous avons reçu immédiatement toutes les informations nécessaires pour notre séjour dans l'appartement (mode d'emploi etc.). Nous avons aussi reçu de très bonnes informations coté visites dans Pari. Merci encore Pascal pour ce beau séjour.,1,french,fr-en,Everything was perfect. We have been very well received. We have received all the necessary information for our stay in the apartment (instructions etc). We have also received very good information next tours in Bet. Thank you again Pascal for this beautiful stay.
"Même si nous ne sommes restés qu'une nuit, nous avons pleinement apprécié ce séjour parisien :) L'appartement est très bien situé, joliment décoré et spacieux. Pascal a été un hôte vraiment sympa et accueillant, il met tout de suite à l'aise, c'est un plaisir ! Merci beaucoup pour ce séjour, on reviendra sûrement !!",1,french,fr-en,"Even if we only stayed one night, we fully enjoyed this stay in paris :) The apartment is very well located, nicely decorated, and spacious. Pascal has been a host really friendly and welcoming, he puts them immediately at ease, it is a pleasure ! Thank you very much for this stay, we will come back surely !!"
"Week-end impeccable chez Pascal. Accueil très sympa, appartement agréable et bien situé. À refaire sans hésiter!",1,french,fr-en,"Weekend flawless in Pascal. Welcome, very nice, apartment nice and well located. To remake without hesitation!"
"Merci à Pascal pour l'accueil génial, les confitures maison, et les deux super chambres en enfilade. L'appartement est idéalement situé, non loin du boulevard Richard-Lenoir, dans un immeuble charmant, et très parisien (pour les étrangers : c'est très typique, et au 5ème sans ascenseur :-). Nous reviendrons sans hésitation dans ce havre de paix, très calme et décoré avec un goût sûr. Bravo.",1,french,fr-en,"Thanks to Pascal for the home great, home-made jams, and two super rooms in a row. The apartment is conveniently located, not far from the boulevard Richard-Lenoir, in a building charming, and very parisian (for foreigners : it is very typical, and the 5th without elevator :-). We will return without hesitation in this haven of peace, very quiet and decorated with a sure taste. Bravo."
Nous avons passé une nuit chez Pascal. L'appartement est bien situé et très bien équipé. Le petit déjeuner inclus est un must. Merci!,1,french,fr-en,We spent one night in Pascal. The apartment is well located and very well equipped. The breakfast included is a must. Thank you!
"Experience ideale, Super accueil, super appartement, un vrai petit nid au milieu de Paris, Pascal est vraiment charmant et très disponible. Un grand merci, au plaisir!",1,french,fr-en,"Experience ideal, Super host, super apartment, a true little nest in the middle of Paris, Pascal was really lovely and very available. A big thank you, to the pleasure!"
"Très bon accueil de Pascal, disponible, présent à notre arrivée.
Appartement confortable, bien situé et très calme, parking à 500m.
Nous avons apprécié le petit déjeuner, il y a vraiment tout ce qu'il faut pour bien démarrer la journée!
Nous y avons passé une seule nuit mais c'est une adresse que nous retenons. Merci!",1,french,fr-en,"Very good reception of Pascal, available, present to our arrival.
Comfortable apartment, well located and very quiet, parking at 500m.
We enjoyed the breakfast, there really is everything you need to start the day!
We spent a single night but it's an address that we remember. Thank you!"
"Nice Stay in """"le 11ème"""" Still Alive et ô combien vivant
A deux pas de toute comodité citadine
Disponibilité totale, Merci.
Le silence en prime une fois fermés portes et fenêtres 
Encore merci de votre hospitalité
Luigi
",1,french,fr-en,"Nice Stay in """"11th"""" Still Alive and oh-so-living
Has two not of any comfort city
Total availability, Thank you.
The silence bonus once closed the doors and windows 
Thank you again for your hospitality
Luigi
"
"Weekend parisien au top dans l'appartement de Pascal, très sympathique, disponible et arrangeant! Très bien situé (à 2 pas des arrêts Parmentier, Richard Lenoir et Oberkampf) propre et agréable, avec un balcon tout mignon... En plus, petite attention qui fait plaisir, tout le nécessaire pour le petit déjeuner est fourni, avec une confiture à la rhubarbe juste délicieuse...
Bref, je le conseille vivement et j'y retournerai avec plaisir! Merci Pascal!",1,french,fr-en,"Weekend in paris at the top in the apartment of Pascal, very friendly, available and accommodating! Very well located (2 stops Parmentier, Richard Lenoir and Oberkampf) clean and nice, with a balcony cute... In addition, little attention and it is a pleasure, everything needed for breakfast is provided, with a jam to the rhubarb just delicious...
In short, I highly recommend and I will return with pleasure! Thank You Pascal!"
Notre hôte Pascal nous a accueilli à notre arrivée.  Il était très sympathique et polit. Très joli cartier.  Prêt de tout.  L'appartement était bien aménagé.  Une épicerie à quelques pas seulement.  L'appartement ressemble à ce qu'on peut retrouver sur le Plateau Mont-Royal à Montréal.  Très satisfaite de notre séjour!,1,french,fr-en,Our host Pascal welcomed us at our arrival. He was very friendly and polit. Very nice cartier. Ready everything. The apartment was well appointed. A grocery store only a few steps away. The apartment looks like what you can find on the Plateau Mont-Royal in Montreal. Very satisfied with our stay!
"Pour un séjour de 3 jours a Paris en famille, l'accueil par Pascal a été chaleureux et très sympa. Il a été super flexible pour notre arrivée tard le soir et il a tout fait pour que nous nous sentions à l'aise dans son appart. L'appart est très bien situé dans un quartier sympa, bien vivant mais pas trop agité ni bruyant. Pascal nous a indiqué plusieurs restos sympa a deux pas, on en a essayé deux, on a vraiment pas été déçus. 
L'appart est propre, ambiance bien parisienne, proche du métro. Convient parfaitement pour un agréable séjour a Paris.",1,french,fr-en,"For a stay of 3 days in Paris with the family, the host Pascal was warm and very pleasant. He was super flexible for our arrival late in the evening and he did everything to make us feel comfortable in his apartment. The apartment is very well located in a great neighbourhood, very much alive, but not too restless or noisy. Pascal has shown us several friendly restaurants two steps, we tried two, there has really not been disappointed. 
The apartment is clean, the atmosphere is very parisian, close to the metro. Perfectly suited for a pleasant stay in Paris."
"L'appartement de Pascal est super bien placé et les deux chambres avec charme et joliment décorées. Il y a même un grand balcon pour des jours plus chauds... Tout est calme et on a assez de place pour les affaires personnels. Pascal a été extrêmement gentil et on même temps très relax et nous faisant confiance. En somme, cela nous a beaucoup plu. Dans la rue, plein de petits bars, bistrots, laverie, supermarché, du Paris pur!",1,french,fr-en,"The apartment of Pascal is super well placed and the two rooms with charm and beautifully decorated. There is even a large balcony for warmer days... All is calm and we have enough space for personal belongings. Pascal was extremely nice and same time very relaxed and we trust. In sum, this we enjoyed very much. In the street, full of small bars, bistros, laundry, supermarket, Paris pure!"
"Excellent, tout était parfait!!",1,french,fr-en,"Excellent, everything was perfect!!"
"Très bon accueil, central, bien équipé à recommander

",1,french,fr-en,"Very good reception, central, well-equipped to recommend

"
"Excellent accueil, appartement très confortable 
Je recommande ",1,french,fr-en,"Excellent reception, very comfortable apartment 
I recommend "
Accueil chaleureux et appartement bien situé et très agréable. A recommander.,1,french,fr-en,Warm welcome and the apartment well located and very nice. Has recommend.
"Pascal est un hôte vraiment accueillant et disponible. Appartement coquet, très propre et charmant. On a envie de revenir ",1,french,fr-en,"Pascal is a host really friendly and available. Apartment charming, clean and very charming. We want to come back "
"Notre séjour s'est très bien passé ! L'appartement est très confortable.
Les petits services (de quoi petit déjeuner par exemple) sont un vrai plus !!
Je le recommande fortement !",1,french,fr-en,"Our stay went very well ! The apartment is very comfortable.
The small services (what breakfast for example) are a real plus !!
I highly recommend it !"
"Logement bien situé, très agréable. Lumineux et bien aménagé avec du mobilier de qualité. La terrasse est un réel plus même pour les mois d'hiver.",1,french,fr-en,"Accommodation well-located, very pleasant. Bright and well furnished with quality furniture. The terrace is a real plus even for the winter months."
"Bel appartement spacieux, propre et très bien situé. J'ai passé un bon séjour et Pascal a été de bon conseil.",1,french,fr-en,"Beautiful, spacious apartment, clean and very well located. I have spent a good stay and Pascal has been good advice."
"L’appartement est exactement comme décrit dans l’annonce. Appartement spacieux, lit confortable, emplacement de premier choix pour aller boire un verre, pour y manger et profiter de la vie parisienne tout en étant au calme et bien se reposer. Merci beaucoup et bonne continuation. je recommande",1,french,fr-en,"The apartment is exactly as described in the ad. Spacious apartment, comfortable bed, location first choice to go for a drink, to eat there and enjoy the life in paris while being quiet and a good night's rest. Thank you very much and good luck. I recommend"
"Accueil impeccable, le quartier est sympas, facile d'accès. Immeuble très calme",1,french,fr-en,"Impeccable welcome, the neighbourhood is nice, easy access. Very quiet building"
"Hôte charmant et disponible. Logement très bien tenu, literie très confortable !!! Idéal pour recharger les batteries après de longues journée de marche dans Paris.",1,french,fr-en,"Charming host and available. Housing very well kept, bedding very comfortable !!! Ideal to recharge batteries after long day of walking in Paris."
L'appartement de Pascal est impeccable. Il est lui même très sympa. Nous étions venu pour le travail et nous n'avons trop pu visiter mais le quartier à l'air assez animé même si l'appartement lui est au calme. Je recommande.,1,french,fr-en,"The apartment of Pascal is impeccable. He himself is very nice. We were ripe for the work, and we have not too been able to visit but the neighborhood looks pretty lively even if the apartment is quiet. I recommend."
"Réactivité, excellent accueil, attentions pour le petit déjeuner, convivialité : merci aux Pascal pour leur accueil !
L’appartement est très confortable bien aménagé et proche de tout. De nombreux conseils et explications de nos hôtes.
Je recommande, allez-y les yeux fermés !",1,french,fr-en,"Reactivity, excellent care, attention to the breakfast, friendliness : thanks to Pascal for their hospitality !
The apartment is very comfortable well appointed and close to everything. Many tips and explanations of our hosts.
I recommend, go there with your eyes closed!!!"
"Merci à Pascal, pour sa gentillesse et son hospitalité. Notre séjour etait parfais.",1,french,fr-en,Thank you to Pascal for his kindness and hospitality. Our stay was perfect.
Nous avons été très bien accueillis par Pascal qui était très réactif par téléphone ce qui fut appréciable compte tenu de notre horaire d'arrivée évolutif. L'appartement est très agréable. Pascal avait préparé tout ce qu'il fallait pour le petit-déjeuner de sorte que nous n'avons pas eu à nous en occuper. Je recommande cette adresse.,1,french,fr-en,We were very well greeted by Pascal who was very responsive by phone and this was significant given our arrival time changing. The apartment is very nice. Pascal had prepared everything we needed for breakfast so that we didn't have to deal with. I recommend this address.
"Appartement très sympathique avec vue dégagée sur les toits de Paris.  Excellent quartier, central et à explorer.",1,french,fr-en,"Apartment very nice with views over the rooftops of Paris. Excellent neighborhood, central and explore."
L'appartement est parfaitement conforme aux descriptions et aux (Website hidden by Airbnb) merveilleusement placé. La disponibilité et la gentillesse naturelle de Pascal sont un atout supplémentaire pour rendre votre séjour agréable. A recommander absolument.,1,french,fr-en,The apartment is perfectly consistent with the descriptions and (Website hidden by Airbnb) wonderfully placed. The availability and the natural friendliness of Pascal are an additional asset to make your stay pleasant. Highly recommended.
"Pascal est accueillant, chaleureux, et professionnel. L’appartement était propre et Pascal nous a permis de déposer nos valises avant l’heure d’arrivée prévue, ce qui était super utile. Par-dessus tout était le balcon avec une très belle vue sur Paris. On a décidé de se passer d’un restaurant pour profiter du soleil et un peu de vin et de fromage. Un rêve parisien devenu réalité.",1,french,fr-en,"Pascal is friendly, warm, and professional. The apartment was clean and Pascal allowed us to drop off our luggage before the scheduled time of arrival, which was super helpful. Above all was the balcony with a beautiful view on Paris. We decided to go to a restaurant to enjoy the sun and a little wine and cheese. A parisian dream become a reality."
