comments,N,lang,en-en,comments
"Byteček bych malinkatý, ale útulný, krásný a čístý! Lokalita byla účasná - centrum Paříže bylo na dochod. Lise jsme sice potkali, ale vše proběhlo bez problémů, byla stále na telefonu a pomohla nám se vším, ším jsme potřebovali. Až pojedu znovu do Paříže, rozhodně se ubytuji zase u Lise!",1,czech-iso8859_2,cs-en,"Apartment I'd a little tiny, but cozy, beautiful and clean! Location was účasná - the center of Paris was on the survivor benefits from social security. Lisa, we met but everything went without problems, was still on the phone and helped us with everything our we needed. When I go again to Paris, definitely check back with Lisa!"
"Very Nice flat, very nice host!",1,czech-iso8859_2,en-en,"Very Nice flat, very nice host!"
A nice house,1,czech-iso8859_2,en-en,A nice house
"Perfektní ubytování v srdci Paříže, kousek od Eiffelovy věže a všech zásadních monumentů, které jsou odsud v pěším dosahu. 
Servis ubytování byl naprosto profesionální s v ničem si nezadal s luxusním hotelem. Rovněž perfektní snídaně, příjemná živá ulice s výhledem na osázené stromy a naproti krásný kamenný dům z počátku 20. století. Pokoj prostorný a čistý, permanentní recepce 24/24, zkrátka maximální spokojenost. Díky moc!",1,czech-iso8859_2,cs-en,"Perfect accommodation in the heart of Paris, steps away from the Eiffel tower and all the major monuments, which are here within walking distance. 
Service accommodation was completely professional with in anything you did not enter with a luxury hotel. Also the perfect breakfast, pleasant lively street with views of the planted trees and across a beautiful stone house from the early 20th. century. Room spacious and clean, permanent reception 24/24, just maximum satisfaction. Thank you so much!"
Very Nice place.,1,czech-iso8859_2,en-en,Very Nice place.
Very nice hosta,1,czech-iso8859_2,en-en,Very nice hosta
Thank you so much,1,czech-iso8859_2,en-en,Thank you so much
"如果我还会去巴黎,我一定会继续住这个公寓的,我必须好好的推荐给我身边的任何要去巴黎的朋友,首先,JOSS是一个很绅士的人,我们的火车晚点了一个小时,他在公寓里面等了我们超过一个小时;第二,公寓的地段很好,离地铁站只有五分钟的距离,在路上还能看到荣军院;第三,公寓客厅的阳台､厨房､卧室都能看到很完整的铁塔｡没想到我们在那么靠近出发的时间能租到如此漂亮的公寓,在巴黎的旅程中,是一个最完美的回忆;第四,公寓很新,东西很整齐很干净,我们在公寓里面做早餐吃,一切都很美好;第五,公寓的周边有超市､酒吧､餐厅､咖啡厅,满足我们的所有要求｡",1,czech-iso8859_2,zh-en,"If I would go to Paris,I will definitely continue to live in this apartment,I have good recommend to me any to go to Paris Friends,First of all,JOSS is a very gentleman person,our train was late one hour,he is in the apartment inside the US for more than an hour;the second,the apartment's location is very good,from the subway station only five minutes away,on the road also can see the Invalides;third,apartment living room balcony, and kitchen, and bedroom are all able to see the very complete Tower House. Didn't think we were in so close to departure time to be able to rent such a beautiful apartment,in the Paris of the journey,is one of the most perfect of memories;fourth,the apartment is very new,something very neat and very clean,we were in apartments which do eat for Breakfast,everything was wonderful;the fifth,the surrounding Have supermarket and bars and restaurant, and cafe,to meet all of our requirements as well."
진짜 좋아요. 역세권에 친절하고 안전해요 깔끔하고,1,czech-iso8859_2,ko-en,Real good. The rights in a friendly and safe to clean
Lovely place & nice service.,1,czech-iso8859_2,en-en,Lovely place & nice service.
Yannick is a very nice host,1,czech-iso8859_2,en-en,Yannick is a very nice host
Všetko bolo také ako na fotkách. Pekná a utulná izba. Blízko zastávky metra.,1,czech-iso8859_2,sk-en,Everything was like on photos. Nice and utulná room. Close to the rebibbia metro.
Hostitelé byli úžasní a velmi ochotní. Byt byl velmi malebný a byl na krásném místě. Byla jsem opravdu velmi spokojena. A všem doporučuji.,1,czech-iso8859_2,cs-en,The hosts were amazing and very helpful. The apartment was very quaint and was in a beautiful place. I was really very satisfied. And to all I recommend.
Přijeli jsme s přítelkyní až kolem 23hod a hostitel na nás čekal přímo na bytě. Byl maximálně ochotný a milí. Byt je ve výborném stavu. Není si na co stěžovat. Rozhodně doporučujeme!,1,czech-iso8859_2,cs-en,We arrived with my girlfriend until around 23hod and the host was waiting for us right at the apartment. He was the most helpful and nice. The apartment is in excellent condition. Not much to complain about. Definitely recommended!
Místo je na skvělém místě! Dostanete se všude a rychle. Ubytování moc příjemné.,1,czech-iso8859_2,cs-en,The place is in a great location! You get everywhere fast. Accommodation very pleasant.
Great stay n a nice hotel.,1,czech-iso8859_2,en-en,Great stay n a nice hotel.
Very Nice stay.,1,czech-iso8859_2,en-en,Very Nice stay.
"Moc krásný, prostorný a čistý byt ve vynikající lokalitě. Bezproblémová komunikace s hostiteli. Můžeme vřele doporučit.",1,czech-iso8859_2,cs-en,"Very beautiful, spacious and clean apartment in an excellent location. Hassle free communications with the host. We can highly recommend."
Very nice stay :),1,czech-iso8859_2,en-en,Very nice stay :)
nice lovely home,1,czech-iso8859_2,en-en,nice lovely home
Byly jsme moc spokojeni. Zázemí pro dvě děti vyborne. Příjemné prostředí. Děkujeme a doporučujeme.,1,czech-iso8859_2,cs-en,We were very satisfied. Background for two children awesome. Pleasant environment. Thank you and we recommend.
Děkujeme moc za ubytování. Velice blízko Tour Eiffel. Hezke klidne misto. V okolí vse co potřebujete. Rodina pohostinna a příjemný lidi. Paříž je misto které doporučuji navštívit a tímto děkuji Christophe za možnost využít jeho bydlení pro nás.,1,czech-iso8859_2,cs-en,Thank you very much for the accommodation. Very close to Tour Eiffel. Nice quiet place. Around everything you need. Family pohostinna and friendly people. Paris is a place that I recommend to visit and this thank you Christophe for the opportunity to take advantage of its housing for us.
"用中文來甶言比較公道一點,始終在表達上更準確｡
如果你是第一次來巴黎,這個公寓實在是非常好的選擇,原因在於它的選址｡每個第一次來巴黎的人,通常擔心的是治安問題,住在這個區則完全沒有治安上的擔憂｡第二是言語不通,而JOHN的這個公寓處於遊客區的中心,附近所有商戶用英語溝通也是毫無困難的｡第三是對外的交通,常聞言道巴黎的地鐵往往令人有不快的經歷,但因為這個公寓附近的巴士線四通八達,五日的旅程我一次地鐵也沒有坐過,這也是我在入住前的考慮｡
誠言,這個公寓的價格是有一點高,但在其配套上也是值得起這個價錢｡",1,czech-iso8859_2,zh-en,"With Chinese Fu word fair point,always expressed on a more accurate location.
If you are first time to Paris,this apartment is really very good choice,because it is the location of the House. Each of the first to the Paris of people,usually worried about security issues,with a stay in this area there is no security concerns as well. The second is a speech not,and JOHN of this apartment is in a swim-off area of the center,near all businesses to communicate in English is also without difficulty. Third is the outbound traffic,very 闻言 know the Paris metro often be a unpleasant experience,but because this apartment is near the bus lines extending in all directions,five day journey I once Metro also did not sit through,this is also my check in front of the considered area.
Honest statement,this apartment price is a little high,but in its package is worth the price of the House."
M é muito amável,1,czech-iso8859_2,pt-en,M is very kind
"Krásný byt, dobrá lokalita a moc hodný pan hostitel. Děkujeme za příjemný pobyt! Všem můžu doporučit!",1,czech-iso8859_2,cs-en,"Beautiful apartment, good location and very good mr. host. Thank you for a pleasant stay! All I can recommend!"
"Byt je krásný,malý a romantický na nádherném místě.Stanice metra je za rohem,obchod s jídlem naproti.Byli jsme velmi spokojeni.",1,czech-iso8859_2,cs-en,"The apartment is beautiful,small and romantic on the beautiful place.Metro station is around the corner,grocery store across the street.We were very satisfied."
"这个地方交通方便,离卢浮宫也不远,you j走路即可到达｡附近有很多吃饭的地方｡不过房间里面没有电视｡",1,czech-iso8859_2,zh-en,"This place is convenient,the center of Paris is also not far,you j walk you can reach the area. Nearby there are many places to eat as well. But inside the rooms have no TV's."
Nice stylish place,2,czech-iso8859_2,en-en,Nice stylish place
Had a nice stay,2,czech-iso8859_2,en-en,Had a nice stay
We had a nice stay.,1,czech-iso8859_2,en-en,We had a nice stay.
Fantastic place. Perfect stay. Thank you ;-),1,czech-iso8859_2,en-en,Fantastic place. Perfect stay. Thank you ;-)
"Ok
",1,czech-iso8859_2,en-en,"Ok
"
"Ubytování  splnilo naše očekávání k našim požadavkům, co se dostupnosti metra i jichých míst týče. Kominikace s majitelem byla skvělá. I co se vybavení a čistoty týče, bylo vše v pořádku. Toto ubytování doporučujeme.",1,czech-iso8859_2,cs-en,"The accommodation fulfilled our expectations to our requirements, what is the availability of metro and jichých places. Communication with the owner was great. And what are the facilities and cleanliness is concerned, everything was fine. This property we recommend."
nice hotel,2,czech-iso8859_2,en-en,nice hotel
Was very nice stay,1,czech-iso8859_2,en-en,Was very nice stay
"Zajímavé ubytovani, doporučuji.",1,czech-iso8859_2,cs-en,"Interesting location, I recommend."
lovely stay!,1,czech-iso8859_2,en-en,lovely stay!
Very nice apt.,2,czech-iso8859_2,en-en,Very nice apt.
"Skvělé ubytování kousek od centra Paříže, velmi hezký byt odpovídající prezentovaným fotografiím a k tomu příjemný hostitel. Díky, Clément!",1,czech-iso8859_2,cs-en,"Great location not far from the centre of Paris, very nice apartment corresponding to the presented photos and a pleasant host. Thanks, Clement!"
Výborná lokalita v prvním pařížském arrondissementu - v okolí nepřeberné množství asijských (zejména korejských a japonských restaurací). Pěšky blízko také k grands boulevards.,1,czech-iso8859_2,cs-en,Excellent location in the first district of paris arrondissement of paris - in the vicinity of a plethora of asian (especially Korean and japanese restaurants). Walk also close to the grands boulevards.
"窗外就是铁塔的照片不是在这所公寓里拍摄的,需要把大半个身子伸出窗外才可看见铁塔｡厨房､卫生间设施很好,客厅的装潢很适合拍出美美的照片,但卧室就立刻简朴很多｡总体来看相较于我们住过的其他B&B,这一间性价比是最低的｡的确是非常安静安全的街区,附近就有小型超市,步行至地铁站大约七分钟｡管家Roseby很亲切热情,询问并帮我们预约好了退房日去机场的出租车｡",1,czech-iso8859_2,zh-en,"Outside the window is the Eiffel Tower photo is not in the apartment shooting,need to put half his body out the window only to see the tower house. Kitchen and toilet facilities very good,the living room decor is very suitable for take beautiful photos,but the bedroom is immediately simple many areas. Overall compared to we have ever stayed in other B&B,the room price is the lowest. Is indeed very quiet and safe neighborhood,nearby there is a small supermarket,walking distance to Metro station is approximately seven minutes as well. Butler Roseby very friendly,ask and get us an appointment the check-out day to go to the airport taxi area."
Skvělá lokalita. Jonathan byl ochotný a vždy rychle komunikoval. Mohu doporučit.,1,czech-iso8859_2,cs-en,Great location. Jonathan was helpful and always quick to communicate. I can recommend it.
Wifi is a problem.,1,czech-iso8859_2,en-en,Wifi is a problem.
"Good, but you could not cook",1,czech-iso8859_2,en-en,"Good, but you could not cook"
Really nice hostal.,1,czech-iso8859_2,en-en,Really nice hostal.
Nice hostel!,1,czech-iso8859_2,en-en,Nice hostel!
"Skvělá lokalita, centrum Latinské čtvrti, značnou část centra zvládnete pěšky.
Živé okolí, hlučné prostředí, ideální pro mladé páry, méně vhodné pro rodiny s dětmi.
",1,czech-iso8859_2,cs-en,"Great location, center of the Latin quarter, a considerable part of the centre you can do on foot.
Live the surrounding, noisy environment, ideal for young couples, less suitable for families with children.
"
Very nice place to stay.,2,czech-iso8859_2,en-en,Very nice place to stay.
Perfect stay! Very nice Host :),1,czech-iso8859_2,en-en,Perfect stay! Very nice Host :)
"Jean的位置还是比较好｡房价位于一栋住宿楼里面,非常安静｡路对面就是家乐福,不足一分钟就可以到地铁站｡地铁站附近也有餐馆和其他超市,非常方便｡如果吹毛求疵的话,就是楼下地铁站的线路有点少哈哈｡需要走到另一个15分钟步行的地铁站去巴黎的景点,另外那个地铁站旁边有中餐馆和中超｡
房间内部和图片一样,是一个studio的户型,卫生间､厨房和客厅｡客厅的沙发床打开后很大,睡起来还是比较舒服的｡厨房的厨具非常多,但是有点陈旧和杂乱｡但还是比较干净的｡另外有一个遥控器可以控制基本客厅所有电器,感觉非常高端｡
入住时Jean的朋友帮忙完成的,虽然英文不是非常好,但是还是完成了基本的入住沟通,并留下她英文很好的儿子的联系方式如果需要帮助的话｡事实上check-out就是他帮忙完成的,答应了我们非常紧急的上午9点check-out要求,很棒｡
总的来说还是推荐推荐的一处房源,尤其对于不想花太多钱在市中心酒店的旅客｡
",1,czech-iso8859_2,zh-en,"Jean's position is still relatively good accessibility by car. The price is located in a building of the accommodation building inside,very quiet area. Across the road is the Carrefour,less than a minute to the metro station area. Metro station are also nearby restaurants and other supermarkets,very convenient location. If NIT-picking,is downstairs in the subway station of line a little bit less ha's. Need to go to another 15 minute walk from the metro station to go to Paris attractions,also the metro station is next to a Chinese restaurant and super location.
The inside of the room and the same picture,is a studio apartment,toilet, and kitchen and living room area. The living room sofa bed opens to a large,sleeping together is quite comfortable. Kitchen utensils very much,but a little stale and cluttered apartment. But still relatively clean. In addition there is a remote control can control the basic living room all appliances,feel very high-end area.
Check-in when Jean's friend to help,although English is not very good,but still completed a basic check-in communication,and leave her English is very good son to contact if you need help as well. In fact check-out is his help,promised us a very urgent 9 a.m. check-out requirements,great location.
In General it is recommended that recommended a house,especially for the Don't want to spend too much money in a city centre hotel room.
"
"주택가라 조용해 산책하기 좋아요. 
마트도 앞이라서 편했고 역에서도 에스컬레이터가 있어 좋았습니다. 

Host도 너무 친절하시고 아침 식사도 챙겨주셔서 좋았습니다. 

감사합니다. ",1,czech-iso8859_2,ko-en,"Homes have to like to walk around. 
The front of the hotel from the station escalator. 

The Host is so friendly and helpful, Breakfast very clean helpful. 

Thank you. "
Lovley hosts. Nice place :),1,czech-iso8859_2,en-en,Lovley hosts. Nice place :)
Very nice Place,1,czech-iso8859_2,en-en,Very nice Place
Very nice stay :-),1,czech-iso8859_2,en-en,Very nice stay :-)
"Vyborna lokalita,velky a prostorny byt,perfekt e vybavena kuchyn,,ale ocekavejte v noci hluk z ulice ,topenj v byte nedostatcne.",1,czech-iso8859_2,cs-en,"Great location,big and grabs, with plenty of apartment,perfekt e equipped with a kitchen, but ocekavejte at night the noise from the street ,topenj in byte nedostatcne."
"Pěkný a čistý byt přímo na metru, v přilehlém parku pěkný výhled na Paříž.",1,czech-iso8859_2,cs-en,"Nice and clean apartment right on the subway, in the adjacent park of the nice view on Paris."
"위치가 상당히 좋습니다. Versailles로 갈 수 있는 Montparnasse 역이 걸어서 5분 거리 내에 있어 거의 모든 시내 버스가 지나다니고 치안도 상당히 좋은 듯 합니다. 지내는 동안 지하철과 기차가 파업하는 바람에 기차나 지하철은 거의 이용하지 않았지만 왠만한 관광지는 버스로 갈 수 있어 문제가 되지 않았습니다.

숙소는 Host가 제공한 사진과 동일하며, 세면대가 좀 작아 세수하는데 불편한 점 외에는 숙소 자체에 불만은 전혀 없었습니다.
숙소에 세탁기는 없지만 근처에 셀프 세탁소가 있고 일반 마트도 많습니다.

숙박비도 저렴한데다가 Host인 Solal은 친근하고 Guest를 잘 배려해 주는 사람인 것 같습니다. 지내면서 궁금한 사항이나 프랑스 현지 상황에 대한 정보는 Host를 통해서 많이 얻을 수 있으니 참고하시기 바랍니다.",1,czech-iso8859_2,ko-en,"The location is fairly good. Versailles to you can go to Montparnasse station walk 5 minutes distance within has almost all the city buses or the security is also fairly good. While the subway and train strike the wind on the train or subway is almost not used, but only for the tourist bus can not have been a problem.

Stay, the Host provided the photos and the same, and the sink is a little small to my inconvenience in addition to the hostel itself, in complaint no.
Place in the washing machine but not near the self Laundry and General Mart.

Accommodation is also inexpensive Host Inn Solal is a friendly Guest and good to people. In questions, or France local situation, information about that Host through which you can get a lot."
Okay place to stay.,1,czech-iso8859_2,en-en,Okay place to stay.
Nice house!,2,czech-iso8859_2,en-en,Nice house!
"Francoise a Miriam byly velmi přátelské a milé,ochotné poradit, každé ráno jsme měli přichystanou snídani, perfektní domluva,super lokalita.Doporučujeme !!!",1,czech-iso8859_2,cs-en,"Francois and Miriam were very friendly and nice,willing to consult, every morning we had prepared breakfast, perfect deal,super location.Recommended !!!"
"Christopher je velmi milý a přátelský hostitel. Byt je čistý, uklizený s dobrou dostupností veřejné dopravy - metro se nachází pár metrů od ubytování, je tak tedy velmi jednoduché dostat se rychle a pohodlně do centra Paříže. Pobyt zde byl velice příjemný :-)",1,czech-iso8859_2,cs-en,"Christopher is very nice and friendly host. The apartment is clean, tidy with good access to public transport - metro is located a few meters from the accommodation, it is so very easy to get quickly and comfortably to the centre of Paris. The stay here was very pleasant :-)"
Very very good!!! Nice house!!,1,czech-iso8859_2,en-en,Very very good!!! Nice house!!
Very  very  nice!!,1,czech-iso8859_2,en-en,Very  very  nice!!
"Bezvadné, skromné ubytování ",1,czech-iso8859_2,cs-en,"Impeccable, modest accommodation "
see you next time,1,czech-iso8859_2,en-en,see you next time
Oklm,2,czech-iso8859_2,en-en,Oklm
Thank you very much,2,czech-iso8859_2,en-en,Thank you very much
Very nice airbnb,1,czech-iso8859_2,en-en,Very nice airbnb
Ubytování mohu vřele doporučit. Po domluvě jsme se ubytovali dříve a i v bytě jsme při odjezdu mohli zůstat déle. S Marcem byla pohodová domluva a vše bylo jak má být.,1,czech-iso8859_2,cs-en,Accommodation I can highly recommend. After the appointment we checked in earlier and even in the apartment we are at the check-out could stay longer. With Marco was a cool deal and everything was as it should be.
"Pěkný byt,skvělá dostupnost,milá komunikace.",1,czech-iso8859_2,cs-en,"Nice apartment,great availability,nice communication."
Lovely stay. Nice People :-),1,czech-iso8859_2,en-en,Lovely stay. Nice People :-)
"立地は､ﾉｰﾄﾙﾀﾞﾑ寺院がｾｰﾇを挟んですぐにあります｡
部屋の窓からは絵葉書で見るようなﾊﾟﾘの姿が目に入ります｡
大きなﾎﾃﾙだと､ﾄﾞｱを開けると長い廊下になりますが､ｱﾚｷｻﾝﾀﾞｰさんの家の場合､部屋をでるとすぐにﾊﾟﾘの空気を吸うことが出来て良かったです｡ｶﾙﾁｪﾗﾀﾝにあり､ｶﾌｪ文化を味わえます｡食事には一切困りませんでした｡すぐ近くのｶﾌｪで夜の12時に食事を終えたこともありました｡
地下鉄の駅もﾊﾞｽ停も近くにあるので､ｴｯﾌｪﾙ塔へはﾊﾞｽで行きました｡
地下鉄は車窓が楽しめないので今回は一度も使いませんでしたが､Ticket-t を近くの地下鉄の駅で買うことが出来ました｡ﾙｰﾌﾞﾙ､ｵﾍﾟﾗ座､ｷﾞｬﾗﾘｰﾗﾌｧｲｴｯﾄ､ﾏﾄﾞﾚｰﾇ寺院には歩いて行きました｡一日16ｷﾛ歩いた事もありましたが､景色が良いので歩くのにまったく苦は感じませんでした｡近くに韓国人が経営する日本雑貨の店があり､おせんべいを買うことが出来ました｡ﾊﾟﾘに行くことがあったらまたｱﾚｷｻﾝﾀﾞｰさんのところにお世話になりたいです｡英語でいろいろｺﾐｭﾆｹｰｼｮﾝを取る必要があったので英語力が必要になるとは思いました｡ﾃﾚﾋﾞがなかったので現地のﾛｰｶﾙ放送を聞きたかったのでそれはかないませんでしたが､本当に満足しました｡6月だったので暗くなるのは10時過ぎで一日を満喫できました｡",1,czech-iso8859_2,ja-en,"Location, on this support frames, the highest score that framed the temple setting I Website across quickly in some ways.
From the window of the room are picture postcard to look like a pattern you can't download the sight of my eyes on.
Large universal only, the doors opened to a long hallway there, and the album Crane the size range warning with auto brake is the home of my cases, the room is as soon as the pattern .. thanx for the app to suck in air and I was in a can. > Dial collect enough light texture. love you, and I pump enough culture to taste it. Meal trouble around the world. Near the K-edges man of the night at 12 when you finish a meal you find.
The subway station also the Buss stop is also nearby, and the engine in-app items with enough room to tower is Buss to go in it.
Subway train window to enjoy not this good, the Ticket-t near the subway station can be bought unlocked. Maybe shooter Edition gives the full experience､Last Kiss Love Live sit､gallery live Bass-D makes it Engine times, thanks､microphone work fine with the level I website temple to walk the last. Day 16 the cross walk there, the scenery is good, walk to the pain is felt the world. Near a Korean-owned Japanese grocery store there, we don't all have to buy it. Pattern I downloaded this and there was like a crane the size range warning with auto brake's on a narrow strip of land and does not have the problem. In English, I od mini screw manual what frames thanks to the front row and watching it was necessary to take the English proficiency necessary to think it. System level the best experience on our websites and from local white frames > dial heard the broadcast and wanted it did not, but really happy with it. 6 months was light not 10 o'clock in the day, guests can indulge in it."
Nice one!,1,czech-iso8859_2,en-en,Nice one!
Very nice stay.,1,czech-iso8859_2,en-en,Very nice stay.
"Krásný pobyt. Všechno bylo podle očekávání, neměli jsme žádné problémy a cena a umístění byly naprosto úžasné. Opravdu jsme si to užili. Nevýhodou bylo 6 patro.",1,czech-iso8859_2,cs-en,"Lovely stay. Everything was according to expectations, we had no problems and the price and location were absolutely amazing. We really enjoyed it. The downside was the 6 floor."
Very nicely,1,czech-iso8859_2,en-en,Very nicely
"Pěkný byt hned u metra La Chapelle. Byt je schovaný v zahradě, takže je tu klid. Hezky a prakticky zařízen a s majitelem je skvělá komunikace.",1,czech-iso8859_2,cs-en,"Nice apartment right by the metro station La Chapelle. The apartment is tucked away in the garden, so it's quiet. Nice and practically furnished and with the owner's great communication."
nice B&B,1,czech-iso8859_2,en-en,nice B&B
Thank you so much.,1,czech-iso8859_2,en-en,Thank you so much.
"Nice room, nice service",1,czech-iso8859_2,en-en,"Nice room, nice service"
Byli jsme spokojeni. Hotel jsme si vybrali orávě kvůli skvělé dostupnosti na metro a RER.,1,czech-iso8859_2,cs-en,We were satisfied. The Hotel we chose orávě due to the great accessibility to the metro and RER.
Very close to metro. Nice place to stay.,1,czech-iso8859_2,en-en,Very close to metro. Nice place to stay.
