comments,N,lang,en-en,comments
Всё отлично,1,bulgarian-iso8859_5,ru-en,Everything is fine
숙소에 늦게 도착해서 그런지 방열쇠를 받는 곳과 숙소가 떨어져 있어 고생이 심했습니다. 도착해서 방이 어딘지 찾을 때도 고생이 심했습니다.,1,bulgarian-iso8859_5,ko-en,Stay late on arrival it was a key away and stay away and play was even. Arrived in the room where you're trying to find and students.
Все отлично.,1,bulgarian-iso8859_5,ru-en,Everything is fine.
주인장이 직접사는곳이 아니어서 청소일을 해주시는 아주머니가 기다리고 있다가 키를 받고 간단한 설명을 들을수 있었습니다.(영어소통에 어려움이 있음)  룸자체는 오래된느낌이지만 생활하는데는 어려움없습니다.  2-3명이 묵기에는 좁지만 위치상의 잇점을 감안하면 충분히 머물만한곳입니다.  걸어서 5분내에 퐁네프다리 갈수있고 근처에 식당들 그리고 바로옆에 큰슈퍼있습니다.  럭셔리하진않지만 나름 파리지엥의 느낌을 살릴수있습니다.,1,bulgarian-iso8859_5,ko-en,"Most directly, Our Place is not clean to please is a very the mother is waiting there to receive the key and a brief description to them.(English communication difficulties), the room itself has an old feel, but a life that is without difficulties. 2-3 persons is very narrow, but the location of the advantage given enough to stay here. Within 5 minutes on the Pont Neuf..... we are near restaurants and right next to a large supermarket. Luxury but be aware of your beautiful Parisian feel to live."
에펠탑 꼭대기가 보이는 깨끗한 아파트 입니다.,1,bulgarian-iso8859_5,ko-en,Top of the Eiffel Tower View clean apartment.
"처음 에어비앤비를 경험해 보는 거라서 걱정이 많이 되었었는데 아구스토가 친절하게 잘 응대해줘서 4박5일동안 즐겁게 지냈다. 위치도 바스틸역과 가까워서 파리시내 어디로든 가기 좋았고 밤늦게까지도 사람들이 많이 다녀서 위험한 느낌은 없었다.
주변에 음식점도 많고 마트도 많아서 편리했고
집이 너무 특이하고 예뻐서  계속 기억에 남을 것 같다.",1,bulgarian-iso8859_5,ko-en,"First Airbnb experience that going from a lot to worry about was a Breakfast kindly well great 4 Night 5 days stay. Location Bastille in Paris, the city where all the good and until late at night is also a lot of people so dangerous I did not feel.
Around food more, even more convenient and
The house is so unusual and so continue memorable."
위치 에펠탑에서 걸어서 10분이에요.,1,bulgarian-iso8859_5,ko-en,The location of the Eiffel Tower in 10 minutes.
"생각보다 더 아늑했어요.
물론 마리가 적어 놓은 대로 계단이 많고 좁지만 그건 본인이 선택한 것이니 감수해야죠.
최대한 배려 많이 해주셔서 지내기 편했고 이것저것 챙겨주셔서 좋았습니다.
화장실 깨끗하고 저 비흡연자인데 담배냄새도 침구에서는 안났어요.
위치 매우 좋고 (버스, 지하철모두) 사람 많은 동네라 밤에 다니기도 괜찮았습니다.
가격대비 매우 만족이에요~",1,bulgarian-iso8859_5,ko-en,"Think more than cozy.
Of course, Marie is noted as stairs and narrow, but that's a personal choice that you have.
Up for consideration are the bed and had it Packed very good.
Toilet is clean and I am a non-smoker the smell of cigarettes still bedding in.
The location is very good (bus, metro all) a lot of people of neighborhood at night is also okay.
The.~"
에펠탑에서 아주 가까워서 야경 보러 가기 좋았고 숙소 바로 앞에 큰 마트가 있어서 매우 편리했음. 지하철역도 도보 5분 거리에 있고 바로 앞에 버스 정류장도 있음.,1,bulgarian-iso8859_5,ko-en,The Eiffel Tower is in very close to the night view was good and the hostel is right in front of a large have a very convenient. A subway station is a 5-minute walk and right in front of the bus.
"일단 주인 아주머니가 이웃 눈치를 굉장히 많이 봅니다. 입구에서 무거운 캐리어를 끌지 못하게 하고 들고 오라고 하는 것이 이해가 안 가요. 그리고 밤 11시 이후에 샤워하지 말라는 말은 공지사항에 없었는데, 갑자기 짜증내면서 말해서 당황했습니다. 부엌에서 요리를 하는데, 갑자기 전등을 꺼버리고 낮에 왜 전등을 쓰냐고 뭐라고 하십니다. 우리는 원래 호스트와 많은 좋은 교류를 하지만, 눈치가 보여서 그냥 조용히 있다가 왔어요. 동네는 조용하고, 방이 높아서 경치는 좋아요. 지하철도 가깝습니다. 그치만 웨 여끼가 뼐5개인찌 모류게써엽",1,bulgarian-iso8859_5,ko-en,"Once the landlady neighbor noticed very much. At the entrance a heavy carrier to attract not come, and I understand that. And 11 at night after a shower they say that the notice was not in, but suddenly irritable to say in embarrassment. In the kitchen to Cook, suddenly the lights turn off in the daytime, why the electric light to write? and what to do. We are the original host and many good exchanges but the eyes, is to just be quiet. The neighborhood is quiet, the room is high and the scenery is great. The subway is also close. But Western women feel is 뼐 5 individual bangles of all kinds to by lobe"
깨끗해서 좋았는데 조금 엄격한 면이 있어요.,1,bulgarian-iso8859_5,ko-en,Clean was nice and a bit strict there.
"위치도 좋았고, 2명이 쓰기에 적당한 방 크기 였습니다.
그러나 주방용품이 조금 부실하여서 요리를 해먹거나 하기에는 조금 불편함이 있었습니다. 호스트는 친절하고, 방도 깨끗했습니다.",1,bulgarian-iso8859_5,ko-en,"The location was also great, 2 people writing on the proper room size it was.
But kitchenware is a bit stale to cook a hammock or a little discomfort. The host is friendly, room was clean."
위치는 시내와 조금 멀지만 조용하고 깨끗해요.,1,bulgarian-iso8859_5,ko-en,The hotel is a bit far but quiet and clean.
에어비앤비 커뮤니티에 회원님의 경험을 들려주세요.,1,bulgarian-iso8859_5,ko-en,The Airbnb community member's experience.
Отлично,2,bulgarian-iso8859_5,ru-en,Well
Хорошая и недорогая квартира в центре Парижа.,1,bulgarian-iso8859_5,ru-en,A good and inexpensive apartment in the center of Paris.
방도 넓고 대부분의 물건들과 식자재들이 갖춰져있어서 정말 편했습니다. 호스트도 매우 친절하고 메트로들과 가까이 있어 접근성도 우수했습니다. 매우 안전하다고 생각이 듭니다,1,bulgarian-iso8859_5,ko-en,"The room is also wide and most of the stuff and food they stocked in really easy. The host is also very friendly and the metro and close access was excellent. Very safe, I think."
"좋은 위치 
1 층이라 이동하기도 편해요.",1,bulgarian-iso8859_5,ko-en,"Good location 
1 floor MRT."
"Прекрасная квартира в самом центре Парижа! Прекрасное расположение, магазины и кафе в шаговой доступности. Своим пребыванием здесь полностью доволен!",1,bulgarian-iso8859_5,ru-en,"Beautiful apartment in the heart of Paris! Great location, shops and cafes within walking distance. My stay here completely satisfied!"
숙소위치는 좋았어요. 지하철 2개 호선과 가까워 멀리 다니기도 편했고 동네도 조용하니 안전했습니다. 큰 마트가 가까워 편했구요. 다만 아직 집외부가 공사 중이라 에어컨이 없는데도 창문을 맘놓고 열수 없었던 점(집이 4층이었는데 4층창문 바로 옆까지 난간을 쌓고 올라와서 공사함)과 계단이 불안한데다가 한참을 올라가야 한다는 점이 아쉬웠습니다.,1,bulgarian-iso8859_5,ko-en,The hostel location was great. Subway 2 subway line and close to the far the hotel was really quiet safe. Large Mart is closer. Just yet the house and on the outside-the air conditioning doesn't have a window to the love-heat that was not the point(the house on the 4th floor was the 4th floor window right next to until I have time to build and come up in the house)and stairs to your anxiety..... one where you have to climb one that is easy to get to.
"방이 엄청 좁고 드나들기도 매우 불편합니다. 혼자 가시거나 최대 두명까지만 함께 하시는걸 추천해요. 엘리베이터가 2인승 그것도 좀 큰 백팩이 있으면 한명밖에 못들어갑니다. 방 안에 변기와 세면대가 있는데 그냥 커튼 치고 용변을 봐야하고 샤워부스도 혼자 들어가서 팔을 벌리기도 힘든 정도입니다. 
위치로서는 정말 좋아요. 나와서 조금만 걸으면 바로 개선문 있고 30분 내로 걷는 거리들에 샤요궁, 에펠탑 등등 볼게 많습니다. 주변 식당들은 많이 비싸요. 호스트가 간식은 많이 준비해주더군요. 편하게 여행하고 싶으시다면 절대 추천 안합니다. 하지만 새로운 경험을 해보고 싶은 분들께는 추천! 
-식기, 컵 별로 안깨끗
-용변 보기 불편 (문앞 복도에 공용 변기 하나 더 있음)
-엘리베이터 좁음, 샤워부스 매우 좁음",1,bulgarian-iso8859_5,ko-en,"The room is enormous and narrow making it very uncomfortable. Alone or up to two up with only one. The Elevator is a 2 seater and a large backpack if you have one other nail in. In the room with toilet and washbasin there is just a curtain treatment and to have a look to shower alone, even in arms so difficult. 
The location in really good. And in just the right arc and 30 minutes walking distance from Chateau Palace, the Eiffel Tower etc see more. The surrounding restaurants are more expensive. The host treats a lot of preparation for me. Convenient if you want to travel absolutely recommended. But a new experience I want to do with their recommendation! 
-Tableware, cups not clean
-Around view uncomfortable (the door in the hallway to public toilet one or more)
-The Elevator is narrow, the shower is very narrow"
"This is a perfect flat for 1 or 2 persons visit to Paris. Close to Eiffel Tower, Metro, river The Seine. No any issues with it. Thanks for the ability to stay there :)
---
Отличная квартира для проживания одному или вдвоем. Рядом Эйфелева Башня (верхушка видна из окна), метро и река Сена. Никаких проблем с квартирой. Спасибо за предоставленную возможность проживания :)",1,bulgarian-iso8859_5,ru-en,"This is a perfect flat for 1 or 2 persons visit to Paris. Close to Eiffel Tower, Metro, The river Seine. No any issues with it. Thanks for the ability to stay there :)
---
Great apartment for one or two. Close to the Eiffel Tower (the tip is visible from the window), metro and the river Seine. No problems with the apartment. Thank you for the opportunity to stay :)"
"호스트가 입실전 부터 친절하게  알려주었습니다. 에펠탑이 보이는 전망, 주변 시설, 시내와 근접한 거리 등 모두 좋았습니다.
또한 엘레베이터가 있어 짐을 옮기기도 편리했습니다.
욕실은 작은 편이지만 여자들이 사용하기에는 불편함이 없었습니다.
다음 여행때도 다시 이용하고싶습니다.",1,bulgarian-iso8859_5,ko-en,"The host is there, real friendly. Eiffel Tower views, surrounding amenities, downtown and close to the street.
Also the Elevator has a load carrying easy.
The bathroom is small but the girls use everyday.
The following travel time and go back to me."
위치가 정말 좋고 방에서 에펠탑이 보인다는게 가장 큰 장점입니다. 걸어서3분거리에 지하철도 있고 치안이 좋은 지역에 위치해있습니다. 화장실이 조금 작은거만 제외하면 정말 좋은 숙소였네요,1,bulgarian-iso8859_5,ko-en,"The location is really good and the room in the Eiffel Tower that is seen to the greatest advantage. Walk 3 minutes from the subway, and security in a good area. The bathroom is a little small, but except for the really good accommodation."
"파리에 3일 있는 동안 이곳에서 지냈습니다. 이 숙소를 고르셨다면 아마 에펠탑 뷰때문에 고르셨을거 같은데, 일단 사진상에 보이는 모습하고 똑같이 보입니다. 실제로 에펠탑과 거리가 조금 있어서 (도보로 20분정도) 건물들에 하부는 가려서 보이지 않습니다만 이정도면 훌륭하게 보입니다. 방 또한 사진과 똑같구요. 방크기가 2명이쓰기엔 딱 적절하고 3명은 좀 작을거 같습니다. 화장실과 욕실이 분리되어있고 크기는 작습니다. 혼자쓸만한 크기 입니다. 세탁기, 냉장고, 오븐, 핫플레이트, 식기류 등등 기본적인 물건들은 갖추어져 있으니 참고하시면 될 것 같습니다.
이곳에 있으면서 에펠탑 빤짝이는 모습, 새벽 1시 화이트 에펠도 보고 아침에 일어나서 에펠탑보면서 커피한잔하는 추억은 참 값지다고 생각합니다. 파리에서 에펠탑 원없이 보고싶다 생각되면 이곳을 추천합니다.",1,bulgarian-iso8859_5,ko-en,"Paris in 3 days while at this place. This is the place to stay and if you probably the Eiffel Tower view because you can't, once a photo is in the look and look the same. Actually, the Eiffel Tower and the streets a little (20 minutes) building on the lower part is to show not only is. The room also photos and equally. Room 2 people to write decent proper and 3 people is kinda small. Toilet and bathroom is separated and is small in size. Alone alone size. Washing machine, refrigerator, oven, hot plates, dinnerware etc basic stuff is equipped with to.
Here, in the Eiffel Tower sparkle, Dawn 1 White Eiffel reports in the morning from the Eiffel Tower while a Cup of coffee that memories are the true value or not. In Paris the Eiffel Tower without a circle I think once this place is recommended."
"위치는 완벽했어요. 퐁피두센터, 루브르박물관, 마레지구도 걸어서 10분안에 가능한의치였고 공항연결도 좋았어요.
인테리어도 사진과거의 똑같아요. 밖은 시끌시끌한데 현관문을열고 들어가면 완전 딴세상처럼 조용했어요.
위생상태는 비교적 깔끔한편이었는데 특유의 냄새와 습기가 조금 걸리네요.
지내기에 괜찮은 곳이라고 생각해요.",1,bulgarian-iso8859_5,ko-en,"The location was perfect. Pompidou Center, Louvre Museum, Marais district, walk to in 10 minutes as possible of was the airport connection was good.
Interior photos and or of equally. The outside is crowded for the door to heat and enters the acting world is like.
Sanitary conditions in a relatively neat hand was a peculiar odor and moisture a little.
In a decent place."
10 из 10.,1,bulgarian-iso8859_5,ru-en,10 out of 10.
매우 친절하시고 하나 하나 배려해주시는 모습이 인상깊었던 호스트였습니다. 집은 지하철에 가까이 위치해있어 주요 관광지에 쉽게 접근 가능하고 찾기 쉬웠으며 내부는 현대적이고 깨끗하여 지내기에 불편함이 없었습니다.,1,bulgarian-iso8859_5,ko-en,Very friendly and one on one care to look impressive host. The house is a subway close to the main tourist attractions easily accessible and the find was easy and the inside is modern and clean to walk in discomfort.
"여행 이전부터 호스트와 연락이 가능하고, 세심하게 챙겨줘서 좋았습니다. 체크인 전 미리 연락해서 시간을 정해서 만났기 때문에 체크인도 쉬웠던 것 같습니다.
아파트가 지하철역, 버스정거장과 가까워 이동이 편리했습니다.
주변 시설로는 마트, 베이커리 등 주변 약도도 정리된 문서가 있어 유용했습니다. (한국어 설명 없음)
숙소에 샴푸, 드라이기, 옷걸이 등 편의용품이 있어서 짐을 덜을 수 있었습니다.
숙소 주변도 조용하여  편히 쉴 수 있었던 것 같습니다.",1,bulgarian-iso8859_5,ko-en,"Travel from the previous host and contact, and attention to detail make me good. Check-in prior to contact hours by the Met in because check-in was as easy as it seems.
The apartment is the metro station, bus stops and easy to navigate.
The surrounding facilities at the Mart, bakery etc around the map and also information documents are available. (No description available)
Stay on the shampoo, dryer, clothes rack etc amenities in the burden.
Around the hostel is also quiet to rest and relax."
Все отлично,3,bulgarian-iso8859_5,ru-en,Everything is fine
지하철역과 가깝고 주요 랜드마크를 가는데 용이했습니다.,1,bulgarian-iso8859_5,ko-en,Subway station and close to the major landmark that was easy.
"일단 위치가 정말 좋습니다. 메트로와도 가깝고, 노트르담 대성당(시테섬)과 가깝고 저흰 오르세와 루브르도 걸어 다녔습니다.
숙소는 6층에 있지만 엘리베이터가 있어서 불편하지 않습니다. 하지만 엘리베이터가 작아서 사람 2명과 캐리어2개면 꽉 찹니다.
숙소엔 있을건 다 있지만 예쁘거나 편한 숙소는 아닙니다. 딱 있을것만 있습니다.",1,bulgarian-iso8859_5,ko-en,"Once the location is really good. Metro and also close to Notre Dame Cathedral(Cité Island)and close and we come up with the Louvre and walk around.
The hostel is on the 6th floor but the Elevator has not inconvenienced. But the Elevator is small person 2 and the carrier 2 side fills.
Hostel Vienna there is but pretty or comfortable is not. Just have it only."
"위치도 좋고 방도 깨끗합니다.

",1,bulgarian-iso8859_5,ko-en,"The location was great, room was clean.

"
"너무나도 반갑게 맞아주어서 좋았습니다.

위치도 나쁘지 않았고요 특히나 여름인데도 불구 하고 바람이 시원하고 좋았습니다.
사진보다 실제로 집이 훨씬 좋구요 행복한 시간을 보내기에는 딱 맞는 곳 이에요",1,bulgarian-iso8859_5,ko-en,"So back in the good.

The location was not bad and especially in summer, even though and the wind is cool and good.
Photos than actually the house is much better. happy to spend time in just the right place."
숙소 안내가 메일과 문자로 친절하고 상세.,1,bulgarian-iso8859_5,ko-en,Accommodation guide mail and letters with a friendly and detailed.
"늦은 시각에 체크인이라 셀프체크인을 했지만 문제는 없었습니다. 집에 들어가기 위해서, 메인문이랑 현관문을 지나서 엘레베이터를 타고 6층까지 가야합니다. 메인문과 현관문은 비밀번호고 집문만 열쇠로 열면 되구요. 그만큼 안전합니다.
사진에서 보이는것보다 집이 훨씬 좋았고, 헤어드라이기도 있었고, 수건이랑 휴지는 넉넉하게 있었습니다. 와이파이와 뜨거운물도 문제없이 잘 나옵니다.
에펠탑과 개선문이 정말 가까워서 밤에 야경보러가기도 좋아요.
슈퍼도 근처에 있어서 편리했습니다.
다만 숙소에 샴푸, 바디워시 , 세탁기가 없어서 아쉬웠습니다. 
그리고 옆집이 조금 씨끄러울수도 있습니다. 뭐하는집인진 모르겠지만 밤낮으로 쉴세없이 사람들이 들락거리네요. 자는데 방해가 될정도로 씨끄럽진 않습니다.
위치가 좋고 안전해요. 추천합니다",1,bulgarian-iso8859_5,ko-en,"Late check in is self check-in but was no problem. Entering the house in order, the main question French door or riding the Elevator 6 floors up to go. The main gate and the entrance door is a password and a house, but as a key to open. It is safe enough.
See in the photo is the house to much, he had a towel, love the rest that generous. WiFi and hot water also without a problem.
The Eiffel Tower and the arc really close to the night scene than get.
Super is also nearby.
The only place on shampoo, body wash , Laundry is not easy. 
And next door is a little seeds smooth. What to edit, I don't know the day and night to rest and more people without S or. Himself to be Mr. Smooth.
The location is good and safe. Recommended."
"혼자 쓰기에 너무 좋은 숙소였어요. 특히 위치가 메트로랑 버스72번이 바로 앞에 있어서 정말 좋아요. 1분 거리입니다. 주택가 한복판이라 조용하고 16구에 있어서 밤에도 안전했어요. 화장실, 부엌, 침대, 작은 옷장, 책상 다 있고요 방이 작긴하지만 1인실로는 적당합니다. 5분정도 가면 상점가 나오는데 동네빵집 , 모노프리, 산드로, 레페토 매장 다 있고요 프랑프리도 한 10분거리에 있어요. 샤요궁 도보 가능한데, 집 앞 파시역 쪽에서 보는 에펠탑이 더 멋졌어요! 
물끓일수 있는 주전자랑 냉장고 스토브 포크 접시 컵 다 있고 젓가락도 있었는데 식기사용은 개취일듯요; 밤에 좀 추워서 비치된 작은 온풍기 사용했습니다. 
신밸벗는 한쿡보댄 바닥이 좀 그래요. 프랭스가 원래 더 그렇다도 하드라고요. 실내용 쪼리같은거 하나 꼭 가져가시는게 좋을거 같아요. 뜨거운 물도 잘나왔고요 가격도 만족스러워서 강추해요.",1,bulgarian-iso8859_5,ko-en,"Writing alone in a too good place. Especially the location with the bus 72 times in really like. 1 minute away. The housing is in the middle and 16 in the night in safety. Toilet, kitchen, bed, small wardrobe, Desk and it is small, but 1 room is suitable. 5 minutes to the shops coming to the neighborhood bakery , mono, Sandro, restaurant stores and the Prix for 10 minutes. Chateau Palace walk, front of the house, a station-side view from the Eiffel Tower more was cool! 
Water boiling that Kettle restaurant refrigerators, stoves fork, plate, Cup and chopsticks, there was also the expression used is taken.; at night a little cold at the beach and the small heaters were used. 
New Valley pivot for Cook information back to the floor a little so. Prince is more original so hard. Indoor splitters, such as one of the top, bring it to like. Hot water well has been and the price was great on the day."
"호스트와 연락이 잘안됩니다.
엘리베이터가 하나 있는데 한명이 겨우 탈수 있고, 심지어 제가 숙박하는 동안은 엘리베이터가 고장나서, 그 무거운 짐을 들고 5층까지 올라가야했습니다.
위치와 에펠탑이 잘보이는 것이 유일한 장점입니다.",1,bulgarian-iso8859_5,ko-en,"Host and contact well.
The Elevator one is very dehydrated and, even, I stay while the Elevator is on, that's a heavy burden, holding 5 someone.
The location and the Eiffel Tower look this is the only advantage."
샤이요궁. 에펠탑과 가까워서 좋고 주변도 깨끗하고 조용해서 편안하게 쉴수 있었습니다. 공항으로 이동하는 르다이렉트버스도 걸어서  갈수있어서 편리하고 72번 버스로 쎈느강따라서 주요 스팟이동도 좋습니다~,1,bulgarian-iso8859_5,ko-en,"The bathroom Palace. The Eiffel Tower, and good and surrounding is also clean and quiet for relaxing. Airport to move to the Le Directory Server Access walk in a convenient 72 bus to Church's, thus the main spot is also good.~"
위치가 샹젤리제 바로 뒷골목이고 주요 지하철역들이 도보로 가까워서 위치가 가장 만족스러웠습니다. 하지만 집이 너무 도로변이라서 소음이 좀 많았어서 조용한 휴가보다 편리한 위치를 선호하는 분에게 추천합니다.,1,bulgarian-iso8859_5,ko-en,Location the Champs Elysees and the right back alley and major metro areas were close to the location of the most. But the house is so city noise is a little much in a quiet holiday than a convenient location to prefer.
로케이션과 보안이 너무도 좋았던 숙소였습니다.,1,bulgarian-iso8859_5,ko-en,And security is too good stay.
Отличная квартира,1,bulgarian-iso8859_5,ru-en,Great apartment
"가족 3인이 묵었는데, 흠잡을 데 없었습니다. 파리 시 중심은 아니지만, 대중교통 수단과 가깝고, 특히나 차가 있는 우리 입장에서는 지하 주차장을 이용할 수 있는 게 큰 장점이었습니다. 주방이 잘 갖춰져 있어 간단히 조리해 음식을 먹기도 편리했습니다. 다음에 다시 가족이나 친구가 오면 이 숙소를 또 선택할 의향이 있습니다. ^^",1,bulgarian-iso8859_5,ko-en,"Family 3 person room, which was, spotless. Paris city center, but public transportation and close to, especially one car on the underground Parking this can be a big advantage. The kitchen is well equipped with simple cooking food to eat is also convenient. Next time family or friends come to stay or choose. ^^"
에펠탑에서 진짜 가까워서 좋았습니다.,1,bulgarian-iso8859_5,ko-en,The Eiffel Tower in real close.
