comments,N,lang,en-en,comments
"Jonathan is an amazing host - very kind and friendly, outstandingly helpful and responsive. we stayed a good 8 nights in his apartment and it was very warm and cozy in the winter time. Heaters works very well, amazing bed and blankets, good hot shower - it's everything we need after a long day of work. Short walk to supermarket and metro station Stalingrad. ",1,english,en-en,"Jonathan is an amazing host - very kind and friendly, outstandingly helpful and responsive. we stayed a good 8 nights in his apartment and it was very warm and cozy in the winter time. Heaters works very well, amazing bed and blankets, good hot shower - it's everything we need after a long day of work. Short walk to supermarket and metro station Stalingrad. "
Mag was great and very helpful!,1,english,en-en,Mag was great and very helpful!
Despite changes in our flights Isabel was very accommodating.  We very much enjoyed our  stay.,1,english,en-en,Despite changes in our flights Isabel was very accommodating.  We very much enjoyed our  stay.
Juan was great! very helpfull.,1,english,en-en,Juan was great! very helpfull.
"very Good,very nice~",1,english,en-en,"very Good,very nice~"
It was a wonderful journey and sweet flat.,1,english,en-en,It was a wonderful journey and sweet flat.
very nice room.,1,english,en-en,very nice room.
"Very nice room. Clean, well equiped. Bree was a very nice host. I really enjoy my stay here. ",1,english,en-en,"Very nice room. Clean, well equiped. Bree was a very nice host. I really enjoy my stay here. "
Super week-end,3,english,en-en,Super week-end
Treat yourself. Stay here.,1,english,en-en,Treat yourself. Stay here.
Home from home,1,english,en-en,Home from home
"She is very helpful amd everything was in order
Thanks for hosting us
",1,english,en-en,"She is very helpful amd everything was in order
Thanks for hosting us
"
Raquel was very polite and helpful during our stay... Place is good located.,1,english,en-en,Raquel was very polite and helpful during our stay... Place is good located.
het was heel leuk,1,english,en-en,het was heel leuk
Great spot. Jordane very helpful.,1,english,en-en,Great spot. Jordane very helpful.
Very sweet lady very helpful beautiful home,1,english,en-en,Very sweet lady very helpful beautiful home
Chantals place was wonderful,1,english,en-en,Chantals place was wonderful
wonderful stay here!,1,english,en-en,wonderful stay here!
"Very nice, clean & cute hotel.
Staff very friendly.
Breakfast was great.",1,english,en-en,"Very nice, clean & cute hotel.
Staff very friendly.
Breakfast was great."
Beautiful home. Very kind host. Convenient but quiet.,1,english,en-en,Beautiful home. Very kind host. Convenient but quiet.
Jordie has be,1,english,en-en,Jordie has be
very good house,1,english,en-en,very good house
Lovely Airbnb in Paris!! Everyone was so nice.,1,english,en-en,Lovely Airbnb in Paris!! Everyone was so nice.
Antoine is very kind man. It was a wonderful experience at Paris.,1,english,en-en,Antoine is very kind man. It was a wonderful experience at Paris.
Malo made us feel very welcome. She is a wonderful host.,1,english,en-en,Malo made us feel very welcome. She is a wonderful host.
"Thank you so much, we had a wonderful time",1,english,en-en,"Thank you so much, we had a wonderful time"
Very comfortable with a wonderful view! Louison was very helpful!,1,english,en-en,Very comfortable with a wonderful view! Louison was very helpful!
Fantastic hosts!  Your place was wonderful!,1,english,en-en,Fantastic hosts!  Your place was wonderful!
Very good hotel,1,english,en-en,Very good hotel
Everybody was very friendly,1,english,en-en,Everybody was very friendly
"He was helpful , very friendly. Cozy place , near to metro lines . Great host ! ",1,english,en-en,"He was helpful , very friendly. Cozy place , near to metro lines . Great host ! "
This was a great place.  We had a wonderful weekend in paris,1,english,en-en,This was a great place.  We had a wonderful weekend in paris
Nice house. David is helpful.,1,english,en-en,Nice house. David is helpful.
It was very good!!,1,english,en-en,It was very good!!
Great place to stop in Paris! Charles is very helpful. It was good choice.,1,english,en-en,Great place to stop in Paris! Charles is very helpful. It was good choice.
very great,1,english,en-en,very great
It was wonderful :-),1,english,en-en,It was wonderful :-)
Isabelle was very nice. We never met Boris,1,english,en-en,Isabelle was very nice. We never met Boris
"Very nice flat, Caroline was a very friendly host. My weekend at Paris wouldn't be the same if I stayed somewhere else. Really nice",1,english,en-en,"Very nice flat, Caroline was a very friendly host. My weekend at Paris wouldn't be the same if I stayed somewhere else. Really nice"
"Great room, great view! Sylvie was very friendly and nice. I had a great time. ",1,english,en-en,"Great room, great view! Sylvie was very friendly and nice. I had a great time. "
Shop is very close,1,english,en-en,Shop is very close
Aggy was nice and very accommodating. She made our Airbnb stay easy.,1,english,en-en,Aggy was nice and very accommodating. She made our Airbnb stay easy.
Aggy is so very kind,1,english,en-en,Aggy is so very kind
Jules is a wonderful host! So nice and helpful. It was a great stay!,1,english,en-en,Jules is a wonderful host! So nice and helpful. It was a great stay!
Your direct message is good. :),1,english,en-en,Your direct message is good. :)
Very nice Hotel woth very buitiful service thank you five stars,1,english,en-en,Very nice Hotel woth very buitiful service thank you five stars
"2 minute walk to metro, area was okay.  Mélanie was very helpful! ",1,english,en-en,"2 minute walk to metro, area was okay.  Mélanie was very helpful! "
Dejan was friendly and helpful,1,english,en-en,Dejan was friendly and helpful
She is very nice,1,english,en-en,She is very nice
Lovely host! Feels like home.,1,english,en-en,Lovely host! Feels like home.
It's very good flat to enjoy your energy,1,english,en-en,It's very good flat to enjoy your energy
Julien was very helpful!,1,english,en-en,Julien was very helpful!
"Charming place, wonderful stay and Dimitri was very responsive.",1,english,en-en,"Charming place, wonderful stay and Dimitri was very responsive."
Bruno was very accomodating.,1,english,en-en,Bruno was very accomodating.
"nice place, away was very kind and helpful",1,english,en-en,"nice place, away was very kind and helpful"
"Carola was very friendly and helpful, and we really enjoyed our stay here!",1,english,en-en,"Carola was very friendly and helpful, and we really enjoyed our stay here!"
All you need to get some rest after long day .,1,english,en-en,All you need to get some rest after long day .
"Had a great time, very helpful host",1,english,en-en,"Had a great time, very helpful host"
Cosy room in a quite neighbourhood!,1,english,en-en,Cosy room in a quite neighbourhood!
Great place to stay wonderful view. Very helpful host. Everything was awesome. Definitely recommend,1,english,en-en,Great place to stay wonderful view. Very helpful host. Everything was awesome. Definitely recommend
Dalinda  was a very helpful hostess !,1,english,en-en,Dalinda  was a very helpful hostess !
"Only one word, awesome ",1,english,en-en,"Only one word, awesome "
"Nice room, we slept very well. Everything was fine.",1,english,en-en,"Nice room, we slept very well. Everything was fine."
"Thank you very much, it was great",1,english,en-en,"Thank you very much, it was great"
Good hostel in downtown Paris. Walkable to many sites. Staff was friendly and helpful.,1,english,en-en,Good hostel in downtown Paris. Walkable to many sites. Staff was friendly and helpful.
Wonderful stay.  Thank you Clement,1,english,en-en,Wonderful stay.  Thank you Clement
Awesome. Would stay again!,1,english,en-en,Awesome. Would stay again!
It is very nice.,1,english,en-en,It is very nice.
Very helpful.,1,english,en-en,Very helpful.
"Easy fast over night stay  
Thank you",1,english,en-en,"Easy fast over night stay  
Thank you"
Bernadette is a great hostess and made our stay in Paris like home.,1,english,en-en,Bernadette is a great hostess and made our stay in Paris like home.
Dovile is very nice!,1,english,en-en,Dovile is very nice!
Thank you Flore,1,english,en-en,Thank you Flore
Very good hostel :),1,english,en-en,Very good hostel :)
Romain was very nice and Available.,1,english,en-en,Romain was very nice and Available.
Great house.,1,english,en-en,Great house.
Christian is very good person. :),1,english,en-en,Christian is very good person. :)
Cute flat in a great location! Chelle was very helpful too!,1,english,en-en,Cute flat in a great location! Chelle was very helpful too!
Stay was okay. Very friendly host.,1,english,en-en,Stay was okay. Very friendly host.
"A nice, very clean hostel",1,english,en-en,"A nice, very clean hostel"
Good value.  Bring your own soap.,1,english,en-en,Good value.  Bring your own soap.
It was a very warm stay in Paris.,1,english,en-en,It was a very warm stay in Paris.
it's very okie,1,english,en-en,it's very okie
Sophie is very sweet,1,english,en-en,Sophie is very sweet
Wonderful stay. Close to everything. It felt like home away from home. Highly recommended.,1,english,en-en,Wonderful stay. Close to everything. It felt like home away from home. Highly recommended.
Everything was superrrr. Thank you Joe,1,english,en-en,Everything was superrrr. Thank you Joe
Very beautiful house! And Best house. Host is very kindness.,1,english,en-en,Very beautiful house! And Best house. Host is very kindness.
top pour un weekend,1,english,en-en,top pour un weekend
very good .,1,english,en-en,very good .
a very good hostel to stay in Paris,1,english,en-en,a very good hostel to stay in Paris
"Very nice house, Christel was helpful and nice. Recommended.",1,english,en-en,"Very nice house, Christel was helpful and nice. Recommended."
"Great stay, wonderful area.",1,english,en-en,"Great stay, wonderful area."
"Great place,  Greg is very nice. ",1,english,en-en,"Great place,  Greg is very nice. "
She was nice and very helpful,1,english,en-en,She was nice and very helpful
All was very gut. As usual,1,english,en-en,All was very gut. As usual
Everything was wonderful,1,english,en-en,Everything was wonderful
Room was very clean and beautiful. I enjoyed a lot during my stay.,1,english,en-en,Room was very clean and beautiful. I enjoyed a lot during my stay.
Camille was very friendly and helpful.,1,english,en-en,Camille was very friendly and helpful.
We loved our stay here. It is a wonderful Airbnb.,1,english,en-en,We loved our stay here. It is a wonderful Airbnb.
A very nice smiley welcome from Aurore. Cosy bedroom. 4th floor no lift.,1,english,en-en,A very nice smiley welcome from Aurore. Cosy bedroom. 4th floor no lift.
Great apartment. Sandrine was very helpful.,1,english,en-en,Great apartment. Sandrine was very helpful.
"great value, very nice host",1,english,en-en,"great value, very nice host"
Gorgeous home away from home.,1,english,en-en,Gorgeous home away from home.
Good house.,1,english,en-en,Good house.
very nice clean room.,1,english,en-en,very nice clean room.
very kind Yankel!,1,english,en-en,very kind Yankel!
Room ok,1,english,en-en,Room ok
we felt very homy,1,english,en-en,we felt very homy
Hot water ends when you take shower.,1,english,en-en,Hot water ends when you take shower.
Wonderful view!,1,english,en-en,Wonderful view!
A very nice man,1,english,en-en,A very nice man
Everything was just awesome :),1,english,en-en,Everything was just awesome :)
Close to metro's; in quite neighborhood,1,english,en-en,Close to metro's; in quite neighborhood
"Thank you Sherry, it was beautiful to stay in your studio. Paris is a wonderful town. ",1,english,en-en,"Thank you Sherry, it was beautiful to stay in your studio. Paris is a wonderful town. "
Danh was very helpful and we loved our stay!,1,english,en-en,Danh was very helpful and we loved our stay!
Great deal! Mehdi is very sweet and helpful host.,1,english,en-en,Great deal! Mehdi is very sweet and helpful host.
"Eric’s place is located in few minutes walk to Louvre museum, Eifel tower was walking distance as well. He is a very great host, very helpful.",1,english,en-en,"Eric’s place is located in few minutes walk to Louvre museum, Eifel tower was walking distance as well. He is a very great host, very helpful."
nice house nice view,1,english,en-en,nice house nice view
Had a wonderful time. Thank you so much,1,english,en-en,Had a wonderful time. Thank you so much
"Good stay, good standard and half way between Gare du Nord and Sacre Couer,  this place met my needs very well. ",1,english,en-en,"Good stay, good standard and half way between Gare du Nord and Sacre Couer,  this place met my needs very well. "
"Great place to stay, great host. Yoni was very helpful.",1,english,en-en,"Great place to stay, great host. Yoni was very helpful."
Het was top:),1,english,en-en,Het was top:)
All was very good.,1,english,en-en,All was very good.
"It was great, very clean & easy",1,english,en-en,"It was great, very clean & easy"
Week-end au top,1,english,en-en,Week-end au top
"Clean , easy to get to !",1,english,en-en,"Clean , easy to get to !"
As you see,1,english,en-en,As you see
Bruno is a wonderful host ! He made our work week in Paris superb!,1,english,en-en,Bruno is a wonderful host ! He made our work week in Paris superb!
It was wonderful,1,english,en-en,It was wonderful
"Ines was very hospitable, a very welcoming host!",1,english,en-en,"Ines was very hospitable, a very welcoming host!"
Very good house Gilbert is good,1,english,en-en,Very good house Gilbert is good
We had a wonderful visit. Thank you!,1,english,en-en,We had a wonderful visit. Thank you!
everything was awsome.,1,english,en-en,everything was awsome.
Easy,1,english,en-en,Easy
Alexandre was a very hospitality person.,1,english,en-en,Alexandre was a very hospitality person.
Pretty ordinary house.,1,english,en-en,Pretty ordinary house.
Wonderful host.,1,english,en-en,Wonderful host.
View is great & staff is helpful.,1,english,en-en,View is great & staff is helpful.
very good~~~,1,english,en-en,very good~~~
"Good stay, Thank you",1,english,en-en,"Good stay, Thank you"
"Yves was a wonderful host! Thanks, Yves!",1,english,en-en,"Yves was a wonderful host! Thanks, Yves!"
Tristan was very helpful and made our stay in Paris a great one.,1,english,en-en,Tristan was very helpful and made our stay in Paris a great one.
Tang is a wonderful host. Thank you!,1,english,en-en,Tang is a wonderful host. Thank you!
"Wonderful view
Awesome room
Kind host
Best place",1,english,en-en,"Wonderful view
Awesome room
Kind host
Best place"
The Studio was Great. Caroline was very helpful. Thank you :),1,english,en-en,The Studio was Great. Caroline was very helpful. Thank you :)
Ophélie was very helpful and we had a great stay.,1,english,en-en,Ophélie was very helpful and we had a great stay.
Wonderful time..Wonderful host..,1,english,en-en,Wonderful time..Wonderful host..
Clara was very helpful.... we enjoyed our stay...having a pizza place nearby was a bonus,1,english,en-en,Clara was very helpful.... we enjoyed our stay...having a pizza place nearby was a bonus
Never met John. Everything  was great.,1,english,en-en,Never met John. Everything  was great.
verry god,1,english,en-en,verry god
Good house great stay,1,english,en-en,Good house great stay
"We enjoyed our stay, thank you very much.",1,english,en-en,"We enjoyed our stay, thank you very much."
"Great neighborhood, great view, great hosts.",1,english,en-en,"Great neighborhood, great view, great hosts."
Great place. Very good location. Louis was very helpful.,1,english,en-en,Great place. Very good location. Louis was very helpful.
"Great spot near Canal St-Martin. Simon was wonderful to book with.

m",1,english,en-en,"Great spot near Canal St-Martin. Simon was wonderful to book with.

m"
It's noisy,1,english,en-en,It's noisy
good host,1,english,en-en,good host
"Large, very well located, nice garden",2,english,en-en,"Large, very well located, nice garden"
"Benedicte is a very kind lady, she gave me a lot of useful info, helped me to have a wonderful journey.",1,english,en-en,"Benedicte is a very kind lady, she gave me a lot of useful info, helped me to have a wonderful journey."
It was marvelous,1,english,en-en,It was marvelous
My colleague was very Happy.,2,english,en-en,My colleague was very Happy.
Very nice place to stay in Paris. Paul was very helpful.,1,english,en-en,Very nice place to stay in Paris. Paul was very helpful.
Beautiful apartment. Elsa was very helpful. Amazing stay.,1,english,en-en,Beautiful apartment. Elsa was very helpful. Amazing stay.
Absolutely wonderful in every regard!,1,english,en-en,Absolutely wonderful in every regard!
"Cosy and quiet, and Manualla is very helpful.",1,english,en-en,"Cosy and quiet, and Manualla is very helpful."
Here is easy to stay. Jay is very kind.,1,english,en-en,Here is easy to stay. Jay is very kind.
It was a very nice stay at Stevens place.,1,english,en-en,It was a very nice stay at Stevens place.
Simple but very nice.,1,english,en-en,Simple but very nice.
very Good｡,1,english,en-en,very Good｡
Jo was very accommodating! Thank you!,1,english,en-en,Jo was very accommodating! Thank you!
Some noise at night..,1,english,en-en,Some noise at night..
"Great place to stay, was very quiet so easy to sleep. Good value",1,english,en-en,"Great place to stay, was very quiet so easy to sleep. Good value"
Thank you very much. It was a very nice stay in Paris.,1,english,en-en,Thank you very much. It was a very nice stay in Paris.
wonderful room thank.,1,english,en-en,wonderful room thank.
Definitely would stay here again,1,english,en-en,Definitely would stay here again
Quite small but warm,1,english,en-en,Quite small but warm
"nice little 'hostel' in Paris, Renaud was very helpful.",1,english,en-en,"nice little 'hostel' in Paris, Renaud was very helpful."
Wonderful stay! Area is great! Would stay again!,1,english,en-en,Wonderful stay! Area is great! Would stay again!
House is very small,1,english,en-en,House is very small
Comfortable is like as  home,1,english,en-en,Comfortable is like as  home
I loved staying here. It was very nice energy.,1,english,en-en,I loved staying here. It was very nice energy.
Our host(melika's son) was very nice. He did us several favors:D. We strongly recommend here.,1,english,en-en,Our host(melika's son) was very nice. He did us several favors:D. We strongly recommend here.
We had a wonderful stay,1,english,en-en,We had a wonderful stay
"Great host, very welcoming home.",1,english,en-en,"Great host, very welcoming home."
5* stay if you visit Paris.,1,english,en-en,5* stay if you visit Paris.
Stephanie’s place is super stylish! Also Stephanie was very accommodating. You won’t regret if you choose her place to stay!,1,english,en-en,Stephanie’s place is super stylish! Also Stephanie was very accommodating. You won’t regret if you choose her place to stay!
Felt at home.,1,english,en-en,Felt at home.
All very good,1,english,en-en,All very good
Mathieu is a very kind and helpful host!,1,english,en-en,Mathieu is a very kind and helpful host!
"Camille is very nice host, she was helpful and kind",1,english,en-en,"Camille is very nice host, she was helpful and kind"
Was great! She was very helpful.,1,english,en-en,Was great! She was very helpful.
You will feel like your home when you enter first. Good neighbourhood.,1,english,en-en,You will feel like your home when you enter first. Good neighbourhood.
Asmaa was a wonderful host.,1,english,en-en,Asmaa was a wonderful host.
Ant was very helpful.,1,english,en-en,Ant was very helpful.
"Lovely room in a great neighborhood, very helpful host!",1,english,en-en,"Lovely room in a great neighborhood, very helpful host!"
Great location. Great views.  Medi was very nice.,1,english,en-en,Great location. Great views.  Medi was very nice.
She was amazing!!! You should all stay here. Eleanor was very helpful!,1,english,en-en,She was amazing!!! You should all stay here. Eleanor was very helpful!
Great stay! Wonderful host!,1,english,en-en,Great stay! Wonderful host!
Geraldine is very kind :),1,english,en-en,Geraldine is very kind :)
very small,1,english,en-en,very small
Thank you Julie! The stay in your flat was very good. We had a very good time.,1,english,en-en,Thank you Julie! The stay in your flat was very good. We had a very good time.
Very nice place. Front desk was helpful and kind.,1,english,en-en,Very nice place. Front desk was helpful and kind.
"Staff were polite, helpful and friendly. My stay was easy and very pleasant.",1,english,en-en,"Staff were polite, helpful and friendly. My stay was easy and very pleasant."
This Place makes you feel like you're home. We enjoyed our stay very much.,1,english,en-en,This Place makes you feel like you're home. We enjoyed our stay very much.
was very good,1,english,en-en,was very good
"Great stay, awesome host.",1,english,en-en,"Great stay, awesome host."
very nice room,2,english,en-en,very nice room
very enjoy,1,english,en-en,very enjoy
Laurie is warm and helpful host.,1,english,en-en,Laurie is warm and helpful host.
Great host who was very helpful,1,english,en-en,Great host who was very helpful
"Close to metro in a top floor unit, was a great few days :)",1,english,en-en,"Close to metro in a top floor unit, was a great few days :)"
Awesome views,1,english,en-en,Awesome views
Thank you very much. We enjoyed our visit in Paris a lot!,1,english,en-en,Thank you very much. We enjoyed our visit in Paris a lot!
Helene was a wonderful host!,1,english,en-en,Helene was a wonderful host!
I had a wonderful stay :),1,english,en-en,I had a wonderful stay :)
"Everything was fine.
Thank you",1,english,en-en,"Everything was fine.
Thank you"
"Raphaël was very flexible in order to accept our schedule.
Good place to stay.",1,english,en-en,"Raphaël was very flexible in order to accept our schedule.
Good place to stay."
Good place. Very near to gare du nord. Very well located. David was wonderful host.,1,english,en-en,Good place. Very near to gare du nord. Very well located. David was wonderful host.
It is great place to stay near Eiffel. Nathalie was very helpful and wonderful host.,1,english,en-en,It is great place to stay near Eiffel. Nathalie was very helpful and wonderful host.
It was very nice!,1,english,en-en,It was very nice!
"My experience with WAng' home was like a home away from home.
Meeting her was like meeting an old school friend :)
The home is located very central - a few meters away from Republique. You can not miss to locate the place. Its very quiet neighborhood .
Wang is a very nice  host . Thanks Wang !",1,english,en-en,"My experience with WAng' home was like a home away from home.
Meeting her was like meeting an old school friend :)
The home is located very central - a few meters away from Republique. You can not miss to locate the place. Its very quiet neighborhood .
Wang is a very nice  host . Thanks Wang !"
"Good, very good",1,english,en-en,"Good, very good"
Wonderful house and very nice family! Isabelle and her family make you feel at home.,1,english,en-en,Wonderful house and very nice family! Isabelle and her family make you feel at home.
"Isabelle is a wonderful host. Perhaps it was my error in not being aware, but breakfast is INCLUDED! Highly recommended!",1,english,en-en,"Isabelle is a wonderful host. Perhaps it was my error in not being aware, but breakfast is INCLUDED! Highly recommended!"
"Thanks Karima, we had a wonderful weekend!",1,english,en-en,"Thanks Karima, we had a wonderful weekend!"
Everything was very nice.,1,english,en-en,Everything was very nice.
we had a very good stay,1,english,en-en,we had a very good stay
very good host,2,english,en-en,very good host
We had a nice time. The staffs are wonderful. Everyone we came across was very sweet .,1,english,en-en,We had a nice time. The staffs are wonderful. Everyone we came across was very sweet .
Host was great and very helpful!,1,english,en-en,Host was great and very helpful!
it was very good .,1,english,en-en,it was very good .
Everything was great. Don’t hesitate to stay here.,1,english,en-en,Everything was great. Don’t hesitate to stay here.
Hotel La Louisiane was wonderful! Great location!,1,english,en-en,Hotel La Louisiane was wonderful! Great location!
I had an amazing stay and jasmina was very helpful!,1,english,en-en,I had an amazing stay and jasmina was very helpful!
Sweet landlord,1,english,en-en,Sweet landlord
It’s  wonderful   Places  And sophie is Friendly. I ‘ll want to stay again,1,english,en-en,It’s  wonderful   Places  And sophie is Friendly. I ‘ll want to stay again
Very helpful host :),1,english,en-en,Very helpful host :)
It was very nice experience,1,english,en-en,It was very nice experience
very gud,1,english,en-en,very gud
Awesome host :),1,english,en-en,Awesome host :)
Paris is at your doorstep. Quiet and comfy. Maria is wonderful,1,english,en-en,Paris is at your doorstep. Quiet and comfy. Maria is wonderful
it was pleasure to stay Sebastian home.,1,english,en-en,it was pleasure to stay Sebastian home.
hotel sympa,1,english,en-en,hotel sympa
"Nice flat minutes away from Sacre-Coeur, we enjoyed our stay",1,english,en-en,"Nice flat minutes away from Sacre-Coeur, we enjoyed our stay"
Nice guy. He made us feel like home and welcomed. He was gentle. Would recommend.,1,english,en-en,Nice guy. He made us feel like home and welcomed. He was gentle. Would recommend.
wonderful hospitality,1,english,en-en,wonderful hospitality
Very helpful staff,1,english,en-en,Very helpful staff
15 mins walk from Gare du nord.,1,english,en-en,15 mins walk from Gare du nord.
Everything was great enjoyable stay,1,english,en-en,Everything was great enjoyable stay
It was like staying at home.,1,english,en-en,It was like staying at home.
very nice hotel!!,1,english,en-en,very nice hotel!!
