comments,N,lang,en-en,comments
"Logement très bien situé à proximité de bars et restaurants sympathiques. Quartier agréable à découvrir. L'appartement est spacieux bien eclairé, le chauffage d'appoint est apprecié dans le salon (à cause du vitrage qui donne son charme au salon). Une seule petite remarque sur le manque de produit de base ( café - beurre - sel ) mais les commerces de proximité sont là. Nous avons pu rester 2 heures supplémentaires, merci.",1,french,fr-en,"Housing very well located close to bars and restaurants friendly. Nice area to discover. The apartment is spacious, well-lit, the auxiliary heating is appreciated in the living room (because of the glazing that gives its charm to the living room). One small note on the lack of basic product ( coffee - butter - salt ) but the shops are there. We could stay 2 hours more, thank you."
Logement bien situé et accessible. Les hôtes sont disponibles et très réactifs.,1,french,fr-en,Apartment well located and accessible. The hosts are very available and very responsive.
"Qualité prix ok ( le quartier est pittoresque à souhait, Caroline et Federico très réactifs ) mais problème d’odeur de pizza dans les toilettes ( du traiteur au Rez de chaussee sans doute ) et très difficile d’aerer avec verrière vétuste et pas d’ouverture dans la chambre .",1,french,fr-en,"Quality price ok ( the neighborhood is picturesque to perfection, Caroline and Federico very reactive ) but there was a problem with the smell of pizza in the toilet ( from the caterer to the Ground floor without a doubt ) and very difficult to aerer with canopy antiquated and no opening in the room ."
L'appartement correspond en tous points a la description. Il est parfairement situe a Montmartre. Les proprietaires sont tres reactifs et arrangeants pour les horaires d'arrivee et de depart. La literie est tres confortable. La piece de vie est sombre mais cela ne gene pas car les voyageurs sont generalement en ville pendant la journee !,1,french,fr-en,The apartment exactly matched the description. It is parfairement located in Montmartre. The owners are very reactive and accommodating to the schedules of arrival and departure. The bedding is very comfortable. The living room is dark but that does gene not because travellers are usually in town during the day !
"Appartement très mignon, très bien situé pour les visites, commerces de proximités à profusion. Caroline & Federico ont été de très bons conseils pour les restos et dans l'appart. il y a quantité de magazines pour nous aider dans nos ballades parisiennes !!!!!! 
Très bonne expérience et adresse à garder !!!!!!!!",1,french,fr-en,"Apartment very cute, very well located for sightseeing, shops proximities in great profusion. Caroline & Federico were very good advice for restaurants and in the apartment. there are quantity of magazines to help us in our walks in paris !!!!!! 
Very good experience, and address to keep !!!!!!!!"
"Nous avons passé un super weekend sur Paris, le logement de Caroline & Federico est conforme à la description et aux photos. Propre, Spacieux et bien équipé. Nous étions 4 adultes et nous avons tous apprécié leur logement. En particulier son emplacement, dans une rue dynamique et proche du Sacré-coeur et de tout ce qu'il y a à faire à Montmartre. Une fois dans l'appartement, le bruit de la rue ne s'entend plus. C'était très bien, nous recommandons leur logement sans hésiter ! =)",1,french,fr-en,"We spent a super weekend in Paris, the housing of Caroline & Federico is consistent with the description and photos. Clean, Spacious and well equipped. We were 4 adults and we all enjoyed their accommodation. In particular its location, in a dynamic street and close to the Sacré-coeur, and all that there is to do in Montmartre. Once in the apartment, the street noise can be heard more. It was very good, we recommend their home without hesitation ! =)"
"Super quartier, appartement très agréable. À refaire. Merci à Caroline pour son accueil",1,french,fr-en,"Great neighborhood, very nice apartment. To do it again. Thank you to Caroline for her hospitality"
Appartement très agréable et très bien situé,7,french,fr-en,Very nice apartment and very well located
"Très bel appartement, beaucoup de charme, un peu moins grand qu'il n'y parait (la faute au grand angle je pense ..), bien placé avec restos sympas autour. L'acces est facile, dommage que les travaux dans la cours empêchent les grasses mat'..",1,french,fr-en,"Very nice apartment, lots of charm, a little less grand than it seems (the fault at wide angle I think ..), well placed with restaurants, the nice around. The access is easy, a pity that the work in the course, prevent the fat mat'.."
"Appartement très bien placé, propre, bien décoré avec beaucoup d attention pour ceux qui veulent le louer. La communication et la réactivité sont très présentes. Bref, une petite perle.",1,french,fr-en,"Apartment very well placed, clean, well decorated with lots of attention for those who want to rent it out. Communication and responsiveness are very much present. In short, a small pearl."
"Appartement super. 
Localisation / accueil / réactivité de Caroline tout était parfait 
Le petit jardin d’hiver est très agréable",1,french,fr-en,"Apartment super. 
Location / home / reactivity of Caroline everything was perfect 
The small winter garden is very nice"
"L'appartement de Caroline est très agréable, calme et idéalement situé.  On s'y sent rapidement comme chez soi et il ne manque de rien. Je recommande vivement cette adresse !",1,french,fr-en,"The apartment Caroline is a very nice, quiet and conveniently located. One feels quickly at home and lack nothing. I strongly recommend this address !"
"Très bien situé, dans un quartier  dynamique et agréable à découvrir. Logement au calme et bien entretenu. Merci à Caroline pour sa réactivité dans les échanges. Adresse  gardée précieusement pour mes prochains déplacements à Paris",1,french,fr-en,"Very well located, in a vibrant and enjoyable to discover. Accommodation in a quiet and well maintained. Thank you to Caroline for its responsiveness in the exchanges. Address kept preciously for my next travel to Paris"
"Caroline a été très réactive, suite à notre réservation de dernière minute.",1,french,fr-en,"Caroline was very responsive, due to our last minute booking."
"Bel appartement bien décoré très bien situé pour flaner dans le quartier de montmartre! 
Caroline sympathique et très réactive.
Seul bémol il faisait très chaud dans l’appartement car aucune fenêtre pour aérer sauf celle des toilettes.",1,french,fr-en,"Nice apartment well decorated and very well situated to stroll in the montmartre district! 
Caroline is friendly and very responsive.
Only downside it was very hot in the apartment, because there's no window to air the room except the toilet."
J’ai adoré l’appartement de Caroline ! J’y reviendrais !,1,french,fr-en,I loved the apartment of Caroline ! I would go back !
"Dommage, le lieu est irréprochable et vous gâchez tout par un manque de préparation. Même si vous aviez un problème de fonctionnement du chauffage, il était possible de mettre en route le radiateur électrique à l'avance.",1,french,fr-en,"Too bad, the place is clean, and you spoil everything by a lack of preparation. Even if you had a problem with the operation of the heating, it was possible to set up the electric heater in advance."
On a bien aimer l appartement. Três agreable ét. Confortable. Três bien. Situer. Paris. On a eu ún tres beau accueil.tout parfais.........on reviendras... Merci mesire.....,1,french,fr-en,We really love the apartment. Três pleasant te. Comfortable. Três well. Place. Paris. We had ún very beautiful home.all perfect.........we will come back... Thank you mesire.....
"Séjour très agréable, appartement bien placé ac une grande terrasse, merci encore!",1,french,fr-en,"Very pleasant stay, apartment well placed ac a large terrace, thank you again!"
"tout à été parfait. Jeremie à été acueillant et disponible durant tout le séjour. l'appartement est parfait et reposant, dans un des meilleurs quartiers de Paris et proche de toutes les comodités. A répéter.",1,french,fr-en,"everything was perfect. Jeremie has been that welcomes and available during all the stay. the apartment is perfect and relaxing, in one of the best neighbourhoods of Paris and close to all conveniences. Has repeat."
Une fois de plus séjour irréprochable chez Jérémie qui a su rester disponible et acceuillant. Merci pour tout et à très vite j'espère!,1,french,fr-en,Once again stay above reproach in Jeremiah that has managed to stay available and welcoming. Thank you for everything and see you soon I hope!
"Je n'ai qu'un mot à dire : superbe ! 
Jeremy est à l'écoute, et l'appartement...un havre de paix et de confort. (A noter : la terrasse immense et la vue sur Paris à couper le souffle !)
A recommander les yeux fermés !",1,french,fr-en,"I only have one word to say : superb ! 
Jeremy is listening, and the apartment...a haven of peace and comfort. (Note : the huge terrace and the view on Paris is breathtaking !)
Has recommend eyes closed !"
"L'appartement est fidèle à la description. 
Jérémie nous a offert un super accueil (eau mise au frais, très bon jus de fruits ...) et a été un très bon hôte. 
Nous recommandons vivement son logement  ",1,french,fr-en,"The apartment is true to the description. 
Jeremiah gave us a great welcome (water cool, very good fruit juice ...) and has been a very good host. 
We highly recommend his accommodation "
"Jeremie nous a fait un tres bon accueil et a ete toujours disponible pour repondre a nos questions.
L appartement est confortable, calme et ensoleille avec une belle terrasse.
",1,french,fr-en,"Jeremie has done a very good host and was always available to answer our questions.
The apartment is comfortable, quiet and sunny with a nice terrace.
"
"Appartement tres agréable, très bien situé ! ",1,french,fr-en,"Apartment very nice, very well located ! "
"Logement proche des transports en commun et des restaurant de la la bastille idéale pour sortir est visité la capitale bien situé.
ca s",1,french,fr-en,"Housing close to public transport and restaurants of the bastille, ideal for leaving is visited the capital, well situated.
ca s"
Bon emplacement. Appartement vaste et lumineux. Beau balcon filant. Il est bien équipé et le propriétaire a la gentillesse de laisser l'usage de son équipement hifi très performant. Mélomanes c'est l'appartement qu'il vous faut.,1,french,fr-en,Good location. Apartment wide and bright. Beautiful balcony spinning. It is well equipped and the owner was kind enough to allow the use of its equipment hi-fi very efficient. Music lovers this is the apartment for you.
Emplacement idéal dans un quartier très vivant et animés. Des hôtes extrêmement arrangeants pour les heures d’entrée et de sortie. Merci pour tout.,1,french,fr-en,Ideal location in a lively and animated. Hosts extremely accommodating to the hours of entry and exit. Thank you for everything.
"Hôtes très accueillants et attentionnés, leur appartement est grand, bien équipé, très agréable à vivre et idéalement placé. Je recommande !",1,french,fr-en,"Hosts very welcoming and helpful, their apartment is large, well equipped, very pleasant to live in and ideally located. I recommend !"
"Appartement très agréable, calme, bien équipé avec notamment un home cinéma. Hôte attentionné. À recommander",1,french,fr-en,"Very nice apartment, quiet, well-equipped with a home cinema. Host attentive. To recommend"
"Un très bel appartement avec tout le confort possible. Entièrement équipé et très calme. Une literie excellente qui permet de passer de très bonnes nuits. 
Messire avait même acheter de quoi faire le petit dej !  Bref, au top.",1,french,fr-en,"A very nice apartment with all the comfort possible. Fully equipped and very quiet. Bedding excellent, which allows you to spend very good nights. 
Messire even had to buy enough to make the breakfast ! In short, at the top."
"Super accueil et super Appart.
Nikel, spacieux, propre et bien placé.",1,french,fr-en,"Excellent host and excellent Apartment.
Nikel, spacious, clean and well placed."
"Super appartement plein sud, au calme dans un quartier très animé.
Jérémie est très à l'écoute de vos besoins.
Adresse à recommander.
Attention si vous êtes plusieurs prenez une clé chacun cela vous évitera les aller retour pour l'ouverture des portes de la résidence.",1,french,fr-en,"Super apartment full south, calm in a very lively area.
Jeremiah is very attentive to your needs.
Address to recommend.
Attention if you are several take a key each that you would go back to the opening of the doors of the residence."
"Cet appartement est idéal pour un séjour à Paris. Propre, spacieux et idéalement situé, proche des transports et bénéficiant de tous types de commerces dans la rue. La literie est confortable, le logement est très calme. Parfait, j’y reviendrai!",1,french,fr-en,"This apartment is ideal for a stay in Paris. Clean, spacious and conveniently located, close to transport links and benefitting from all kinds of shops in the street. The bedding is very comfortable, the accommodation is very quiet. Perfect, I will be back!"
"Logement très bien situé.
Les photos sont tout à fait conformes à la réalité, l'appartement était très propre et très calme  et notre hôte nous a gentiment offert des boissons.
A recommander !",1,french,fr-en,"Housing very well located.
The photos are quite accurate, the apartment was very clean and very quiet and our host has kindly offered drinks.
Has recommend!!!"
"Très chouette appartement, bien situé, excellent séjour.",1,french,fr-en,"Very nice apartment, well located, great stay."
Je recommande cet appartement  tres bon accueil,1,french,fr-en,"I recommend this apartment, very good host"
"L’appartement est vraiment très agréable ,très propre et conforme au descriptif. 
Le seul bémol a été le retard d’une heure et demi pour entrer dans les lieux car Messire faisait le ménage et nos appels sans réponse pendant 15 min devant l’entrée de l’immeuble.
Nous n’avons pas réussi à nous brancher au wifi de l’appartement.",1,french,fr-en,"The apartment is really very nice ,very clean, and in compliance with the description. 
The only downside was the delay of an hour and a half to enter the premises because Messire was the household and our calls unanswered for 15 min in front of the entrance of the building.
We have not been able to connect to the wifi of the apartment."
Nous avons passé un agréable séjour dans l’appartement de Jeremy. L’essentiel pour moi était le calme et c’était très bien ! Les nuits étaient tranquilles ainsi que les journées ce qui n’est pas évident à Paris.  Très propre avec tout le nécessaire pour séjourner et cuisiner. Et l’emplacement est top ! 2 belles chambres bien isolées du salon avec une bonne literie.,1,french,fr-en,We spent a pleasant stay in the apartment of Jeremy. The main thing for me was the quiet and it was very good ! The nights were quiet and the days which is not obvious in Paris. Very clean with everything you need to stay and cook. And the location is top ! 2 beautiful rooms well isolated from the living area with a good bedding.
"Pour notre première expérience avec Airbnb, nous avons été enchantés de notre séjour dans l'appartement de Jeremy. Très bien situé dans le quartier de la Bastille, extrêmement calme, parfaitement propre, il laisse deviner la personnalité d'un hôte éclectique et cultivé,  grand mélomane, grand lecteur et grand voyageur.",1,french,fr-en,"For our first experience with Airbnb, we were delighted with our stay in the apartment of Jeremy. Very well located in the Bastille area, extremely quiet, perfectly clean, it hints at the personality of a host of eclectic and grown, a great lover, a great reader and a great traveller."
Conforme a la description. La butte au cailles est un des quartiers les plus sympa de Paris:),1,french,fr-en,Conform to the description. The mound quail is one of the city's most pleasant of Paris:)
"Let others in the Airbnb community know about yourappear on the listing page.
Premiere fois a Paris et sans hesitation je referai la meme chose !!!!
Tout était au delà de ce que je pouvais imaginer , tout était vraiment tres bien , le quartier , l' appartement  et surtout Jean François qui nous a aider tout au long du séjour .",1,french,fr-en,"Let others in the Airbnb community know about yourappear on the listing page.
First time to Paris and without hesitation I do it again the same thing !!!!
Everything was beyond what I could imagine , everything was really very good , the neighborhood , the apartment and especially Jean-François who gave us help throughout the stay ."
"J'ai eu grand plaisir à occuper l'appartement de Jean-François. Tout beau-tout neuf, très bien équipé, lumineux, agréable, calme, donnant sur une cour et situé au coeur si vivant du quartier Montorgueil si vivant. Accueil et organisation furent parfaits. Bon moment calme.
",1,french,fr-en,"I had great pleasure in occupying the apartment of Jean-François. All beautiful-brand new, very well equipped, bright, pleasant, quiet, overlooking a courtyard and located in the heart if living in the Montorgueil district, if living. Hospitality and organization were perfect. Good moment of calm.
"
"Il faudrait 6 étoiles pour décrire cet appartement charmant, décoré avec style et sobriété, bien équipé et bien situé au coeur du quartier Montorgueil et ses innombrables restos, boutiques, à proximité de tous les métros. C'est la deuxième fois que je loue un appartement de Jean-François et il est toujours discret, accueillant, gentil et accommodant. ",1,french,fr-en,"There should be 6 stars to describe this charming apartment, decorated with style and sobriety, well equipped and well located in the heart of the Montorgueil district and its countless restaurants, shops, close to all subways. This is the second time that I rent an apartment of Jean-François and he is always discreet, friendly, nice and accomodating. "
"Tout s´est bien passé pendant notre journée. L´appartement, c´est tres bon dans un quartier fantastique!",1,french,fr-en,Everything has gone well during our day. The apartment is very good in a wonderful district!
"L'appartement de Jean François est tellement impeccable que l'on pourrait avoir peur qu'il y manque un peu de chaleur....J'ai quand même réservé sans me laisser dissuader par cet apriori d'autant que le concept aibnb se veut être des plus amical, avec l'utilisation des prenoms de chacun et autre sympathiques mesures, je propose moi même de très jolies locations ... la chaleur humaine fait pour moi la différence avec beaucoup d'hotel. 
Jean François n 'était malheureusement pas là pour m’accueillir,  la clef était dans une boite codé, l'appartement impeccable comme prévu, propice au travail, ça tombe bien j'étais là pour affaire et n'aurait pas eu le temps de chercher un autre logement...C'est pourtant malheureusement ce qui m'est arrivé lorsque mon travail m a forcé a rester un jour et une nuit de plus et que l’impeccable rigidité de Jean François à pousser a ne pas m'accordé pour une question de ménage ignorant ma proposition de ne rien déplacer et de ne rien salir.",1,french,fr-en,"The apartment of Jean-François is so flawless that one might be afraid that it lacks a bit of heat....I still booked without letting myself be deterred by this apriori as the concept aibnb wants to be more friendly, with the use of the first names of each, and other sympathetic measures, I propose myself of very nice rentals ... the human warmth makes for me the difference with a lot of hotel. 
Jean François was unfortunately not there to greet me, the key was in a box coded, the apartment impeccable, as expected, conducive to work, it's just as well I was there for business and would not have had the time to look for another place to live...yet It is unfortunately what happened to me when my work m was forced to stay a day and a night, and the impeccable stiffness of Jean-François to push not to me granted for a question of the household ignoring my proposal does nothing to move and nothing to mess with."
"Ce fut un séjour Magnifique, l'appartement de Jean-François est   comme sur les photos. Propre et spacieux dans un beau quartier. Je recommandé.",1,french,fr-en,"This was a great stay, the apartment of Jean-François is like on the pictures. Clean and spacious in a beautiful area. I recommended."
"Le logement de Jean-François correspondait exactement à sa description et aux photos. Il est moderne, lumineux et calme bien que situé en plein cœur d'un quartier très animé. Tous les commerces sont à deux pas sans parler des restaurants. La station de métro Sentier sur la ligne 3 est juste devant l'immeuble, très pratique pour se déplacer.
La communication a été très bonne et les réponses toujours rapides de la part de Jean-François même si nous ne nous sommes pas rencontrés pendant le séjour. Je reviendrai avec plaisir das cet appartement lors d'un prochain séjour à Paris. Je ne saurais que le recommander sans hésitation.",1,french,fr-en,"The housing of Jean-François corresponded exactly to his description and photos. It is modern, bright and quiet although located in the heart of a very lively neighborhood. All the shops are two steps away not to mention restaurants. The metro station is Sentier on line 3, is just in front of the building, very convenient to move.
The communication was very good and the answers always fast to the hand of Jean-François even if we have not met during the stay. I'll come back with pleasure das this apartment on a future stay in Paris. I would recommend it without hesitation."
"Très bonne communication avec Jean-François qui a tout fait pour faciliter notre arrivée. L'appartement est beau, calme, très propre, fonctionnel et très bien situé. Nous avons passé un séjour très agréable. C'est une adresse à conserver et à recommander.",1,french,fr-en,"Very good communication with Jean-François who has done everything to facilitate our arrival. The apartment is beautiful, quiet, very clean, functional and very well located. We spent a very pleasant stay. It is an address to keep and recommend."
"Appartement idéalement situé. Plein centre du quartier montorgueil mais au calme. Appartement très bien équipé, très agréable à vivre et ensoleillé . Les photos correspondent, il n'y a pas de surprise. 
",1,french,fr-en,"Apartment ideally located. The centre of the montorgueil district, but quiet. Apartment very well equipped, very pleasant and sunny . The photos correspond, there is no surprise. 
"
"Très bon séjour, excellente localisation et appartement tel que présenté.",1,french,fr-en,"Very good stay, excellent location and apartment as presented."
bel emplacement pour cet appartement spacieux et tres bien agencé. emplacement et explications au top. merci,1,french,fr-en,nice location for this apartment is spacious and very well arranged. location and explanation at the top. thank you
Qualité prix et emplacement parfait,1,french,fr-en,Quality price and perfect location
"Logement très bien placé, fonctionnel, pratique et arrangé avec beaucoup de goût.
Jean François est très réactif et attentif à votre bien être.",1,french,fr-en,"Housing very well placed, functional, practical, and arranged with much taste.
Jean Francois is very responsive and attentive to your well being."
"Appartement très chaleureux, calme et idéalement situé pour visiter Paris. Amalia a toujours été disponible quand nous avions besoin d'un renseignement ou service quelconque
 ",1,french,fr-en,"Apartment very warm, quiet and ideally located to visit Paris. Amalia has always been available when we needed information or service of some kind
"
"Que dire... Frigo sale et puant, placards innommables, pas de rideaux aux fenêtres donc réveillés par la lumière du jour le matin et par le lampadaire dans la cour qui s'allumait à chaque passage. 
Pratiquement tous les tiroirs et placards étaient verrouillés donc à 4 nous avons du laisser nos affaires dans les valises.
Et l'appartement est beaucoup trop petit pour 4 personnes. A deux c'est supportable (attention, ne pas mesurer plus d'1m75 sous peine de ne pas pouvoir tenir debout dans la douche).
Ah oui, pas de télé ni radio ni réveil, rien, donc prévoir de bons bouquins.
",1,french,fr-en,"What can I say... Fridge dirty and smelly, cupboards unspeakable, no curtains on the window so woken up by the light of the day in the morning and by the lamppost in the yard that was lit at each passage. 
Virtually all the drawers and cupboards were locked, so at 4 we had to leave our stuff in the suitcases.
And the apartment is much too small for 4 people. Has two it is bearable (be careful not to measure more than 1m75, under penalty of not being able to stand up in the shower).
Ah yes, no tv, no radio or clock, nothing, so plan to good books.
"
"Très joli appartement, emplacement magique ! 
Tout le confort necessaire, internet fonctionne parfaitement. 
Amalia est très sympa, même à distance...
",1,french,fr-en,"Very nice apartment, location is magical ! 
All the comfort necessary, the internet works perfectly. 
Amalia is very nice, even at a distance...
"
