comments,N,lang,en-en,comments
Pierre is a wonderful host. He was very helpful and accomodating. We felt right at home and had a wonderful stay. Highly recommended.,1,english,en-en,Pierre is a wonderful host. He was very helpful and accomodating. We felt right at home and had a wonderful stay. Highly recommended.
The flat was very nice.,1,english,en-en,The flat was very nice.
"Very welcoming, very helpful host",1,english,en-en,"Very welcoming, very helpful host"
Awesome home,1,english,en-en,Awesome home
Joelle is really nice person! she was very kindness with me. Flat on 5 floor so view is wonderfull. you can stay and enjoy visiting.,1,english,en-en,Joelle is really nice person! she was very kindness with me. Flat on 5 floor so view is wonderfull. you can stay and enjoy visiting.
She was very kind and welcoming.,1,english,en-en,She was very kind and welcoming.
Stéphane was wonderful and welcoming.,1,english,en-en,Stéphane was wonderful and welcoming.
Great location. Host was very helpful.,1,english,en-en,Great location. Host was very helpful.
"well located, very helpful host. ",1,english,en-en,"well located, very helpful host. "
very well :),1,english,en-en,very well :)
Great host. Had a wonderful stay.,1,english,en-en,Great host. Had a wonderful stay.
Othmane was very kind and generous. He helped make our stay very comfortable.,1,english,en-en,Othmane was very kind and generous. He helped make our stay very comfortable.
Host was very gracious & helpful.,1,english,en-en,Host was very gracious & helpful.
"Emily was warm, helpful, and very accommodating. Highly recommended.",1,english,en-en,"Emily was warm, helpful, and very accommodating. Highly recommended."
Kikko is very nice. It was warm welcome.,1,english,en-en,Kikko is very nice. It was warm welcome.
Sandrine was very helpful. The place was nice.,1,english,en-en,Sandrine was very helpful. The place was nice.
Wonderful host!,2,english,en-en,Wonderful host!
"It was wonderful place in paris
So, if you want travel around montmartre brice’s loft is right place
",1,english,en-en,"It was wonderful place in paris
So, if you want travel around montmartre brice’s loft is right place
"
Thank you Jerome all was perfekt.,1,english,en-en,Thank you Jerome all was perfekt.
Stay in a nice house was a wonderful trip in Paris.,1,english,en-en,Stay in a nice house was a wonderful trip in Paris.
Lovely flat in wonderful area. Quentin was a very helpful host too! Thanks,1,english,en-en,Lovely flat in wonderful area. Quentin was a very helpful host too! Thanks
awesome stay,1,english,en-en,awesome stay
"Valentine was very nice, helpful and made me feel at home.",1,english,en-en,"Valentine was very nice, helpful and made me feel at home."
"She is very friendly, enjoyed our stay there.",1,english,en-en,"She is very friendly, enjoyed our stay there."
Zakaria was a great host. He was very helpful and a nice guy.,1,english,en-en,Zakaria was a great host. He was very helpful and a nice guy.
Our group of 6 had a wonderful 2-night stay!,1,english,en-en,Our group of 6 had a wonderful 2-night stay!
"Quiet from street noise - very convenient- metro, a couple minute walk",1,english,en-en,"Quiet from street noise - very convenient- metro, a couple minute walk"
Flat very well located but very noisy neighboords every night :(,1,english,en-en,Flat very well located but very noisy neighboords every night :(
"Isabelle was an amazing host, showing me hospitality from day one. An enjoyable stay in Paris!",1,english,en-en,"Isabelle was an amazing host, showing me hospitality from day one. An enjoyable stay in Paris!"
The landlord is very nice.,1,english,en-en,The landlord is very nice.
very good.,3,english,en-en,very good.
Sabrina was a wonderful host. The room is beautiful.,1,english,en-en,Sabrina was a wonderful host. The room is beautiful.
The stay was ok Bit die Tour people a little vor to small,1,english,en-en,The stay was ok Bit die Tour people a little vor to small
Not very inspiring but was ok.,1,english,en-en,Not very inspiring but was ok.
"very kind, wonderful view, good location, safety, everything was good!",1,english,en-en,"very kind, wonderful view, good location, safety, everything was good!"
very nice stay at Maggie's place,1,english,en-en,very nice stay at Maggie's place
Great host... She is a wonderful host.,1,english,en-en,Great host... She is a wonderful host.
wonderful host. Fantastic place. Huge thank you Jay,1,english,en-en,wonderful host. Fantastic place. Huge thank you Jay
"Very nice stay, lovely flat in an amazing neighbourhood. Felix was very helpful. ",1,english,en-en,"Very nice stay, lovely flat in an amazing neighbourhood. Felix was very helpful. "
very nice  very  good,1,english,en-en,very nice  very  good
Elo made us very welcome had someone meet us all was good.,1,english,en-en,Elo made us very welcome had someone meet us all was good.
We had a wonderful weekend. Thank you!,1,english,en-en,We had a wonderful weekend. Thank you!
Very very nice.,2,english,en-en,Very very nice.
Erik was a great host. He welcomed my wife and sister very well and our stay was great. Thank you!,1,english,en-en,Erik was a great host. He welcomed my wife and sister very well and our stay was great. Thank you!
very very good!,1,english,en-en,very very good!
Host was very nice and accommodating. 5 minute walk from metro.,1,english,en-en,Host was very nice and accommodating. 5 minute walk from metro.
Jonathan was an excellence host. He is very understanding and helpful.,1,english,en-en,Jonathan was an excellence host. He is very understanding and helpful.
Our host was very welcoming and made us feel at home.,1,english,en-en,Our host was very welcoming and made us feel at home.
We did not get to meet Gaëlle but she was extremely helpful.,1,english,en-en,We did not get to meet Gaëlle but she was extremely helpful.
"Isabelle is a very good host, kind and warm.",1,english,en-en,"Isabelle is a very good host, kind and warm."
"He was very kind. So, I feel comfortable.",1,english,en-en,"He was very kind. So, I feel comfortable."
Great light flat. Wonderful view.,1,english,en-en,Great light flat. Wonderful view.
You would meet very kind host,1,english,en-en,You would meet very kind host
it's very nice!,1,english,en-en,it's very nice!
Thank you for letting us stay in your wonderful home !,1,english,en-en,Thank you for letting us stay in your wonderful home !
Sara was very accommodating and helpful in,1,english,en-en,Sara was very accommodating and helpful in
Wonderful time in Paris! Sl!M's place was very hospitable!!,1,english,en-en,Wonderful time in Paris! Sl!M's place was very hospitable!!
Karine was wonderful and helped us feel right at home!,1,english,en-en,Karine was wonderful and helped us feel right at home!
"I really enjoyed my stay at Laure's apartment. Her family is very friendly and very willing to assist. The apartment was as advertised and very conveniently situated. I would visit again.

Ek het regtig my verblyf by Laure se woonstel geniet. Haar gesin was baie vriendelik en behulpsaam. Die woonstel was soos op die adverstensie en baie gerieflik geleë. Ek sal weer 'n besoek aflê. ",1,english,en-en,"I really enjoyed my stay at Laure's apartment. Her family is very friendly and very willing to assist. The apartment was as advertised and very conveniently situated. I would visit again.

Ek het regtig my verblyf by Laure se woonstel geniet. Haar gesin was baie vriendelik en behulpsaam. Die woonstel was soos op die adverstensie en baie gerieflik geleë. Ek sal weer 'n besoek aflê. "
She is very kindly,1,english,en-en,She is very kindly
Julien was very easy to make arrangements with!,1,english,en-en,Julien was very easy to make arrangements with!
Quite ok.,1,english,en-en,Quite ok.
"Lan was great. made me feel very welcome.
",1,english,en-en,"Lan was great. made me feel very welcome.
"
"Eric is very nice, everything was very good. We had a very good time. ",1,english,en-en,"Eric is very nice, everything was very good. We had a very good time. "
We enjoyed our stay at Clovis' apartment. The neighborhood was wonderful.,1,english,en-en,We enjoyed our stay at Clovis' apartment. The neighborhood was wonderful.
you should be quiet,1,english,en-en,you should be quiet
Host was polite and very helpful.,1,english,en-en,Host was polite and very helpful.
Great spot! Wonderful view!,1,english,en-en,Great spot! Wonderful view!
"Amazing ,  view worth booking. First time in Paris was a memorable one. ",1,english,en-en,"Amazing ,  view worth booking. First time in Paris was a memorable one. "
She was very kind and Nice. We stayed very well.,1,english,en-en,She was very kind and Nice. We stayed very well.
It's a very nice home.,1,english,en-en,It's a very nice home.
Xavier made us feel at home.,1,english,en-en,Xavier made us feel at home.
We really enjoyed this loft. Small but very nice. Benjamin was very helpful throughout our stay,1,english,en-en,We really enjoyed this loft. Small but very nice. Benjamin was very helpful throughout our stay
"She was very helpful before, during and after our stay!",1,english,en-en,"She was very helpful before, during and after our stay!"
Wonderful Stay.,1,english,en-en,Wonderful Stay.
Had a great weekend,1,english,en-en,Had a great weekend
"Everything was wonderful! 
Had a loveley stay",1,english,en-en,"Everything was wonderful! 
Had a loveley stay"
"Greta is very nice, discret and helpful.",1,english,en-en,"Greta is very nice, discret and helpful."
Marine made me feel at home and was very flexible to accomodate me.,1,english,en-en,Marine made me feel at home and was very flexible to accomodate me.
Good and genuine.,1,english,en-en,Good and genuine.
Great host. Thank you Fin,1,english,en-en,Great host. Thank you Fin
had a wonderful stay,1,english,en-en,had a wonderful stay
"verygood!
房东很贴心,好评",1,english,en-en,"verygood!
房东很贴心,好评"
We had wonderful week in Paris.,1,english,en-en,We had wonderful week in Paris.
"Alessandro, Luca's room mate was very welcoming. ",1,english,en-en,"Alessandro, Luca's room mate was very welcoming. "
Everything was good. Rob is very helpful.,1,english,en-en,Everything was good. Rob is very helpful.
Stephanie was very kind and friendly,1,english,en-en,Stephanie was very kind and friendly
A wonderfully cosy haven :-),1,english,en-en,A wonderfully cosy haven :-)
"Thanks, Daniel.",1,english,en-en,"Thanks, Daniel."
very good place.,2,english,en-en,very good place.
Sophies is very nice,1,english,en-en,Sophies is very nice
Our host Natalie was so welcoming! We had a wonderful stay whilst in Paris,1,english,en-en,Our host Natalie was so welcoming! We had a wonderful stay whilst in Paris
She is very kind and helpful.,1,english,en-en,She is very kind and helpful.
We had a great stay at Manuels'. His Cousin was very friendly and helpful.,1,english,en-en,We had a great stay at Manuels'. His Cousin was very friendly and helpful.
"very sweet house,I like It",1,english,en-en,"very sweet house,I like It"
"Wonderful host , enjoyed our stay immensely.",1,english,en-en,"Wonderful host , enjoyed our stay immensely."
Taleb was a very good host,1,english,en-en,Taleb was a very good host
"Everthing was wonderful 
Tranks ",1,english,en-en,"Everthing was wonderful 
Tranks "
Landlord is very friendly and helpful.,1,english,en-en,Landlord is very friendly and helpful.
Good home,1,english,en-en,Good home
"Christophe, met me outside and helped with my luggage. He was very friendly
 ",1,english,en-en,"Christophe, met me outside and helped with my luggage. He was very friendly
 "
"Wonderful stay. Christophe is a fantastic host. 100% would recommend. He was so helpful, kind, generous, accommodating, and funny.",1,english,en-en,"Wonderful stay. Christophe is a fantastic host. 100% would recommend. He was so helpful, kind, generous, accommodating, and funny."
"She was very nice and quick answer.
쌰워쉴이넘흐쬽아효인횽샹쟈같은거빼묜죵말죠훈숙쇼임늬댜",1,english,en-en,"She was very nice and quick answer.
쌰워쉴이넘흐쬽아효인횽샹쟈같은거빼묜죵말죠훈숙쇼임늬댜"
"Great place, one wonderful week in Paris!",1,english,en-en,"Great place, one wonderful week in Paris!"
Great spot and Charles was very helpful.,1,english,en-en,Great spot and Charles was very helpful.
Everything you could want. Jimmy was also very helpful,1,english,en-en,Everything you could want. Jimmy was also very helpful
Denis was awesome. Só helpfull.,1,english,en-en,Denis was awesome. Só helpfull.
"Friendly host, made our stay in Paris very helpful!",1,english,en-en,"Friendly host, made our stay in Paris very helpful!"
"Our stay was wonderful and Jamila is a great host, ",1,english,en-en,"Our stay was wonderful and Jamila is a great host, "
Patricia was very kind and she make us feel very welkom.,1,english,en-en,Patricia was very kind and she make us feel very welkom.
"Nice guy, very helpful",1,english,en-en,"Nice guy, very helpful"
lola is very kind~~~ also house is very cool!!,1,english,en-en,lola is very kind~~~ also house is very cool!!
Eveything was great...we love Aurelie she is very kind and we felt like in our house....thanks a lot!,1,english,en-en,Eveything was great...we love Aurelie she is very kind and we felt like in our house....thanks a lot!
Little messy house,1,english,en-en,Little messy house
Wonderful stay. Thank you!,1,english,en-en,Wonderful stay. Thank you!
It was a cozy home and we had a wonderful weekend :),1,english,en-en,It was a cozy home and we had a wonderful weekend :)
It is a good house.,1,english,en-en,It is a good house.
Great view. Wonderful hospitality,1,english,en-en,Great view. Wonderful hospitality
Christine was very helpful with emails,1,english,en-en,Christine was very helpful with emails
"Great host, wonderful room. Enjoyed.",1,english,en-en,"Great host, wonderful room. Enjoyed."
She was very helpful,1,english,en-en,She was very helpful
"The room view is very nice,it's very nice host. thank you martine.",1,english,en-en,"The room view is very nice,it's very nice host. thank you martine."
Everything was very good.,2,english,en-en,Everything was very good.
"very nice """"home"""" in Paris...",1,english,en-en,"very nice """"home"""" in Paris..."
It was all very good.,2,english,en-en,It was all very good.
I had a wonderful time in Dali's apt. He was helpful and hospitable.,1,english,en-en,I had a wonderful time in Dali's apt. He was helpful and hospitable.
Very helpful hosts,1,english,en-en,Very helpful hosts
Great walkup with an awesome view,1,english,en-en,Great walkup with an awesome view
"Sylviane is  great host,  she made me feel very welcome",1,english,en-en,"Sylviane is  great host,  she made me feel very welcome"
"fantastic,she was very helpful,and nicely",1,english,en-en,"fantastic,she was very helpful,and nicely"
It's very wonderful trip in Paris.,1,english,en-en,It's very wonderful trip in Paris.
"I have a very nice stay, Nathalie is a wonderful host!",1,english,en-en,"I have a very nice stay, Nathalie is a wonderful host!"
Our stay in Paris was very comfortable. Thank you.,1,english,en-en,Our stay in Paris was very comfortable. Thank you.
He is super friendly and staying was low key and easy,1,english,en-en,He is super friendly and staying was low key and easy
We felt very much at home.,1,english,en-en,We felt very much at home.
View was very good .,1,english,en-en,View was very good .
It was very nice as usual,1,english,en-en,It was very nice as usual
He is very kind and helpful.Thank you Raphael ;),1,english,en-en,He is very kind and helpful.Thank you Raphael ;)
Raphael is a very good host :),1,english,en-en,Raphael is a very good host :)
Everything is wonderful! Raphael is very nice.,1,english,en-en,Everything is wonderful! Raphael is very nice.
Lea was a very helpful host,1,english,en-en,Lea was a very helpful host
Janvier was very helpful n made me feel like home,1,english,en-en,Janvier was very helpful n made me feel like home
"Cool place in Paris, kitchen was very nice to have.",1,english,en-en,"Cool place in Paris, kitchen was very nice to have."
Gabrielle is very accommodating and kind. She make you feel at home and is very relaxed.,1,english,en-en,Gabrielle is very accommodating and kind. She make you feel at home and is very relaxed.
So cute! Julien was very helpful.,1,english,en-en,So cute! Julien was very helpful.
"Wonderful place to stay, it was nice to feel """"at home"""".",1,english,en-en,"Wonderful place to stay, it was nice to feel """"at home""""."
Was very good,1,english,en-en,Was very good
"It was a good hostel.
However, it is too high.
",1,english,en-en,"It was a good hostel.
However, it is too high.
"
Franc wonderful host!:))),1,english,en-en,Franc wonderful host!:)))
Frank's place was wonderful! Merci encore.,1,english,en-en,Frank's place was wonderful! Merci encore.
Good but very small,1,english,en-en,Good but very small
It was very nice.,4,english,en-en,It was very nice.
A wonderful warm greeting from Mia,1,english,en-en,A wonderful warm greeting from Mia
Everything was ok. Julien is very nice host.,1,english,en-en,Everything was ok. Julien is very nice host.
very nice room!we enjoy it.,1,english,en-en,very nice room!we enjoy it.
Sylvain is very host! All was great!,1,english,en-en,Sylvain is very host! All was great!
Cool house.,1,english,en-en,Cool house.
very good overall.,1,english,en-en,very good overall.
Wonderful in every way!,1,english,en-en,Wonderful in every way!
Olivier was very flexible!,1,english,en-en,Olivier was very flexible!
We had a wonderful stay at Mona's place. Mona is very nice and helpful.,1,english,en-en,We had a wonderful stay at Mona's place. Mona is very nice and helpful.
We had a wonderful time.  Thank You,1,english,en-en,We had a wonderful time.  Thank You
"Good stay, what you see is what you get",1,english,en-en,"Good stay, what you see is what you get"
Louise is a wonderful host and she helped make our stay in Paris memorable,1,english,en-en,Louise is a wonderful host and she helped make our stay in Paris memorable
"very clean.
happy house.",1,english,en-en,"very clean.
happy house."
Alexis is very nice man. And he make me feel at home,1,english,en-en,Alexis is very nice man. And he make me feel at home
Marie is very helpful,1,english,en-en,Marie is very helpful
Sylvie is a very nice and attentive host. My stay was very enjoyable. Thanks,1,english,en-en,Sylvie is a very nice and attentive host. My stay was very enjoyable. Thanks
Wonderful. Felt like home but in Paris,1,english,en-en,Wonderful. Felt like home but in Paris
"She was very warmly host.
",1,english,en-en,"She was very warmly host.
"
"Eric was a very responsive, helpful host. Thank you Eric.",1,english,en-en,"Eric was a very responsive, helpful host. Thank you Eric."
Lucie was very helpful and hospitable. Her flat is very clean and lovely.,1,english,en-en,Lucie was very helpful and hospitable. Her flat is very clean and lovely.
We enjoyed meeting Hombeline and staying in her loft. She was a very nice and helpful host. Recommended.,1,english,en-en,We enjoyed meeting Hombeline and staying in her loft. She was a very nice and helpful host. Recommended.
Feel like home,1,english,en-en,Feel like home
hello mr j-noel this house is very very good .i like so much ､thanks you ❤️,1,english,en-en,hello mr j-noel this house is very very good .i like so much ､thanks you ❤️
"Thank you so much and your friend Pierre .. he's very kindly and was very helpful ... 
My stay was wonderful in your flat


Oh ",1,english,en-en,"Thank you so much and your friend Pierre .. he's very kindly and was very helpful ... 
My stay was wonderful in your flat


Oh "
"Wonderful home, well located.",1,english,en-en,"Wonderful home, well located."
Stephan was very helpful in responding to my queries quickly.  I enjoyed my stay.,1,english,en-en,Stephan was very helpful in responding to my queries quickly.  I enjoyed my stay.
Everything was very well - just like last time.,1,english,en-en,Everything was very well - just like last time.
Very sweet woman who does her very best to make you feel welcome.,1,english,en-en,Very sweet woman who does her very best to make you feel welcome.
good house,3,english,en-en,good house
Wonderful flat and Jean Leon was helpful and friendly.,1,english,en-en,Wonderful flat and Jean Leon was helpful and friendly.
I was (again) very happy to stay with Anne. Please see my earlier rating.,1,english,en-en,I was (again) very happy to stay with Anne. Please see my earlier rating.
Magda was very sweet and attentive. The view is like a dream.,1,english,en-en,Magda was very sweet and attentive. The view is like a dream.
At home room,1,english,en-en,At home room
It was very good.,2,english,en-en,It was very good.
"Vincent is very kind. His rental home was very clean and nice. 
Thank you!",1,english,en-en,"Vincent is very kind. His rental home was very clean and nice. 
Thank you!"
Lovely view!,1,english,en-en,Lovely view!
"Christian was a great host, he made our arrival very smooth!
Hope we can stay again some day.",1,english,en-en,"Christian was a great host, he made our arrival very smooth!
Hope we can stay again some day."
"Room was good, Eric is a nice host. ",1,english,en-en,"Room was good, Eric is a nice host. "
Keyi was very friendly. Comfortable room. Lovely dog,1,english,en-en,Keyi was very friendly. Comfortable room. Lovely dog
"I want to visit again here!!
so kind host!",1,english,en-en,"I want to visit again here!!
so kind host!"
Wonderful place. Stay here!,1,english,en-en,Wonderful place. Stay here!
"Wonderful neighbourhood, good shopping.",1,english,en-en,"Wonderful neighbourhood, good shopping."
Claude was very welcoming.,1,english,en-en,Claude was very welcoming.
It was as good as it can get. Paul is very responsive.,1,english,en-en,It was as good as it can get. Paul is very responsive.
Easy to get to,1,english,en-en,Easy to get to
Place is very nice. Would book again.,1,english,en-en,Place is very nice. Would book again.
The neighborhood was excellent.  The host was very helpful.  I enjoyed my stay in Paris.,1,english,en-en,The neighborhood was excellent.  The host was very helpful.  I enjoyed my stay in Paris.
Arthur was a great host. He was very gentle and helpful.,1,english,en-en,Arthur was a great host. He was very gentle and helpful.
" Veronique is a wonderful landlord, kind and easy going. I felt like at home at Veronique’s flat. ",1,english,en-en," Veronique is a wonderful landlord, kind and easy going. I felt like at home at Veronique’s flat. "
very good~,1,english,en-en,very good~
Super week end :),1,english,en-en,Super week end :)
Benjamins flat was in a very beautiful area we had a lot of fun and enjoyned our stay in Paris :),1,english,en-en,Benjamins flat was in a very beautiful area we had a lot of fun and enjoyned our stay in Paris :)
wonderful view~,1,english,en-en,wonderful view~
It was a wonderful stay. We can recommend Eves home.,1,english,en-en,It was a wonderful stay. We can recommend Eves home.
Lovely little flat! Vu was very responsive.,1,english,en-en,Lovely little flat! Vu was very responsive.
"great flat, wonderful neighbourhood! all was good",1,english,en-en,"great flat, wonderful neighbourhood! all was good"
Very big house,1,english,en-en,Very big house
Great neighbourhood. Good value.,1,english,en-en,Great neighbourhood. Good value.
"Martial is a great host, very helpful",1,english,en-en,"Martial is a great host, very helpful"
Had a great visit! Kevin's home had a great view - he was very accommodating to our travel schedule.,1,english,en-en,Had a great visit! Kevin's home had a great view - he was very accommodating to our travel schedule.
Did not meet host.,1,english,en-en,Did not meet host.
Sweet,1,english,en-en,Sweet
Stephanie is a great host,1,english,en-en,Stephanie is a great host
Host was very accommodating,1,english,en-en,Host was very accommodating
Everything was .  I'm very satisfied.,1,english,en-en,Everything was .  I'm very satisfied.
"It's very nice room,very sweet home ",1,english,en-en,"It's very nice room,very sweet home "
"Dear Sophie.
You were very kindful and my family send to you thanks. Your apartment was good to ours. We have good memories about you and your house.

From  Moon",1,english,en-en,"Dear Sophie.
You were very kindful and my family send to you thanks. Your apartment was good to ours. We have good memories about you and your house.

From  Moon"
Sandy was very accommodating !,1,english,en-en,Sandy was very accommodating !
"what a wonderful home & wonderful people. We so enjoyed our stay. Laredj is so helpful, knowledgeable, and kind.",1,english,en-en,"what a wonderful home & wonderful people. We so enjoyed our stay. Laredj is so helpful, knowledgeable, and kind."
Very nice cosy flat. Estelle is very friendly.,1,english,en-en,Very nice cosy flat. Estelle is very friendly.
quiet neighbourhood and makes you feel home.,1,english,en-en,quiet neighbourhood and makes you feel home.
Excellent! Loved staying. Coralie was very helpful and nice.,1,english,en-en,Excellent! Loved staying. Coralie was very helpful and nice.
Helpful host however neighbours could get noisy,1,english,en-en,Helpful host however neighbours could get noisy
"Great area, great view, good host. ",1,english,en-en,"Great area, great view, good host. "
"Everything was fine.
Thank you",1,english,en-en,"Everything was fine.
Thank you"
We have wonderful days in paris. Thank you,1,english,en-en,We have wonderful days in paris. Thank you
Very very helpfull and friendly Host...thank you,1,english,en-en,Very very helpfull and friendly Host...thank you
