comments,N,lang,en-en,comments
"패트릭과 집은 완벽해요.
파리여행에 로망이 있었는데 완벽하게 충족시켜준 아파트였습니다.
파리에서 숙소를 세번 옮겼고 가장 좋은 집이였어요. 그 전 숙소에 문제가 있었는데 패트릭이 배려해주어서 잘 지내다가 체크인 할 수 있었습니다. 
우선 집은 정말 호텔급이에요. 침실 거실 화장실 모두 깨끗하고 주방사용이나 불편한 점이 거의 없었답니다.
위치도 좋았구요. 저희는 전철보다 버스를 이용했는데 가까이에 많은 정류장들이 있어서 어디든지 갈 수 있었습니다. 
파리는 약간 추웠지만 덕분에 잘 쉬었습니다.

두명이면 딱 좋게 지낼수 있고 3,4 명까지도 문제 없어 보이네요. 가격만 조금싸다면 다시 가고싶은 숙소에요 ㅎㅎㅎ

잘 지내요 패트릭!",1,bulgarian-iso8859_5,ko-en,"Patrick and the house is perfect for that.
In Paris the romance was perfectly caters to the standards of the apartment.
In Paris stay three times and transferred to the best home. Its stay, problem was Patrick this to in well..... check-in was able to. 
First home is really a property. Bedroom, living room, bathroom all clean and free use of the kitchen or the inconvenience, there was little response.
The location is excellent. We train than the bus was close to many stops there are from wherever you can go. 
Paris is a little cold, but thanks to the well rested.

Two you good Able and 3,4 persons is also a problem. Price but a little pricey. again if you want to stay in. ㅎㅎㅎ

Fine Patrick!"
"길 가다가 에펠탑을 볼 수 있으며, 집앞에 맛있는 빵 집이 있습니다. 다만, 샤워시설이 매우 작습니다. 집은 깨끗했으며 샤워용품이 조금 부족합니다. 챙겨가시면 좋을 것 같습니다. 호스트의 답변이 빠른 편이라 이용하기 좋은 숙소입니다.",1,bulgarian-iso8859_5,ko-en,"The way that the Eiffel Tower can be seen, and the house in front of a delicious bread house. However, the shower is very small. The house was very clean and Shower products lack a bit. GILD, if you like. The host answers fast this is a good place to stay."
"위치, 친절도, 청결도 모두 만족입니다. 에펠타워와 가까워서 밤에 다니기에도 둘 이상 다니면 무섭지 않습니다.
방에서 약간의 향신료 향이 나서 환기 시키면서 지냈습니다. 1층이지만 내부 공간이기 때문에 창문 열어놔도 안전합니다. ",1,bulgarian-iso8859_5,ko-en,"Location, friendliness, cleanliness all satisfied. The Eiffel Tower and close at night to even more than the other not scary.
In some of the spice I will start from the We spent. 1 layer, but the inside space is because the window down. "
위치는 진짜 진짜 좋아요! 6호선 8호선 같이 있는 곳이고 정말 역에서 나와서 2-3 분이면 집입니다! 따듯한 물도 잘 나오고 주변에 늦게까지 하는 식당도 많고 (새벽2시까지 하는 맥날도있음) 집근처에 집시나 어두운 골목도 없어요! 슈퍼마켓도 바로 옆에 있고 세탁실도 길건너에 바로 있습니다! 진짜 안전하고 숙소도 깔끔합니다~~,1,bulgarian-iso8859_5,ko-en,The location is really good! 6 line No. 8 subway line as the city and really at the station and 2-3 minutes to the House. Warm water may well come around until late in the restaurants that much (until 2am to Mac day) the house near the house or a dark alley! Also a supermarket right next door and the Laundromat across the street right. Real safe and neat.~~
"도착하기 며칠전에 정확한 주소와 확인할것들을 알려주었습니다.
늦은 체크인에도 친절하게 기다려주셔서 감사했습니다.
숙소근처에 역과 큰 마트가 있고, 에펠탑이 걸어서 15분 거리에 있어 숙소 밖을 나서면 에펠탑이 살짝 보일정도였습니다.
아파트 출입문 보안이 상당히 잘 되어있고, 현관문 잠그고 여는것이 살짝 어려웠으나 적응되니 괜찮았습니다.
전반적으로 사진과 동일한 느낌이나, 샤워기 슈압이 약한것이 흠 입니다.
파리에 다시 가게된다면 또 숙박할 생각있습니다.",1,bulgarian-iso8859_5,ko-en,"Arrive a few days before the exact address and check it to tell them.
Late check-in kindly wait thank.
Stay, near Station and big Mart, the Eiffel Tower is 15 minutes ' walk away the hostel to the Eiffel Tower is slightly visible.
Apartment door security fairly well, the door lock and opening it slightly difficult, but adaptation is good.
Overall pictures and the same feeling, or shower Super-pressure is weak, it is flawless.
In Paris visit or stay you think."
"Чистая и аккуратная квартира, приятная хозяйка.",1,bulgarian-iso8859_5,ru-en,"Clean and neat apartment, nice hostess."
작지만 알찬 숙소였습니다 호스트분도 친절하시고  사진 그대로의 방 풍경이였습니다. 다만 엘레베이터가 없다는게 정말로 힘들긴했습니다. 또한 화장실이 밖에 있다는게 조금 불편했어요 샤워실은 안에 있었지만 집이 조금한만큼 조금하다는점 알고 계시면 좋을 거에요,1,bulgarian-iso8859_5,ko-en,"A small but fruitful stay. the host also very friendly and the way of scenery. Just the Elevator is really difficult. Also the toilet is outside so a little uncomfortable. shower is inside, but the house is a little as much as little to know better."
훌륭한 위치와 도보로 에펠탑과 생젤리제이동 가능합니다.,1,bulgarian-iso8859_5,ko-en,Great location and walk to the Eiffel Tower and Champs Elysées on the move.
"Oanh은 굉장히 친절한 호스트입니다! 
실제로 보지는 못했지만 숙소를 이용함에 있어 불편함이 없도록 세심하게 신경 써 주었어요. 
숙소도 굉장히 깔끔하고요 호스트가 게스트의 편의를 많이 생각한게 보였습니다. (수건이며, 간단한 물, 차 종류등을 구비하고 있습니다)
위치 자체도 역과 굉장히 가까워서 지하철을 이용하는데 아주 좋았습니다. 
또 큰 마트가 도보로 2-3분 거리에 위치하고 있기 때문에 식료품을 사는 데도 전혀 문제가 없어요
걱정했던 것과 달리 따뜻한 물도 잘 나왔구요, 숙소 자체가 안락한 느낌이 가득합니다. 밤에 방에서 구경하는 에펠탑도 아주 멋집니다.
둘이서 일주일 동안 아주 편하게 지냈습니다",1,bulgarian-iso8859_5,ko-en,"Oanh is a very friendly host! 
Actually did not see but a nice place to stay in discomfort, so that the care. 
The hostel is also very clean and the host of a lot of convenience think. (Towel and simple water, tea types, etc....)
The location itself is also very close to the subway, which was very good. 
Or large Mart is a 2-3 minutes because you have to buy groceries having no problems.
Worry that was unlike the warm water came out nicely, and the hostel itself is comfortable and full of feeling. Room at night from the Eiffel Tower is also very nice.
Second time in a week very comfortably spent."
Прекрасно,1,bulgarian-iso8859_5,ru-en,Well
"Это супер аутентичная квартира, 5 мин от эйфелевой башни! 10 из 10",1,bulgarian-iso8859_5,ru-en,"It's super authentic apartment, 5 min from the Eiffel tower! 10 out of 10"
"2개월 장기 투숙이었는데 매주 깔끔하게 청소해주시고 새로운 시트, 수건 가져다주셨어요. 가끔 집으로 초대해주셔서 같이 시간도 보낼 수 있었고 그런 세심한 배려가 감동이었습니다. 위치도 좋은게 주위에 지하철 역이 3개가 있고 버스 정류장도 코앞에 있어서 어디든 쉽게 갈 수 있고 주변에 몽쥬약국도 있어서 한국분들 많이 찾아 오시더라구요. 주위에 없는 편의시설은 거의 없고 치안도 좋습니다. 오래된 건물이라고는 하는데 생각보다 훨씬 깔끔하고 낙후된 느낌은 없어요. 다만 벽간소음이 좀 있는데 사실 한국만큼의 시설을 기대하는건 무리가 있어서 ,, 개인적으로 딱히 큰 문제는 아니었습니다. 다 너무 좋았던 것 같아요 낮에는 파리 지붕들이 펼쳐져 있어서 참 멋졌고 날 좋은 날 밤에는 별이 보일만큼 멋진 뷰를 가진 스튜디오였습니다. 무엇보다도 호스트가 너무 너무 친절하고 좋습니다. 후회 없는 선택이었네요.",1,bulgarian-iso8859_5,ko-en,"2 months long-term stay was very neatly cleaned and new sheets, towels brought. Occasional home invitation at the same time could send and then the attention to detail is impressive. The location is also good, around the Metro Station 3 bus stop code in front of you easily can go around the Mont-pharmacy in a find today. Around with no place to stay, almost no policing. The old building is much cleaner and outdated feeling. Just wall-time noise little the fact that Korea as well as to that bunch, personally, really big problem. Too good seems to be low on Paris roofs unfolds you can see was wonderful and good weather at night the stars look just as cool as the view with Studio. More than anything, the host is so so friendly and nice. No regrets choice."
"우리도착시간이 거의 밤 11시가 넘어가는 시간임에도 별 크게 문제없이 집에 들어갈 수 있어서 좋았음. 다만, 나의 짧은 영어실력으로 집에 들어가는 방법을 바로 이해하지 못했던점. 그러나 3일 여기서 지내면서 프랑스집을 경험할 수 있어서 좋았고, 에펠탑이 그리 멀지 않았던점, 바로 옆에는 마트가 있고, 야시장도 구경할 수 있었다. 
호텔이 아니라는 점을 기억한다면, 이 집에서 프랑스식 집을 경험해 보는 것도 그리 나쁘지 않은 것 같다. 
마루가 오래되어서 삐꺽거리고 천정에 전등이 없고 일부 전등이 나가서 밤에는 어둡다고 느낄수도 있을 것 같다. 하지만 난 이 집을 긍정적으로 평가한다.",1,bulgarian-iso8859_5,ko-en,"Our arrival time is almost 11 at night is beyond time for them largely without problems into the House. However, I'm short of word as entering the house that way just did not understand the point. But 3 days here in France to collect the experience was nice, and the Eiffel Tower not too far away was the store, right next to the Mart, night market, you can. 
The hotel is well remember that, in this house the French house experience is so bad that it is not the same. 
The flooring is old and the creaks and ceiling lights and some lights go out in the night in the dark and feel you would like. But I this House me a positive rating."
Прекрасная французская квартира,1,bulgarian-iso8859_5,ru-en,Beautiful French apartment
집이 쪼콤 짝당 그것빼고는 대체적으로 훌륭하다.,1,bulgarian-iso8859_5,ko-en,The house is a squat sweet even Per it's generally great.
"집 위치는 파리의 중심인 퐁피두센터를 걸어서 10분이내로 갈수 있어서 좋았습니다. 물론 집도 겨울이라 추울까 걱정했는데 따듯하게 잘 지냈습니다. 근처에 수퍼도 가깝고 지하절 역도 가까워서 좋았습니다. 지역에 중국식당이 있고 조그만 중국 수퍼도 있습니다. 집은 작고 아담하고 저희 4명 어머니,아내 , 저 그리고 아들(6세)가 머물기에는 조금 작은 듯 하지만 그런데도 만족스럽습니다. 단지 집앞에 보행도로라 처음에는 당황스러웠습니다. 그리고 처음에 인터넷이 잘 안되어서 불편했지만 곧 수리해 주어서 잘 사용하고 왔습니다. 그리고 마지막으로 집안 마루 바닥이 소리가 심해서 밤에 화장실 가는 것이 신경 쓰입니다....저희 어머니는 엘리베이터가 없어서 불편했지지만 젊은 사람들이 다니기에는 불편하지 않을 듯 합니다. 주변 환경도 밤 늦게 까지 활기찬 분위기라 위험하지 않습니다.",1,bulgarian-iso8859_5,ko-en,"The House location of Paris, Centre Georges Pompidou Center within 10 minutes walk of ... more Of course the house even in the winter this is cold up I was worried as well. Near super close and underground control station so don't. Local Chinese restaurant, but a Chinese Super. The house is small and Adam and our 4 People, mother,wife , and son(6 years old)to stay a little small but nevertheless satisfactory. Just the house in front of the pedestrian roads, at first confused. And for the first time on the Internet as well massage parlours, but soon repaired to good use. And finally the House floorboards the sound is deep in the night on the toilet with that mind.....My mother have no lift was inconvenient, but young people in that uncomfortable not to. The environment around even late at night up the vibrant atmosphere as not dangerous."
밤 늦게도 주택가라서인지 돌아다녔던 곳들 중에 가장 안전하다고 느꼈던 곳에 있었다. 주변에 빵집 큰마트도 있거 지하철역에도 걸어서 금방 도착할 수 있었다. 아 엘레베이터가 없었지만 2층이라서 괜찮았다,1,bulgarian-iso8859_5,ko-en,"Late at night residential in the back was where most of the safe and felt the place was in. Around bakery large site or area on the walk from the arrival. No Elevator was not there, but the 2 layers I was fine."
우선 1번 도어 번호키 누르고 두번째 키박스 열 때 힘껏 잡아 당겨야 해요. 비밀번호 누르고 옆에 누르면서 잡아당기는게 너무 힘들었어요~ 그래도 호스트가 채팅수준으로 메시지 해주고 전화도 바로 연결되서 좋았습니다. 청결하고 마트 가는 길에 보이는 에펠탑이 예술이에요~,1,bulgarian-iso8859_5,ko-en,Priority number 1 Door Number key press and the second key to the box when you open the hard pull. Password click Next click the pull was a little too hard~ so the host chat level with the message and the phone was good. Clean and Mart on the way to see the Eiffel Tower in the art.~
"여행을 하면서 다른 나라에서 온 게스트, 현지인과 숙소를 공유하는 것은 매우 흥미롭고 가치있는 일이었다. 그렇지만 개인실 문에는 잠금장치가 필요해 보인다. 다정한 우리의 호스트는 숙소를 감각적이고 편리하게 구성해 두었으며 항상 청결하게 유지했다. 특히 엘레베이터가 있기 때문에 짐이 많은 게스트에게는 더할나위 없이 훌륭하다. 숙소는 루브르와 가까운 번화한 곳에 위치하여 안전했고, 파리에서 즐길거리를 도보로 이용할 수 있다. 우리가 짧게 머물렀던것이 가장 아쉬운 부분이고, 파리에 다시 여행하고 싶게 만드는 멋진숙소이다.",1,bulgarian-iso8859_5,ko-en,"While travelling from different countries the guest, locals and the perfect place to share is very interesting and valuable. But the private room door on the lock necessary. For our host home to the sensual and easily configured for two was always kept clean. Especially the Elevator because there is a burden many guest in around a great. Place the Louvre and close to the bustling location was safe and, Paris or walking. We briefly stayed it the most beautiful part, in Paris to travel back to want to create a wonderful stay."
Все понравилось. Париж прекрасен.,1,bulgarian-iso8859_5,ru-en,I liked everything. Paris is lovely.
아주 친절하게 대해줬고 편하게 숙소를 이용할 수 있도록 해주었습니다. 여행하는데에 있어 많은 도움을 주었고 아침마다 나오는 빵은 아침마다 기분을 좋게 해주었습니다.,1,bulgarian-iso8859_5,ko-en,Very kind to me and convenient place to use. Travel a lot helped and the morning I bake it every morning to feel better.
호스트분이 역까지 데려다 주셔서 고마웠습니다.,1,bulgarian-iso8859_5,ko-en,Host station to thank it was very helpful.
"2세 아기와 함께한 여행이어서 무엇보다 숙소의 위치가 중요했어요. 에펠탑과 샹제리제 거리가 다 가까이에 (걸어서 20~30분이면 닿을 거리) 있었고, 지하철역도 8호선 13호선 Invalides역이 걸어서 5분 거리에 있어서 정말 좋았어요. 제가 에어비앤비가 처음이라 다른 숙소와 비교는 못하겠지만, 아파트도 저희 가족은 정말 만족했답니다. 거실에 침대도 쉽게 접히고 펴졌구요. (거실침대 쿠션감은 좋지 않았어요.) 가장 맘에 들었던 부분은 주방입니다. 요리하고 바로 먹기에 편하고 예쁜 주방이에요. 저흰 아기가 감기로 아파서 외출을 많이 못했기에 집에서 밥 해먹을 일이 아주 많아서 참 이용을 잘했어요. 세탁기도 잘 사용했구요. 체크인시 호스트를 만날 줄 알았는데 체크인 방법이 상세히 적힌 메일만 받았어요. 체크아웃시에도 메일로만 받았구요. 호스트를 만나지 못해 아쉬웠지만 체크인시 어려움은 없었답니다.
가족간 여행에 특히 좋을거 같은 숙소입니다. 집에서 요리를 많이 하지 않는다면 좀 아까울 거 같아요.
호텔은 매일매일 청소해주니 반짝반짝 깨끗하지만, 이 아파트는 아파트니 당연히 스스로 청소하고 빨래도 해야해서 그런 부분은 불편할 수 있을거 같아요. 수건도 큰거 2장만 지급됩니다. 전 작은 수건 3장 가져갔는데 아주 잘 썼어요.
넘 좋았던 숙소였어요. 호스트 길리아 님께 감사합니다. 후기를 보는 다른 분들도 잘 선택하시고 좋은 여행 하시기 바랍니다.^^",1,bulgarian-iso8859_5,ko-en,"2 years old baby with here in the What than the location of the hostel was important. The Eiffel Tower and Champs Elysees Street is in close proximity (within 20 to 30 minutes within a distance), area of 8 line No. 13 Line No. Invalides station is a 5 minute walk from it was really good. I Airbnb for the first time in a different place and compare that, but not the apartment, so our family was really pleased with the response. In the living room beds easy fold and unfold. (Living room bed cushion texture was not good.) The most liked was the kitchen. Cooking and eating in and pretty kitchen. We baby cold sick in addition to did a lot more at home in the Bob hammock there are so many things from this well. Washing machine to good use. Check the host to meet I thought check Way detailed written mail only. Check out in the mail but received. Host only or not but check the difficulty was no answer.
Family travel is particularly good as is the accommodation. Cooking at home doesn't do much if you get well.
The hotel has daily cleaning is very shiny clean, but the apartment is naturally cleaning and washing should also be in such a part can be uncomfortable to remove. A towel also large or 2 only will be paid. Ago small towel 3 took it very well written.
Over a good stay. Host the way our Lord with thanks. After watching other people well-chosen and good travel.^^"
센강 접근이 쉬웠어요. 교통 요지입니다,1,bulgarian-iso8859_5,ko-en,Center Health Access was easy. Transport.
숙소는 깨끗했고 아주 안전한 곳에 위치해있어요.,1,bulgarian-iso8859_5,ko-en,The accommodations were clean and very safe place to be.
все отлично,1,bulgarian-iso8859_5,ru-en,everything is fine
가격을 고려한다면 최상의 위치와 컨디션입니다.,1,bulgarian-iso8859_5,ko-en,Is the best location and condition.
에펠탑 근처 숙소로 걸어 올수도 있었다.,1,bulgarian-iso8859_5,ko-en,The Eiffel Tower near the hostel and walked up.
"нас встретил друг Жана , Фредерик . все рассказал и показал ,квартира  отличная светлая ) все понравилось )))) ",1,bulgarian-iso8859_5,ru-en,"we met a friend of Jean , Frederick . all told and shown the apartment great light ) I liked everything )))) "
올라가는게 좀 힘들지만 가성비 최고입니다.,1,bulgarian-iso8859_5,ko-en,"Climb a bit tough, but the best."
"겨울에 방문해서 숙소가 추울까봐 걱정했는데, 난방기가 두 개나 있고 화장실도 난방이 되어 전혀 문제 없었어요. 수압도 세고 온수도 펑펑 나와요. 주변에 각종 가게들도 많고 아이들이 많은 안전해보이는 동네예요.
다른 후기에도 적혀있듯이 원룸이고, 소파배드이며, 1층에 위치한 방이에요. 바깥 도로와 한계단도 차이나지 않는 1층이요. 건물의 출입문과 맞닿아 있는 방이라 사람들이 철문을 여닿는 꽤 크게 들려요. 다행히 한밤중에는 드나드는 사람이 없었는지 조용했구요.
커피포트 등 기본적인 주방기구들이 있어서 간단히 요리도 해먹을 수 있고, 약간의 소스와 비스킷들이 있었지만 저희는 먹지 않았어요. 냉장고랑 전자렌지도 있어요.
체크인과 체크아웃 시간은 앞뒤 손님 일정에 따라 유연하게 조정할 수 있어 좋았어요.",1,bulgarian-iso8859_5,ko-en,"Visiting in winter the cold was worried that my radiators, two and the bathroom heating was no problem. Water pressure and hot water plonk. Around various shops, and many children get a lot of safety to the neighborhood.
After another also written as one-room, sofa, dispenser, located on the 1st floor. Outside of the road and also the car or not 1 layer. Building of the door and bordering room people iron door hammered quite significantly. Fortunately the middle of the night on that or the person is.
Coffee and other basic kitchen utensils you can simply cook a hammock, a little sauce, and biscuits were but we did not eat. Refrigerator restaurant microwave.
Check-in and check-out time is front and back guests according to the schedule flexibility to adjust."
